Saturday 24/2/1894
FA Cup
1894/2/24
Bolton Wanderers 3 : 0 Liverpool DetailsSaturday 27/2/1897
FA Cup
1897/2/27
Liverpool 1 : 1 Nottingham Forest FC DetailsWednesday 03/3/1897
FA Cup
1897/3/3
Nottingham Forest FC 0 : 1 Liverpool Replayed Game
DetailsSaturday 20/3/1897
FA Cup
1897/3/20
Aston Villa 3 : 0 Liverpool Semi Finals
DetailsSaturday 26/2/1898
FA Cup
1898/2/26
Derby County FC 1 : 1 Liverpool DetailsWednesday 02/3/1898
FA Cup
1898/3/2
Liverpool 1 : 5 Derby County FC Replayed Game
DetailsSaturday 25/2/1899
FA Cup
1899/2/25
West Bromwich Albion FC 0 : 2 Liverpool DetailsSaturday 18/3/1899
FA Cup
1899/3/18
Sheffield United FC 2 : 2 Liverpool Semi Finals
DetailsThursday 23/3/1899
FA Cup
1899/3/23
Sheffield United FC 4 : 4 Liverpool Semi Finals
Replayed Game
DetailsThursday 30/3/1899
FA Cup
1899/3/30
Sheffield United FC 1 : 0 Liverpool Semi Finals
Replayed Game
DetailsSaturday 10/3/1906
FA Cup
1906/3/10
Liverpool 3 : 0 FC Southampton DetailsSaturday 31/3/1906
FA Cup
1906/3/31
Everton FC 2 : 0 Liverpool Semi Finals
DetailsSaturday 09/3/1907
FA Cup
1907/3/9
Sheffield Wednesday FC 1 : 0 Liverpool DetailsSaturday 07/3/1914
FA Cup
1914/3/7
Liverpool 2 : 1 Queens Park Rangers DetailsSaturday 28/3/1914
FA Cup
1914/3/28
Liverpool 2 : 0 Aston Villa Semi Finals
DetailsSaturday 25/4/1914
FA Cup
1914/4/25
Burnley FC 1 : 0 Liverpool Finals
DetailsSaturday 06/3/1920
FA Cup
1920/3/6
Huddersfield Town 2 : 1 Liverpool DetailsThursday 05/10/1922
FA Community Shield
1922/10/5
Huddersfield Town 1 : 0 Liverpool DetailsSaturday 08/3/1924
FA Cup
1924/3/8
Newcastle United FC 1 : 0 Liverpool DetailsSaturday 07/3/1925
FA Cup
1925/3/7
FC Southampton 1 : 0 Liverpool DetailsSaturday 27/2/1932
FA Cup
1932/2/27
Liverpool 0 : 2 Chelsea DetailsSaturday 01/3/1947
FA Cup
1947/3/1
Liverpool 4 : 1 Birmingham City FC DetailsSaturday 29/3/1947
FA Cup
1947/3/29
Burnley FC 0 : 0 Liverpool Semi Finals
After extra time
DetailsSaturday 12/4/1947
FA Cup
1947/4/12
Liverpool 0 : 1 Burnley FC Semi Finals
Replayed Game
DetailsSaturday 04/3/1950
FA Cup
1950/3/4
Blackpool FC 1 : 2 Liverpool DetailsSaturday 25/3/1950
FA Cup
1950/3/25
Everton FC 0 : 2 Liverpool Semi Finals
DetailsSaturday 29/4/1950
FA Cup
1950/4/29
Liverpool 0 : 2 Arsenal FC Finals
DetailsSaturday 01/3/1958
FA Cup
1958/3/1
Blackburn Rovers FC 2 : 1 Liverpool DetailsSaturday 30/3/1963
FA Cup
1963/3/30
Liverpool 1 : 0 West Ham United DetailsSaturday 27/4/1963
FA Cup
1963/4/27
Leicester City 1 : 0 Liverpool Semi Finals
DetailsSaturday 29/2/1964
FA Cup
1964/2/29
Liverpool 1 : 2 Swansea City DetailsSaturday 15/8/1964
FA Community Shield
1964/8/15
Liverpool 2 : 2 West Ham United DetailsMonday 17/8/1964
UEFA Champions League
1964/8/17
KR Reykjavik - Iceland 0 : 5 Liverpool - England DetailsMonday 14/9/1964
UEFA Champions League
1964/9/14
Liverpool - England 6 : 1 KR Reykjavik - Iceland DetailsWednesday 25/11/1964
UEFA Champions League
1964/11/25
Liverpool - England 3 : 0 RSC Anderlecht - Belgium 1st Round
DetailsWednesday 16/12/1964
UEFA Champions League
1964/12/16
RSC Anderlecht - Belgium 0 : 1 Liverpool - England 1st Round
DetailsWednesday 10/2/1965
UEFA Champions League
1965/2/10
1. FC Koln - Germany 0 : 0 Liverpool - England Quarter finals
DetailsSaturday 06/3/1965
FA Cup
1965/3/6
Leicester City 0 : 0 Liverpool DetailsWednesday 10/3/1965
FA Cup
1965/3/10
Liverpool 1 : 0 Leicester City Replayed Game
DetailsWednesday 17/3/1965
UEFA Champions League
1965/3/17
Liverpool - England 0 : 0 1. FC Koln - Germany Quarter finals
DetailsWednesday 24/3/1965
UEFA Champions League
1965/3/24
Liverpool - England 2 : 2 1. FC Koln - Germany Quarter finals
DetailsSaturday 27/3/1965
FA Cup
1965/3/27
Liverpool 2 : 0 Chelsea Semi Finals
DetailsSaturday 01/5/1965
FA Cup
1965/5/1
Liverpool 2 : 1 Leeds United FC Finals
After extra time
DetailsTuesday 04/5/1965
UEFA Champions League
1965/5/4
Liverpool - England 3 : 1 Internazionale Milano - Italy Semi finals
DetailsWednesday 12/5/1965
UEFA Champions League
1965/5/12
Internazionale Milano - Italy 3 : 0 Liverpool - England Semi finals
DetailsSaturday 14/8/1965
FA Community Shield
1965/8/14
Manchester United 2 : 2 Liverpool DetailsWednesday 29/9/1965
European Cup Winners Cup
1965/9/29
Juventus FC - Italy 1 : 0 Liverpool - England DetailsWednesday 13/10/1965
European Cup Winners Cup
1965/10/13
Liverpool - England 2 : 0 Juventus FC - Italy DetailsWednesday 24/11/1965
European Cup Winners Cup
1965/11/24
Liverpool - England 3 : 1 Standard de Liege - Belgium Second round
DetailsWednesday 01/12/1965
European Cup Winners Cup
1965/12/1
Standard de Liege - Belgium 1 : 2 Liverpool - England Second round
DetailsTuesday 01/3/1966
European Cup Winners Cup
1966/3/1
Liverpool - England 2 : 0 K. Budapest Honved - Hungary Quarterfinals
DetailsTuesday 08/3/1966
European Cup Winners Cup
1966/3/8
K. Budapest Honved - Hungary 0 : 0 Liverpool - England Quarterfinals
DetailsThursday 14/4/1966
European Cup Winners Cup
1966/4/14
Celtic Glasgow - Scotland 1 : 0 Liverpool - England Semifinals
DetailsTuesday 19/4/1966
European Cup Winners Cup
1966/4/19
Liverpool - England 2 : 0 Celtic Glasgow - Scotland Semifinals
DetailsThursday 05/5/1966
European Cup Winners Cup
1966/5/5
Borussia Dortmund - Germany 2 : 1 Liverpool - England Final
After extra time
DetailsSaturday 13/8/1966
FA Community Shield
1966/8/13
Liverpool 1 : 0 Everton FC DetailsWednesday 28/9/1966
UEFA Champions League
1966/9/28
Liverpool - England 2 : 0 FC Petrolul Ploiesti - Romania 1st Round
DetailsWednesday 12/10/1966
UEFA Champions League
1966/10/12
FC Petrolul Ploiesti - Romania 3 : 1 Liverpool - England 1st Round
DetailsWednesday 19/10/1966
UEFA Champions League
1966/10/19
Liverpool - England 2 : 0 FC Petrolul Ploiesti - Romania 1st Round
DetailsWednesday 07/12/1966
UEFA Champions League
1966/12/7
Ajax Amsterdam - Netherlands 5 : 1 Liverpool - England 2nd Round
DetailsWednesday 14/12/1966
UEFA Champions League
1966/12/14
Liverpool - England 2 : 2 Ajax Amsterdam - Netherlands 2nd Round
DetailsSaturday 30/3/1968
FA Cup
1968/3/30
West Bromwich Albion FC 0 : 0 Liverpool DetailsMonday 08/4/1968
FA Cup
1968/4/8
Liverpool 1 : 1 West Bromwich Albion FC Replayed Game
DetailsThursday 18/4/1968
FA Cup
1968/4/18
West Bromwich Albion FC 2 : 1 Liverpool Replayed Game
DetailsSaturday 21/2/1970
FA Cup
1970/2/21
Watford 1 : 0 Liverpool DetailsSaturday 06/3/1971
FA Cup
1971/3/6
Liverpool 0 : 0 Tottenham Hotspur DetailsTuesday 16/3/1971
FA Cup
1971/3/16
Tottenham Hotspur 0 : 1 Liverpool Replayed Game
DetailsSaturday 27/3/1971
FA Cup
1971/3/27
Liverpool 2 : 1 Everton FC Semi Finals
DetailsWednesday 14/4/1971
European Cup of Exhibitions - Football
1971/4/14
Liverpool - England 0 : 1 Leeds United FC - England Semi Final
DetailsWednesday 28/4/1971
European Cup of Exhibitions - Football
1971/4/28
Leeds United FC - England 0 : 0 Liverpool - England Semi Final
DetailsSaturday 08/5/1971
FA Cup
1971/5/8
Liverpool 1 : 2 Arsenal FC Finals
DetailsSaturday 07/8/1971
FA Community Shield
1971/8/7
Leicester City 1 : 0 Liverpool DetailsWednesday 15/9/1971
European Cup Winners Cup
1971/9/15
Servette FC - Switzerland 2 : 1 Liverpool - England First Round
DetailsWednesday 29/9/1971
European Cup Winners Cup
1971/9/29
Liverpool - England 2 : 0 Servette FC - Switzerland First Round
DetailsWednesday 20/10/1971
European Cup Winners Cup
1971/10/20
Liverpool - England 0 : 0 FC Bayern Munich - Germany Second Round
DetailsWednesday 03/11/1971
European Cup Winners Cup
1971/11/3
FC Bayern Munich - Germany 3 : 1 Liverpool - England Second Round
DetailsTuesday 12/9/1972
UEFA Cup
1972/9/12
Liverpool - England 2 : 0 Eintracht Frankfurt - Germany DetailsTuesday 26/9/1972
UEFA Cup
1972/9/26
Eintracht Frankfurt - Germany 0 : 0 Liverpool - England DetailsTuesday 24/10/1972
UEFA Cup
1972/10/24
Liverpool - England 3 : 0 AEK Athens - Greece 2nd Round
DetailsTuesday 07/11/1972
UEFA Cup
1972/11/7
AEK Athens - Greece 1 : 3 Liverpool - England 2nd Round
DetailsWednesday 29/11/1972
UEFA Cup
1972/11/29
Dynamo Berlin - Germany 0 : 0 Liverpool - England 3rd Round
DetailsMonday 04/12/1972
English League Cup
1972/12/4
Liverpool 1 : 1 Tottenham Hotspur DetailsWednesday 06/12/1972
English League Cup
1972/12/6
Tottenham Hotspur 3 : 1 Liverpool Replayed Game
DetailsWednesday 13/12/1972
UEFA Cup
1972/12/13
Liverpool - England 3 : 1 Dynamo Berlin - Germany 3rd Round
DetailsWednesday 07/3/1973
UEFA Cup
1973/3/7
Liverpool - England 2 : 0 SG Dynamo Dresden - Germany Quarterfinals
DetailsWednesday 21/3/1973
UEFA Cup
1973/3/21
SG Dynamo Dresden - Germany 0 : 1 Liverpool - England Quarterfinals
DetailsTuesday 10/4/1973
UEFA Cup
1973/4/10
Liverpool - England 1 : 0 Tottenham Hotspur - England Semifinals
DetailsWednesday 25/4/1973
UEFA Cup
1973/4/25
Tottenham Hotspur - England 2 : 1 Liverpool - England Semifinals
DetailsThursday 10/5/1973
UEFA Cup
1973/5/10
Liverpool - England 3 : 0 Borussia Monchengladbach - Germany Final
DetailsWednesday 23/5/1973
UEFA Cup
1973/5/23
Borussia Monchengladbach - Germany 2 : 0 Liverpool - England Final
DetailsWednesday 19/9/1973
UEFA Champions League
1973/9/19
Jeunesse Esch - Luxembourg 1 : 1 Liverpool - England DetailsWednesday 03/10/1973
UEFA Champions League
1973/10/3
Liverpool - England 2 : 0 Jeunesse Esch - Luxembourg DetailsWednesday 24/10/1973
UEFA Champions League
1973/10/24
Crvena Zvezda - Serbia 2 : 1 Liverpool - England Round 2
DetailsTuesday 06/11/1973
UEFA Champions League
1973/11/6
Liverpool - England 1 : 2 Crvena Zvezda - Serbia Round 2
DetailsWednesday 19/12/1973
English League Cup
1973/12/19
Wolverhampton Wanderers FC 1 : 0 Liverpool DetailsSaturday 09/3/1974
FA Cup
1974/3/9
Bristol City FC 0 : 1 Liverpool DetailsSaturday 30/3/1974
FA Cup
1974/3/30
Liverpool 0 : 0 Leicester City Semi Finals
DetailsWednesday 03/4/1974
FA Cup
1974/4/3
Leicester City 1 : 3 Liverpool Semi Finals
Replayed Game
DetailsSaturday 04/5/1974
FA Cup
1974/5/4
Liverpool 3 : 0 Newcastle United FC Finals
DetailsSaturday 10/8/1974
FA Community Shield
1974/8/10
Leeds United FC 1 : 1
5 : 6
Liverpool Penalty Kicks
DetailsWednesday 18/9/1974
European Cup Winners Cup
1974/9/18
Liverpool - England 11 : 0 Strømsgodset - Norway DetailsWednesday 02/10/1974
European Cup Winners Cup
1974/10/2
Strømsgodset - Norway 0 : 1 Liverpool - England DetailsWednesday 23/10/1974
European Cup Winners Cup
1974/10/23
Liverpool - England 1 : 1 Ferencvarosi TC - Hungary Second round
DetailsWednesday 06/11/1974
European Cup Winners Cup
1974/11/6
Ferencvarosi TC - Hungary 0 : 0 Liverpool - England Second round
DetailsWednesday 17/9/1975
UEFA Cup
1975/9/17
Hibernian FC - Scotland 0 : 1 Liverpool - England DetailsTuesday 30/9/1975
UEFA Cup
1975/9/30
Liverpool - England 3 : 1 Hibernian FC - Scotland DetailsWednesday 22/10/1975
UEFA Cup
1975/10/22
Real Sociedad - Spain 1 : 3 Liverpool - England 2nd Round
DetailsTuesday 04/11/1975
UEFA Cup
1975/11/4
Liverpool - England 6 : 0 Real Sociedad - Spain 2nd Round
DetailsWednesday 26/11/1975
UEFA Cup
1975/11/26
WKS Slask Wroclaw - Poland 1 : 2 Liverpool - England 3rd Round
DetailsWednesday 10/12/1975
UEFA Cup
1975/12/10
Liverpool - England 3 : 0 WKS Slask Wroclaw - Poland 3rd Round
DetailsWednesday 03/3/1976
UEFA Cup
1976/3/3
SG Dynamo Dresden - Germany 0 : 0 Liverpool - England Quarterfinals
DetailsWednesday 17/3/1976
UEFA Cup
1976/3/17
Liverpool - England 2 : 1 SG Dynamo Dresden - Germany Quarterfinals
DetailsTuesday 30/3/1976
UEFA Cup
1976/3/30
FC Barcelona - Spain 0 : 1 Liverpool - England Semifinals
DetailsWednesday 14/4/1976
UEFA Cup
1976/4/14
Liverpool - England 1 : 1 FC Barcelona - Spain Semifinals
DetailsWednesday 28/4/1976
UEFA Cup
1976/4/28
Liverpool - England 3 : 2 Club Brugge KV - Belgium Final
DetailsWednesday 19/5/1976
UEFA Cup
1976/5/19
Club Brugge KV - Belgium 1 : 1 Liverpool - England Final
DetailsSaturday 14/8/1976
FA Community Shield
1976/8/14
Liverpool 1 : 0 FC Southampton DetailsTuesday 14/9/1976
UEFA Champions League
1976/9/14
Liverpool - England 2 : 0 Crusaders FC - Northern Ireland DetailsTuesday 28/9/1976
UEFA Champions League
1976/9/28
Crusaders FC - Northern Ireland 0 : 5 Liverpool - England DetailsWednesday 20/10/1976
UEFA Champions League
1976/10/20
Trabzonspor - Turkey 1 : 0 Liverpool - England Second round
DetailsWednesday 03/11/1976
UEFA Champions League
1976/11/3
Liverpool - England 3 : 0 Trabzonspor - Turkey Second round
DetailsWednesday 02/3/1977
UEFA Champions League
1977/3/2
Saint Etienne - France 1 : 0 Liverpool - England Quarterfinals
DetailsWednesday 16/3/1977
UEFA Champions League
1977/3/16
Liverpool - England 3 : 1 Saint Etienne - France Quarterfinals
DetailsSaturday 19/3/1977
FA Cup
1977/3/19
Liverpool 2 : 0 Middlesbrough DetailsWednesday 06/4/1977
UEFA Champions League
1977/4/6
FC Zurich - Switzerland 1 : 3 Liverpool - England Semifinals
DetailsWednesday 20/4/1977
UEFA Champions League
1977/4/20
Liverpool - England 3 : 0 FC Zurich - Switzerland Semifinals
DetailsSaturday 23/4/1977
FA Cup
1977/4/23
Liverpool 2 : 2 Everton FC Semi Finals
DetailsWednesday 27/4/1977
FA Cup
1977/4/27
Everton FC 0 : 3 Liverpool Semi Finals
Replayed Game
DetailsSaturday 21/5/1977
FA Cup
1977/5/21
Manchester United 2 : 1 Liverpool Finals
DetailsWednesday 25/5/1977
UEFA Champions League
1977/5/25
Liverpool - England 3 : 1 Borussia Monchengladbach - Germany Final
DetailsSaturday 13/8/1977
FA Community Shield
1977/8/13
Liverpool 0 : 0 Manchester United DetailsWednesday 19/10/1977
UEFA Champions League
1977/10/19
Liverpool - England 5 : 1 SG Dynamo Dresden - Germany Second round
DetailsWednesday 02/11/1977
UEFA Champions League
1977/11/2
SG Dynamo Dresden - Germany 2 : 1 Liverpool - England Second round
DetailsTuesday 22/11/1977
UEFA Super Cup
1977/11/22
Hamburger SV - Germany 1 : 1 Liverpool - England DetailsTuesday 06/12/1977
UEFA Super Cup
1977/12/6
Liverpool - England 6 : 0 Hamburger SV - Germany DetailsTuesday 17/1/1978
English League Cup
1978/1/17
Wrexham FC 1 : 3 Liverpool DetailsTuesday 07/2/1978
English League Cup
1978/2/7
Liverpool 2 : 1 Arsenal FC Semi Finals
DetailsTuesday 14/2/1978
English League Cup
1978/2/14
Arsenal FC 0 : 0 Liverpool Semi Finals
DetailsWednesday 01/3/1978
UEFA Champions League
1978/3/1
SL Benfica - Portugal 1 : 2 Liverpool - England Quarterfinals
DetailsWednesday 15/3/1978
UEFA Champions League
1978/3/15
Liverpool - England 4 : 1 SL Benfica - Portugal Quarterfinals
DetailsSaturday 18/3/1978
English League Cup
1978/3/18
Nottingham Forest FC 0 : 0 Liverpool Final
After extra time
DetailsWednesday 22/3/1978
English League Cup
1978/3/22
Nottingham Forest FC 1 : 0 Liverpool Final
DetailsWednesday 29/3/1978
UEFA Champions League
1978/3/29
Borussia Monchengladbach - Germany 2 : 1 Liverpool - England Semifinals
DetailsWednesday 12/4/1978
UEFA Champions League
1978/4/12
Liverpool - England 3 : 0 Borussia Monchengladbach - Germany Semifinals
DetailsWednesday 10/5/1978
UEFA Champions League
1978/5/10
Liverpool - England 1 : 0 Club Brugge KV - Belgium Final
DetailsWednesday 13/9/1978
UEFA Champions League
1978/9/13
Nottingham Forest FC - England 2 : 0 Liverpool - England First Round
DetailsWednesday 27/9/1978
UEFA Champions League
1978/9/27
Liverpool - England 0 : 0 Nottingham Forest FC - England First Round
DetailsMonday 04/12/1978
UEFA Super Cup
1978/12/4
RSC Anderlecht - Belgium 3 : 1 Liverpool - England DetailsTuesday 19/12/1978
UEFA Super Cup
1978/12/19
Liverpool - England 2 : 1 RSC Anderlecht - Belgium DetailsSaturday 10/3/1979
FA Cup
1979/3/10
Ipswich Town FC 0 : 1 Liverpool DetailsSaturday 31/3/1979
FA Cup
1979/3/31
Manchester United 2 : 2 Liverpool Semi Finals
DetailsWednesday 04/4/1979
FA Cup
1979/4/4
Liverpool 0 : 1 Manchester United Semi Finals
Replayed Game
DetailsSaturday 11/8/1979
FA Community Shield
1979/8/11
Liverpool 3 : 1 Arsenal FC DetailsWednesday 19/9/1979
UEFA Champions League
1979/9/19
Liverpool - England 2 : 1 Dinamo Tiflis - Georgia First Round
DetailsWednesday 03/10/1979
UEFA Champions League
1979/10/3
Dinamo Tiflis - Georgia 3 : 0 Liverpool - England First Round
DetailsWednesday 05/12/1979
English League Cup
1979/12/5
Norwich City 1 : 3 Liverpool DetailsTuesday 22/1/1980
English League Cup
1980/1/22
Nottingham Forest FC 1 : 0 Liverpool Semi Finals
DetailsTuesday 12/2/1980
English League Cup
1980/2/12
Liverpool 1 : 1 Nottingham Forest FC Semi Finals
DetailsSaturday 08/3/1980
FA Cup
1980/3/8
Tottenham Hotspur 0 : 1 Liverpool DetailsSaturday 12/4/1980
FA Cup
1980/4/12
Liverpool 0 : 0 Arsenal FC Semi Finals
After extra time
DetailsWednesday 16/4/1980
FA Cup
1980/4/16
Liverpool 1 : 1 Arsenal FC Semi Finals
Replayed Game
DetailsMonday 28/4/1980
FA Cup
1980/4/28
Liverpool 1 : 1 Arsenal FC Semi Finals
Replayed Game
DetailsThursday 01/5/1980
FA Cup
1980/5/1
Liverpool 0 : 1 Arsenal FC Semi Finals
Replayed Game
DetailsSaturday 09/8/1980
FA Community Shield
1980/8/9
Liverpool 1 : 0 West Ham United DetailsWednesday 17/9/1980
UEFA Champions League
1980/9/17
OPS Oulu - Finland 1 : 1 Liverpool - England First Round
DetailsWednesday 01/10/1980
UEFA Champions League
1980/10/1
Liverpool - England 10 : 1 OPS Oulu - Finland First Round
DetailsWednesday 22/10/1980
UEFA Champions League
1980/10/22
Aberdeen F.C - Scotland 0 : 1 Liverpool - England Second round
DetailsWednesday 05/11/1980
UEFA Champions League
1980/11/5
Liverpool - England 4 : 0 Aberdeen F.C - Scotland Second round
DetailsTuesday 02/12/1980
English League Cup
1980/12/2
Liverpool 3 : 1 Birmingham City FC DetailsWednesday 14/1/1981
English League Cup
1981/1/14
Manchester City 0 : 1 Liverpool Semi Finals
DetailsTuesday 10/2/1981
English League Cup
1981/2/10
Liverpool 1 : 1 Manchester City Semi Finals
DetailsWednesday 04/3/1981
UEFA Champions League
1981/3/4
Liverpool - England 5 : 1 CSKA Sofia - Bulgaria Quarterfinals
DetailsSaturday 14/3/1981
English League Cup
1981/3/14
Liverpool 1 : 1 West Ham United Final
After extra time
DetailsWednesday 18/3/1981
UEFA Champions League
1981/3/18
CSKA Sofia - Bulgaria 0 : 1 Liverpool - England Quarterfinals
DetailsWednesday 01/4/1981
English League Cup
1981/4/1
Liverpool 2 : 1 West Ham United Final
DetailsWednesday 08/4/1981
UEFA Champions League
1981/4/8
Liverpool - England 0 : 0 FC Bayern Munich - Germany Semifinals
DetailsWednesday 22/4/1981
UEFA Champions League
1981/4/22
FC Bayern Munich - Germany 1 : 1 Liverpool - England Semifinals
DetailsWednesday 27/5/1981
UEFA Champions League
1981/5/27
Liverpool - England 1 : 0 Real Madrid CF - Spain Final
DetailsWednesday 16/9/1981
UEFA Champions League
1981/9/16
OPS Oulu - Finland 0 : 1 Liverpool - England First Round
DetailsWednesday 30/9/1981
UEFA Champions League
1981/9/30
Liverpool - England 7 : 0 OPS Oulu - Finland First Round
DetailsWednesday 21/10/1981
UEFA Champions League
1981/10/21
AZ Alkmaar - Netherlands 2 : 2 Liverpool - England Second round
DetailsWednesday 04/11/1981
UEFA Champions League
1981/11/4
Liverpool - England 3 : 2 AZ Alkmaar - Netherlands Second round
DetailsSunday 13/12/1981
Intercontinental Club Cup
1981/12/13
Flamengo - Brazil 3 : 0 Liverpool - England DetailsTuesday 12/1/1982
English League Cup
1982/1/12
Liverpool 0 : 0 Barnsley FC DetailsTuesday 19/1/1982
English League Cup
1982/1/19
Barnsley FC 1 : 3 Liverpool Replayed Game
DetailsTuesday 02/2/1982
English League Cup
1982/2/2
Ipswich Town FC 0 : 2 Liverpool Semi Finals
DetailsTuesday 09/2/1982
English League Cup
1982/2/9
Liverpool 2 : 2 Ipswich Town FC Semi Finals
DetailsWednesday 03/3/1982
UEFA Champions League
1982/3/3
Liverpool - England 1 : 0 CSKA Sofia - Bulgaria Quarterfinals
DetailsSaturday 13/3/1982
English League Cup
1982/3/13
Liverpool 3 : 1 Tottenham Hotspur Final
After extra time
DetailsWednesday 17/3/1982
UEFA Champions League
1982/3/17
CSKA Sofia - Bulgaria 2 : 0 Liverpool - England Quarterfinals
DetailsThursday 12/8/1982
FA Community Shield
1982/8/12
Liverpool 1 : 0 Tottenham Hotspur DetailsWednesday 15/9/1982
UEFA Champions League
1982/9/15
Dundalk FC - Ireland 1 : 4 Liverpool - England First Round
DetailsWednesday 29/9/1982
UEFA Champions League
1982/9/29
Liverpool - England 1 : 0 Dundalk FC - Ireland First Round
DetailsWednesday 20/10/1982
UEFA Champions League
1982/10/20
HJK Helsinki - Finland 1 : 0 Liverpool - England Second round
DetailsWednesday 03/11/1982
UEFA Champions League
1982/11/3
Liverpool - England 5 : 0 HJK Helsinki - Finland Second round
DetailsTuesday 18/1/1983
English League Cup
1983/1/18
Liverpool 2 : 1 West Ham United DetailsTuesday 08/2/1983
English League Cup
1983/2/8
Liverpool 3 : 0 Burnley FC Semi Finals
DetailsTuesday 15/2/1983
English League Cup
1983/2/15
Burnley FC 1 : 0 Liverpool Semi Finals
DetailsWednesday 02/3/1983
UEFA Champions League
1983/3/2
Widzew Lodz - Poland 2 : 0 Liverpool - England Quarterfinals
DetailsWednesday 16/3/1983
UEFA Champions League
1983/3/16
Liverpool - England 3 : 2 Widzew Lodz - Poland Quarterfinals
DetailsSaturday 26/3/1983
English League Cup
1983/3/26
Liverpool 2 : 1 Manchester United Final
After extra time
DetailsSaturday 20/8/1983
FA Community Shield
1983/8/20
Manchester United 2 : 0 Liverpool DetailsWednesday 14/9/1983
UEFA Champions League
1983/9/14
Odense Boldklub - Denmark 0 : 1 Liverpool - England DetailsWednesday 28/9/1983
UEFA Champions League
1983/9/28
Liverpool - England 5 : 0 Odense Boldklub - Denmark DetailsWednesday 19/10/1983
UEFA Champions League
1983/10/19
Liverpool - England 0 : 0 Athletic de Bilbao - Spain Second round
DetailsWednesday 02/11/1983
UEFA Champions League
1983/11/2
Athletic de Bilbao - Spain 0 : 1 Liverpool - England Second round
DetailsTuesday 17/1/1984
English League Cup
1984/1/17
Sheffield Wednesday FC 2 : 2 Liverpool DetailsWednesday 25/1/1984
English League Cup
1984/1/25
Liverpool 3 : 0 Sheffield Wednesday FC Replayed Game
DetailsTuesday 07/2/1984
English League Cup
1984/2/7
Liverpool 2 : 2 Walsall Semi Finals
DetailsTuesday 14/2/1984
English League Cup
1984/2/14
Walsall 0 : 2 Liverpool Semi Finals
DetailsWednesday 07/3/1984
UEFA Champions League
1984/3/7
Liverpool - England 1 : 0 SL Benfica - Portugal Quarterfinals
DetailsWednesday 21/3/1984
UEFA Champions League
1984/3/21
SL Benfica - Portugal 1 : 4 Liverpool - England Quarterfinals
DetailsSunday 25/3/1984
English League Cup
1984/3/25
Liverpool 0 : 0 Everton FC Final
After extra time
DetailsWednesday 28/3/1984
English League Cup
1984/3/28
Liverpool 1 : 0 Everton FC Final
DetailsThursday 05/4/1984
UEFA Champions League
1984/4/5
Dinamo Bucarest - Romania 1 : 2 Liverpool - England Semifinals
DetailsWednesday 11/4/1984
UEFA Champions League
1984/4/11
Liverpool - England 1 : 0 Dinamo Bucarest - Romania Semifinals
DetailsWednesday 30/5/1984
UEFA Champions League
1984/5/30
AS Roma - Italy 1 : 1
2 : 4
Liverpool - England Final
Penalty Kicks
DetailsTuesday 14/8/1984
FA Community Shield
1984/8/14
Everton FC 1 : 0 Liverpool DetailsWednesday 19/9/1984
UEFA Champions League
1984/9/19
KKS Lech Poznan - Poland 0 : 1 Liverpool - England DetailsWednesday 03/10/1984
UEFA Champions League
1984/10/3
Liverpool - England 4 : 0 KKS Lech Poznan - Poland DetailsWednesday 24/10/1984
UEFA Champions League
1984/10/24
Liverpool - England 3 : 1 SL Benfica - Portugal Second round
DetailsWednesday 07/11/1984
UEFA Champions League
1984/11/7
SL Benfica - Portugal 1 : 0 Liverpool - England Second round
DetailsSunday 09/12/1984
Intercontinental Club Cup
1984/12/9
Independiente - Argentina 1 : 0 Liverpool - England DetailsWednesday 16/1/1985
UEFA Super Cup
1985/1/16
Juventus FC - Italy 2 : 0 Liverpool - England DetailsWednesday 06/3/1985
UEFA Champions League
1985/3/6
FK Austria Wien - Austria 1 : 1 Liverpool - England Quarterfinals
DetailsSunday 10/3/1985
FA Cup
1985/3/10
Barnsley FC 0 : 4 Liverpool DetailsWednesday 20/3/1985
UEFA Champions League
1985/3/20
Liverpool - England 4 : 1 FK Austria Wien - Austria Quarterfinals
DetailsWednesday 10/4/1985
UEFA Champions League
1985/4/10
Liverpool - England 4 : 0 Panathinaikos - Greece Semifinals
DetailsSaturday 13/4/1985
FA Cup
1985/4/13
Manchester United 2 : 2 Liverpool Semi Finals
After extra time
DetailsWednesday 17/4/1985
FA Cup
1985/4/17
Liverpool 1 : 2 Manchester United Semi Finals
Replayed Game
DetailsWednesday 24/4/1985
UEFA Champions League
1985/4/24
Panathinaikos - Greece 0 : 1 Liverpool - England Semifinals
DetailsWednesday 29/5/1985
UEFA Champions League
1985/5/29
Juventus FC - Italy 1 : 0 Liverpool - England Final
DetailsTuesday 21/1/1986
English League Cup
1986/1/21
Liverpool 3 : 0 Ipswich Town FC DetailsWednesday 12/2/1986
English League Cup
1986/2/12
Queens Park Rangers 1 : 0 Liverpool Semi Finals
DetailsWednesday 05/3/1986
English League Cup
1986/3/5
Liverpool 2 : 2 Queens Park Rangers Semi Finals
DetailsTuesday 11/3/1986
FA Cup
1986/3/11
Liverpool 0 : 0 Watford DetailsMonday 17/3/1986
FA Cup
1986/3/17
Watford 1 : 2 Liverpool Replayed Game
DetailsSaturday 05/4/1986
FA Cup
1986/4/5
Liverpool 2 : 0 FC Southampton Semi Finals
After extra time
DetailsSaturday 10/5/1986
FA Cup
1986/5/10
Liverpool 3 : 1 Everton FC Finals
DetailsWednesday 06/8/1986
FA Community Shield
1986/8/6
Liverpool 1 : 1 Everton FC DetailsWednesday 21/1/1987
English League Cup
1987/1/21
Everton FC 0 : 1 Liverpool DetailsWednesday 11/2/1987
English League Cup
1987/2/11
FC Southampton 0 : 0 Liverpool Semi Finals
DetailsWednesday 25/2/1987
English League Cup
1987/2/25
Liverpool 3 : 0 FC Southampton Semi Finals
DetailsSunday 05/4/1987
English League Cup
1987/4/5
Arsenal FC 2 : 1 Liverpool Final
DetailsSunday 13/3/1988
FA Cup
1988/3/13
Manchester City 0 : 4 Liverpool DetailsSaturday 09/4/1988
FA Cup
1988/4/9
Liverpool 2 : 1 Nottingham Forest FC Semi Finals
DetailsSaturday 14/5/1988
FA Cup
1988/5/14
Wimbledon FC 1 : 0 Liverpool Finals
DetailsFriday 12/8/1988
Teresa Herrera Trophy
1988/8/12
Atletico de Madrid 5 : 1 Liverpool DetailsSunday 14/8/1988
Teresa Herrera Trophy
1988/8/14
Liverpool 4 : 0 Real Sociedad Thrd Place
DetailsSaturday 20/8/1988
FA Community Shield
1988/8/20
Liverpool 2 : 1 Wimbledon FC DetailsSaturday 18/3/1989
FA Cup
1989/3/18
Liverpool 4 : 0 Brentford DetailsSaturday 15/4/1989
FA Cup
1989/4/15
Liverpool 0 : 0 Nottingham Forest FC Semi Finals
Play suspended
DetailsSunday 07/5/1989
FA Cup
1989/5/7
Liverpool 3 : 1 Nottingham Forest FC Semi Finals
Replayed Game
DetailsSaturday 20/5/1989
FA Cup
1989/5/20
Liverpool 3 : 2 Everton FC Finals
After extra time
DetailsSaturday 12/8/1989
FA Community Shield
1989/8/12
Arsenal FC 0 : 1 Liverpool DetailsSunday 11/3/1990
FA Cup
1990/3/11
Queens Park Rangers 2 : 2 Liverpool DetailsWednesday 14/3/1990
FA Cup
1990/3/14
Liverpool 1 : 0 Queens Park Rangers Replayed Game
DetailsSunday 08/4/1990
FA Cup
1990/4/8
Crystal Palace FC 4 : 3 Liverpool Semi Finals
After extra time
DetailsSaturday 18/8/1990
FA Community Shield
1990/8/18
Liverpool 1 : 1 Manchester United DetailsWednesday 18/9/1991
UEFA Cup
1991/9/18
Liverpool - England 6 : 1 FC Kuusysi - Finland DetailsWednesday 02/10/1991
UEFA Cup
1991/10/2
FC Kuusysi - Finland 1 : 0 Liverpool - England DetailsWednesday 23/10/1991
UEFA Cup
1991/10/23
Auxerre - France 2 : 0 Liverpool - England 2nd Round
DetailsWednesday 06/11/1991
UEFA Cup
1991/11/6
Liverpool - England 3 : 0 Auxerre - France 2nd Round
DetailsWednesday 27/11/1991
UEFA Cup
1991/11/27
FC Wacker Innsbruck - Austria 0 : 2 Liverpool - England 3rd Round
DetailsWednesday 11/12/1991
UEFA Cup
1991/12/11
Liverpool - England 4 : 0 FC Wacker Innsbruck - Austria 3rd Round
DetailsWednesday 04/3/1992
UEFA Cup
1992/3/4
Genoa CFC - Italy 2 : 0 Liverpool - England Quarterfinals
DetailsSaturday 07/3/1992
FA Cup
1992/3/7
Liverpool 1 : 0 Aston Villa DetailsWednesday 18/3/1992
UEFA Cup
1992/3/18
Liverpool - England 1 : 2 Genoa CFC - Italy Quarterfinals
DetailsSunday 05/4/1992
FA Cup
1992/4/5
Liverpool 1 : 1 Portsmouth Semi Finals
After extra time
DetailsMonday 13/4/1992
FA Cup
1992/4/13
Portsmouth 0 : 0
1 : 3
Liverpool Semi Finals
Penalty Kicks
DetailsSaturday 09/5/1992
FA Cup
1992/5/9
Liverpool 2 : 0 AFC Sunderland Finals
DetailsSaturday 08/8/1992
FA Community Shield
1992/8/8
Leeds United FC 4 : 3 Liverpool DetailsSunday 16/8/1992
English Premier League
1992/8/16
Nottingham Forest FC 1 : 0 Liverpool Week # 1
DetailsWednesday 19/8/1992
English Premier League
1992/8/19
Liverpool 2 : 1 Sheffield United FC Week # 2
DetailsSunday 23/8/1992
English Premier League
1992/8/23
Liverpool 0 : 2 Arsenal FC Week # 3
DetailsTuesday 25/8/1992
English Premier League
1992/8/25
Ipswich Town FC 2 : 2 Liverpool Week # 4
DetailsSaturday 29/8/1992
English Premier League
1992/8/29
Leeds United FC 2 : 2 Liverpool Week # 5
DetailsTuesday 01/9/1992
English Premier League
1992/9/1
Liverpool 1 : 1 FC Southampton Week # 6
DetailsSaturday 05/9/1992
English Premier League
1992/9/5
Liverpool 2 : 1 Chelsea Week # 7
DetailsSaturday 12/9/1992
English Premier League
1992/9/12
Sheffield United FC 1 : 0 Liverpool Week # 8
DetailsWednesday 16/9/1992
European Cup Winners Cup
1992/9/16
Liverpool - England 6 : 1 Apollon Limassol - Cyprus First Round
DetailsSaturday 19/9/1992
English Premier League
1992/9/19
Aston Villa 4 : 2 Liverpool Week # 9
DetailsSaturday 26/9/1992
English Premier League
1992/9/26
Liverpool 2 : 3 Wimbledon FC Week # 10
DetailsWednesday 30/9/1992
European Cup Winners Cup
1992/9/30
Apollon Limassol - Cyprus 1 : 2 Liverpool - England First Round
DetailsSaturday 03/10/1992
English Premier League
1992/10/3
Liverpool 1 : 0 Sheffield Wednesday FC Week # 11
DetailsSunday 18/10/1992
English Premier League
1992/10/18
Manchester United 2 : 2 Liverpool Week # 12
DetailsWednesday 21/10/1992
European Cup Winners Cup
1992/10/21
Spartak Moscow - Russia 4 : 2 Liverpool - England Second Round
DetailsSunday 25/10/1992
English Premier League
1992/10/25
Liverpool 4 : 1 Norwich City Week # 13
DetailsSaturday 31/10/1992
English Premier League
1992/10/31
Tottenham Hotspur 2 : 0 Liverpool Week # 14
DetailsSaturday 07/11/1992
English Premier League
1992/11/7
Liverpool 4 : 1 Middlesbrough Week # 15
DetailsSunday 08/11/1992
European Cup Winners Cup
1992/11/8
Liverpool - England 0 : 2 Spartak Moscow - Russia Second Round
DetailsMonday 23/11/1992
English Premier League
1992/11/23
Queens Park Rangers 0 : 1 Liverpool Week # 16
DetailsSaturday 28/11/1992
English Premier League
1992/11/28
Liverpool 5 : 0 Crystal Palace FC Week # 17
DetailsSaturday 05/12/1992
English Premier League
1992/12/5
Everton FC 2 : 1 Liverpool Week # 18
DetailsSunday 13/12/1992
English Premier League
1992/12/13
Liverpool 2 : 1 Blackburn Rovers FC Week # 19
DetailsSaturday 19/12/1992
English Premier League
1992/12/19
Coventry City 5 : 1 Liverpool Week # 20
DetailsMonday 28/12/1992
English Premier League
1992/12/28
Liverpool 1 : 1 Manchester City Week # 22
DetailsSaturday 09/1/1993
English Premier League
1993/1/9
Liverpool 1 : 2 Aston Villa Week # 23
DetailsSaturday 16/1/1993
English Premier League
1993/1/16
Wimbledon FC 2 : 0 Liverpool Week # 24
DetailsSunday 31/1/1993
English Premier League
1993/1/31
Arsenal FC 0 : 1 Liverpool Week # 26
DetailsSaturday 06/2/1993
English Premier League
1993/2/6
Liverpool 0 : 0 Nottingham Forest FC Week # 27
DetailsWednesday 10/2/1993
English Premier League
1993/2/10
Chelsea 0 : 0 Liverpool Week # 28
DetailsSaturday 13/2/1993
English Premier League
1993/2/13
FC Southampton 2 : 1 Liverpool Week # 29
DetailsSaturday 20/2/1993
English Premier League
1993/2/20
Liverpool 0 : 0 Ipswich Town FC Week # 30
DetailsSaturday 27/2/1993
English Premier League
1993/2/27
Sheffield Wednesday FC 1 : 1 Liverpool Week # 31
DetailsSaturday 06/3/1993
English Premier League
1993/3/6
Liverpool 1 : 2 Manchester United Week # 33
DetailsWednesday 10/3/1993
English Premier League
1993/3/10
Liverpool 1 : 0 Queens Park Rangers Week # 32
DetailsSaturday 13/3/1993
English Premier League
1993/3/13
Middlesbrough 1 : 2 Liverpool Week # 34
DetailsSaturday 20/3/1993
English Premier League
1993/3/20
Liverpool 1 : 0 Everton FC Week # 35
DetailsTuesday 23/3/1993
English Premier League
1993/3/23
Crystal Palace FC 1 : 1 Liverpool Week # 36
DetailsSaturday 03/4/1993
English Premier League
1993/4/3
Blackburn Rovers FC 4 : 1 Liverpool Week # 37
DetailsSaturday 10/4/1993
English Premier League
1993/4/10
Liverpool 1 : 0 Oldham Athletic Week # 38
DetailsMonday 12/4/1993
English Premier League
1993/4/12
Manchester City 1 : 1 Liverpool Week # 39
DetailsSaturday 17/4/1993
English Premier League
1993/4/17
Liverpool 4 : 0 Coventry City Week # 40
DetailsWednesday 21/4/1993
English Premier League
1993/4/21
Liverpool 2 : 0 Leeds United FC Week # 25
DetailsSaturday 01/5/1993
English Premier League
1993/5/1
Norwich City 1 : 0 Liverpool Week # 41
DetailsWednesday 05/5/1993
English Premier League
1993/5/5
Oldham Athletic 3 : 2 Liverpool Week # 21
DetailsSaturday 08/5/1993
English Premier League
1993/5/8
Liverpool 6 : 2 Tottenham Hotspur Week # 42
DetailsSaturday 14/8/1993
English Premier League
1993/8/14
Liverpool 2 : 0 Sheffield Wednesday FC Week # 1
DetailsWednesday 18/8/1993
English Premier League
1993/8/18
Queens Park Rangers 1 : 3 Liverpool Week # 2
DetailsSunday 22/8/1993
English Premier League
1993/8/22
Swindon Town FC 0 : 5 Liverpool Week # 3
DetailsWednesday 25/8/1993
English Premier League
1993/8/25
Liverpool 1 : 2 Tottenham Hotspur Week # 4
DetailsSaturday 28/8/1993
English Premier League
1993/8/28
Liverpool 2 : 0 Leeds United FC Week # 5
DetailsWednesday 01/9/1993
English Premier League
1993/9/1
Coventry City 1 : 0 Liverpool Week # 6
DetailsSunday 12/9/1993
English Premier League
1993/9/12
Liverpool 0 : 1 Blackburn Rovers FC Week # 7
DetailsSaturday 18/9/1993
English Premier League
1993/9/18
Everton FC 2 : 0 Liverpool Week # 8
DetailsSaturday 25/9/1993
English Premier League
1993/9/25
Chelsea 1 : 0 Liverpool Week # 9
DetailsSaturday 02/10/1993
English Premier League
1993/10/2
Liverpool 0 : 0 Arsenal FC Week # 10
DetailsSaturday 16/10/1993
English Premier League
1993/10/16
Liverpool 2 : 1 Oldham Athletic Week # 11
DetailsSaturday 23/10/1993
English Premier League
1993/10/23
Manchester City 1 : 1 Liverpool Week # 12
DetailsWednesday 27/10/1993
English League Cup
1993/10/27
Liverpool 3 : 2 Ipswich Town FC DetailsSaturday 30/10/1993
English Premier League
1993/10/30
Liverpool 4 : 2 FC Southampton Week # 13
DetailsSaturday 06/11/1993
English Premier League
1993/11/6
Liverpool 2 : 0 West Ham United Week # 14
DetailsSunday 21/11/1993
English Premier League
1993/11/21
Newcastle United FC 3 : 0 Liverpool Week # 15
DetailsSunday 28/11/1993
English Premier League
1993/11/28
Liverpool 2 : 1 Aston Villa Week # 17
DetailsWednesday 01/12/1993
English League Cup
1993/12/1
Liverpool 1 : 1 Wimbledon FC Round 4
DetailsSaturday 04/12/1993
English Premier League
1993/12/4
Sheffield Wednesday FC 3 : 1 Liverpool Week # 18
DetailsWednesday 08/12/1993
English Premier League
1993/12/8
Liverpool 3 : 2 Queens Park Rangers Week # 23
DetailsSaturday 11/12/1993
English Premier League
1993/12/11
Liverpool 2 : 2 Swindon Town FC Week # 20
DetailsTuesday 14/12/1993
English League Cup
1993/12/14
Wimbledon FC 2 : 2
4 : 3
Liverpool Round 4
Penalty Kicks
DetailsSaturday 18/12/1993
English Premier League
1993/12/18
Tottenham Hotspur 3 : 3 Liverpool Week # 21
DetailsSunday 26/12/1993
English Premier League
1993/12/26
Sheffield United FC 0 : 0 Liverpool DetailsTuesday 28/12/1993
English Premier League
1993/12/28
Liverpool 1 : 1 Wimbledon FC DetailsSaturday 01/1/1994
English Premier League
1994/1/1
Ipswich Town FC 1 : 2 Liverpool Week # 23
DetailsTuesday 04/1/1994
English Premier League
1994/1/4
Liverpool 3 : 3 Manchester United Week # 24
DetailsSaturday 15/1/1994
English Premier League
1994/1/15
Oldham Athletic 0 : 3 Liverpool Week # 25
DetailsSaturday 22/1/1994
English Premier League
1994/1/22
Liverpool 2 : 1 Manchester City Week # 26
DetailsSaturday 05/2/1994
English Premier League
1994/2/5
Norwich City 2 : 2 Liverpool Week # 27
DetailsMonday 14/2/1994
English Premier League
1994/2/14
FC Southampton 4 : 2 Liverpool Week # 28
DetailsSaturday 19/2/1994
English Premier League
1994/2/19
Leeds United FC 2 : 0 Liverpool Week # 28
DetailsSaturday 26/2/1994
English Premier League
1994/2/26
Liverpool 1 : 0 Coventry City Week # 29
DetailsSaturday 05/3/1994
English Premier League
1994/3/5
Blackburn Rovers FC 2 : 0 Liverpool Week # 27
DetailsSunday 13/3/1994
English Premier League
1994/3/13
Liverpool 2 : 1 Everton FC Week # 31
DetailsSaturday 19/3/1994
English Premier League
1994/3/19
Liverpool 2 : 1 Chelsea DetailsSaturday 26/3/1994
English Premier League
1994/3/26
Arsenal FC 1 : 0 Liverpool Week # 34
DetailsWednesday 30/3/1994
English Premier League
1994/3/30
Manchester United 1 : 0 Liverpool Week # 34
DetailsSaturday 02/4/1994
English Premier League
1994/4/2
Liverpool 1 : 2 Sheffield United FC Week # 35
DetailsMonday 04/4/1994
English Premier League
1994/4/4
Wimbledon FC 1 : 1 Liverpool Week # 36
DetailsSaturday 09/4/1994
English Premier League
1994/4/9
Liverpool 1 : 0 Ipswich Town FC Week # 37
DetailsSaturday 16/4/1994
English Premier League
1994/4/16
Liverpool 0 : 2 Newcastle United FC Week # 38
DetailsSaturday 23/4/1994
English Premier League
1994/4/23
West Ham United 1 : 2 Liverpool Week # 39
DetailsSaturday 30/4/1994
English Premier League
1994/4/30
Liverpool 0 : 1 Norwich City Week # 40
DetailsSaturday 07/5/1994
English Premier League
1994/5/7
Aston Villa 2 : 1 Liverpool Week # 42
DetailsSaturday 20/8/1994
English Premier League
1994/8/20
Crystal Palace FC 1 : 6 Liverpool Week # 1
DetailsSunday 28/8/1994
English Premier League
1994/8/28
Liverpool 3 : 0 Arsenal FC Week # 3
DetailsWednesday 31/8/1994
English Premier League
1994/8/31
FC Southampton 0 : 2 Liverpool Week # 4
DetailsSaturday 10/9/1994
English Premier League
1994/9/10
Liverpool 0 : 0 West Ham United Week # 5
DetailsSaturday 17/9/1994
English Premier League
1994/9/17
Manchester United 2 : 0 Liverpool Week # 6
DetailsSaturday 24/9/1994
English Premier League
1994/9/24
Newcastle United FC 1 : 1 Liverpool Week # 7
DetailsSaturday 01/10/1994
English Premier League
1994/10/1
Liverpool 4 : 1 Sheffield Wednesday FC Week # 8
DetailsSaturday 08/10/1994
English Premier League
1994/10/8
Liverpool 3 : 2 Aston Villa Week # 9
DetailsSaturday 15/10/1994
English Premier League
1994/10/15
Blackburn Rovers FC 3 : 2 Liverpool Week # 10
DetailsSaturday 22/10/1994
English Premier League
1994/10/22
Liverpool 3 : 0 Wimbledon FC Week # 11
DetailsTuesday 25/10/1994
English League Cup
1994/10/25
Liverpool 2 : 1 Stoke City FC DetailsSaturday 29/10/1994
English Premier League
1994/10/29
Ipswich Town FC 1 : 3 Liverpool Week # 12
DetailsMonday 31/10/1994
English Premier League
1994/10/31
Queens Park Rangers 2 : 1 Liverpool Week # 15
DetailsSaturday 05/11/1994
English Premier League
1994/11/5
Liverpool 1 : 0 Nottingham Forest FC Week # 13
DetailsWednesday 09/11/1994
English Premier League
1994/11/9
Liverpool 3 : 1 Chelsea Week # 2
DetailsMonday 21/11/1994
English Premier League
1994/11/21
Everton FC 2 : 0 Liverpool Week # 14
DetailsSaturday 26/11/1994
English Premier League
1994/11/26
Liverpool 1 : 1 Tottenham Hotspur Week # 16
DetailsWednesday 30/11/1994
English League Cup
1994/11/30
Blackburn Rovers FC 1 : 3 Liverpool Round 4
DetailsSaturday 03/12/1994
English Premier League
1994/12/3
Coventry City 1 : 1 Liverpool Week # 17
DetailsSunday 11/12/1994
English Premier League
1994/12/11
Liverpool 0 : 0 Crystal Palace FC Week # 18
DetailsSunday 18/12/1994
English Premier League
1994/12/18
Chelsea 0 : 0 Liverpool Week # 19
DetailsMonday 26/12/1994
English Premier League
1994/12/26
Leicester City 1 : 2 Liverpool Week # 20
DetailsWednesday 28/12/1994
English Premier League
1994/12/28
Liverpool 2 : 0 Manchester City Week # 21
DetailsSaturday 31/12/1994
English Premier League
1994/12/31
Leeds United FC 0 : 2 Liverpool Week # 22
DetailsMonday 02/1/1995
English Premier League
1995/1/2
Liverpool 4 : 0 Norwich City Week # 23
DetailsWednesday 11/1/1995
English League Cup
1995/1/11
Liverpool 1 : 0 Arsenal FC Quarter Finals
DetailsSaturday 14/1/1995
English Premier League
1995/1/14
Liverpool 0 : 1 Ipswich Town FC Week # 24
DetailsTuesday 24/1/1995
English Premier League
1995/1/24
Liverpool 0 : 0 Everton FC Week # 26
DetailsSaturday 04/2/1995
English Premier League
1995/2/4
Nottingham Forest FC 1 : 1 Liverpool Week # 27
DetailsSaturday 11/2/1995
English Premier League
1995/2/11
Liverpool 1 : 1 Queens Park Rangers Week # 28
DetailsWednesday 15/2/1995
English League Cup
1995/2/15
Liverpool 1 : 0 Crystal Palace FC Semi Finals
DetailsSaturday 25/2/1995
English Premier League
1995/2/25
Sheffield Wednesday FC 1 : 2 Liverpool Week # 30
DetailsSaturday 04/3/1995
English Premier League
1995/3/4
Liverpool 2 : 0 Newcastle United FC Week # 31
DetailsWednesday 08/3/1995
English League Cup
1995/3/8
Crystal Palace FC 0 : 1 Liverpool Semi Finals
DetailsTuesday 14/3/1995
English Premier League
1995/3/14
Liverpool 2 : 3 Coventry City Week # 29
DetailsSunday 19/3/1995
English Premier League
1995/3/19
Liverpool 2 : 0 Manchester United Week # 34
DetailsWednesday 22/3/1995
English Premier League
1995/3/22
Tottenham Hotspur 0 : 0 Liverpool Week # 35
DetailsSunday 02/4/1995
English League Cup
1995/4/2
Liverpool 2 : 1 Bolton Wanderers Final
DetailsWednesday 05/4/1995
English Premier League
1995/4/5
Liverpool 3 : 1 FC Southampton Week # 32
DetailsSunday 09/4/1995
English Premier League
1995/4/9
Liverpool 0 : 1 Leeds United FC Week # 37
DetailsWednesday 12/4/1995
English Premier League
1995/4/12
Arsenal FC 0 : 1 Liverpool Week # 33
DetailsFriday 14/4/1995
English Premier League
1995/4/14
Manchester City 2 : 1 Liverpool Week # 38
DetailsMonday 17/4/1995
English Premier League
1995/4/17
Liverpool 2 : 0 Leicester City Week # 39
DetailsSaturday 29/4/1995
English Premier League
1995/4/29
Norwich City 1 : 2 Liverpool Week # 40
DetailsTuesday 02/5/1995
English Premier League
1995/5/2
Wimbledon FC 0 : 0 Liverpool Week # 25
DetailsSaturday 06/5/1995
English Premier League
1995/5/6
Aston Villa 2 : 0 Liverpool Week # 41
DetailsWednesday 10/5/1995
English Premier League
1995/5/10
West Ham United 3 : 0 Liverpool Week # 36
DetailsSunday 14/5/1995
English Premier League
1995/5/14
Liverpool 2 : 1 Blackburn Rovers FC Week # 42
DetailsSaturday 19/8/1995
English Premier League
1995/8/19
Liverpool 1 : 0 Sheffield Wednesday FC Week # 1
DetailsMonday 21/8/1995
English Premier League
1995/8/21
Leeds United FC 1 : 0 Liverpool Week # 2
DetailsSaturday 26/8/1995
English Premier League
1995/8/26
Tottenham Hotspur 1 : 3 Liverpool Week # 3
DetailsWednesday 30/8/1995
English Premier League
1995/8/30
Liverpool 1 : 0 Queens Park Rangers Week # 4
DetailsSaturday 09/9/1995
English Premier League
1995/9/9
Wimbledon FC 1 : 0 Liverpool Week # 5
DetailsTuesday 12/9/1995
UEFA Cup
1995/9/12
FC Alania Vladikavkaz - Russia 1 : 2 Liverpool - England 1st Round
DetailsSaturday 16/9/1995
English Premier League
1995/9/16
Liverpool 3 : 0 Blackburn Rovers FC Week # 6
DetailsSaturday 23/9/1995
English Premier League
1995/9/23
Liverpool 5 : 2 Bolton Wanderers Week # 7
DetailsTuesday 26/9/1995
UEFA Cup
1995/9/26
Liverpool - England 0 : 0 FC Alania Vladikavkaz - Russia 1st Round
DetailsSunday 01/10/1995
English Premier League
1995/10/1
Manchester United 2 : 2 Liverpool Week # 8
DetailsSaturday 14/10/1995
English Premier League
1995/10/14
Liverpool 0 : 0 Coventry City Week # 9
DetailsTuesday 17/10/1995
UEFA Cup
1995/10/17
Brondby IF - Denmark 0 : 0 Liverpool - England 2nd Round
DetailsSunday 22/10/1995
English Premier League
1995/10/22
FC Southampton 1 : 3 Liverpool Week # 10
DetailsWednesday 25/10/1995
English League Cup
1995/10/25
Liverpool 4 : 0 Manchester City DetailsSaturday 28/10/1995
English Premier League
1995/10/28
Liverpool 6 : 0 Manchester City Week # 11
DetailsTuesday 31/10/1995
UEFA Cup
1995/10/31
Liverpool - England 0 : 1 Brondby IF - Denmark 2nd Round
DetailsSaturday 04/11/1995
English Premier League
1995/11/4
Newcastle United FC 2 : 1 Liverpool Week # 12
DetailsSaturday 18/11/1995
English Premier League
1995/11/18
Liverpool 1 : 2 Everton FC Week # 13
DetailsWednesday 22/11/1995
English Premier League
1995/11/22
West Ham United 0 : 0 Liverpool Week # 14
DetailsSaturday 25/11/1995
English Premier League
1995/11/25
Middlesbrough 2 : 1 Liverpool Week # 15
DetailsWednesday 29/11/1995
English League Cup
1995/11/29
Liverpool 0 : 1 Newcastle United FC Round 4
DetailsSaturday 02/12/1995
English Premier League
1995/12/2
Liverpool 1 : 1 FC Southampton Week # 16
DetailsSaturday 09/12/1995
English Premier League
1995/12/9
Bolton Wanderers 0 : 1 Liverpool Week # 17
DetailsSunday 17/12/1995
English Premier League
1995/12/17
Liverpool 2 : 0 Manchester United Week # 18
DetailsSaturday 23/12/1995
English Premier League
1995/12/23
Liverpool 3 : 1 Arsenal FC Week # 19
DetailsSaturday 30/12/1995
English Premier League
1995/12/30
Chelsea 2 : 2 Liverpool Week # 21
DetailsMonday 01/1/1996
English Premier League
1996/1/1
Liverpool 4 : 2 Nottingham Forest FC Week # 22
DetailsSaturday 13/1/1996
English Premier League
1996/1/13
Sheffield Wednesday FC 1 : 1 Liverpool Week # 23
DetailsSaturday 20/1/1996
English Premier League
1996/1/20
Liverpool 5 : 0 Leeds United FC Week # 24
DetailsWednesday 31/1/1996
English Premier League
1996/1/31
Aston Villa 0 : 2 Liverpool Week # 20
DetailsSaturday 03/2/1996
English Premier League
1996/2/3
Liverpool 0 : 0 Tottenham Hotspur Week # 25
DetailsSunday 11/2/1996
English Premier League
1996/2/11
Queens Park Rangers 1 : 2 Liverpool Week # 26
DetailsSaturday 24/2/1996
English Premier League
1996/2/24
Blackburn Rovers FC 2 : 3 Liverpool Week # 28
DetailsSaturday 02/3/1996
English Premier League
1996/3/2
Liverpool 3 : 0 Aston Villa Week # 29
DetailsWednesday 13/3/1996
English Premier League
1996/3/13
Liverpool 2 : 2 Wimbledon FC Week # 27
DetailsSaturday 16/3/1996
English Premier League
1996/3/16
Liverpool 2 : 0 Chelsea Week # 31
DetailsSaturday 23/3/1996
English Premier League
1996/3/23
Nottingham Forest FC 1 : 0 Liverpool Week # 32
DetailsWednesday 03/4/1996
English Premier League
1996/4/3
Liverpool 4 : 3 Newcastle United FC Week # 33
DetailsSaturday 06/4/1996
English Premier League
1996/4/6
Coventry City 1 : 0 Liverpool Week # 34
DetailsMonday 08/4/1996
English Premier League
1996/4/8
Liverpool 2 : 0 West Ham United Week # 35
DetailsSunday 14/4/1996
English Premier League
1996/4/14
Everton FC 1 : 1 Liverpool Week # 36
DetailsSaturday 27/4/1996
English Premier League
1996/4/27
Liverpool 1 : 0 Middlesbrough Week # 37
DetailsWednesday 01/5/1996
English Premier League
1996/5/1
Arsenal FC 0 : 0 Liverpool Week # 30
DetailsSunday 05/5/1996
English Premier League
1996/5/5
Manchester City 2 : 2 Liverpool Week # 38
DetailsSaturday 11/5/1996
FA Cup
1996/5/11
Manchester United 1 : 0 Liverpool Finals
DetailsSaturday 17/8/1996
English Premier League
1996/8/17
Middlesbrough 3 : 3 Liverpool Week # 1
DetailsMonday 19/8/1996
English Premier League
1996/8/19
Liverpool 2 : 0 Arsenal FC Week # 2
DetailsSaturday 24/8/1996
English Premier League
1996/8/24
Liverpool 0 : 0 AFC Sunderland Week # 3
DetailsWednesday 04/9/1996
English Premier League
1996/9/4
Coventry City 0 : 1 Liverpool Week # 4
DetailsSaturday 07/9/1996
English Premier League
1996/9/7
Liverpool 2 : 1 FC Southampton Week # 5
DetailsThursday 12/9/1996
European Cup Winners Cup
1996/9/12
MyPa - Finland 0 : 1 Liverpool - England First round
DetailsSunday 15/9/1996
English Premier League
1996/9/15
Leicester City 0 : 3 Liverpool Week # 6
DetailsSaturday 21/9/1996
English Premier League
1996/9/21
Liverpool 5 : 1 Chelsea Week # 7
DetailsThursday 26/9/1996
European Cup Winners Cup
1996/9/26
Liverpool - England 3 : 1 MyPa - Finland First round
DetailsSunday 29/9/1996
English Premier League
1996/9/29
West Ham United 1 : 2 Liverpool Week # 8
DetailsSaturday 12/10/1996
English Premier League
1996/10/12
Manchester United 1 : 0 Liverpool Week # 9
DetailsThursday 17/10/1996
European Cup Winners Cup
1996/10/17
FC Sion - Switzerland 1 : 2 Liverpool - England Second round
DetailsWednesday 23/10/1996
English League Cup
1996/10/23
Charlton Athletic FC 1 : 1 Liverpool DetailsSunday 27/10/1996
English Premier League
1996/10/27
Liverpool 2 : 1 Derby County FC Week # 11
DetailsThursday 31/10/1996
European Cup Winners Cup
1996/10/31
Liverpool - England 6 : 3 FC Sion - Switzerland Second round
DetailsSunday 03/11/1996
English Premier League
1996/11/3
Blackburn Rovers FC 3 : 0 Liverpool Week # 12
DetailsWednesday 13/11/1996
English League Cup
1996/11/13
Liverpool 4 : 1 Charlton Athletic FC Replayed Game
DetailsSaturday 16/11/1996
English Premier League
1996/11/16
Leeds United FC 0 : 2 Liverpool Week # 13
DetailsWednesday 20/11/1996
English Premier League
1996/11/20
Liverpool 1 : 1 Everton FC Week # 10
DetailsSaturday 23/11/1996
English Premier League
1996/11/23
Liverpool 1 : 1 Wimbledon FC Week # 14
DetailsWednesday 27/11/1996
English League Cup
1996/11/27
Liverpool 4 : 2 Arsenal FC Round 4
DetailsMonday 02/12/1996
English Premier League
1996/12/2
Tottenham Hotspur 0 : 2 Liverpool Week # 15
DetailsSaturday 07/12/1996
English Premier League
1996/12/7
Liverpool 0 : 1 Sheffield Wednesday FC Week # 16
DetailsSaturday 14/12/1996
English Premier League
1996/12/14
Liverpool 5 : 1 Middlesbrough Week # 20
DetailsTuesday 17/12/1996
English Premier League
1996/12/17
Liverpool 4 : 2 Nottingham Forest FC Week # 17
DetailsMonday 23/12/1996
English Premier League
1996/12/23
Newcastle United FC 1 : 1 Liverpool Week # 18
DetailsThursday 26/12/1996
English Premier League
1996/12/26
Liverpool 1 : 1 Leicester City Week # 19
DetailsSunday 29/12/1996
English Premier League
1996/12/29
FC Southampton 0 : 1 Liverpool Week # 21
DetailsWednesday 01/1/1997
English Premier League
1997/1/1
Chelsea 1 : 0 Liverpool Week # 22
DetailsWednesday 08/1/1997
English League Cup
1997/1/8
Middlesbrough 2 : 1 Liverpool Quarterfinals
DetailsSaturday 11/1/1997
English Premier League
1997/1/11
Liverpool 0 : 0 West Ham United Week # 23
DetailsSaturday 18/1/1997
English Premier League
1997/1/18
Liverpool 3 : 0 Aston Villa Week # 24
DetailsSunday 26/1/1997
FA Cup
1997/1/26
Chelsea 4 : 2 Liverpool DetailsSaturday 01/2/1997
English Premier League
1997/2/1
Derby County FC 0 : 1 Liverpool Week # 25
DetailsWednesday 19/2/1997
English Premier League
1997/2/19
Liverpool 4 : 0 Leeds United FC Week # 32
DetailsSaturday 22/2/1997
English Premier League
1997/2/22
Liverpool 0 : 0 Blackburn Rovers FC Week # 27
DetailsSunday 02/3/1997
English Premier League
1997/3/2
Aston Villa 1 : 0 Liverpool Week # 28
DetailsThursday 06/3/1997
European Cup Winners Cup
1997/3/6
SK Brann - Norway 1 : 1 Liverpool - England Quarterfinals
DetailsMonday 10/3/1997
English Premier League
1997/3/10
Liverpool 4 : 3 Newcastle United FC Week # 37
DetailsSaturday 15/3/1997
English Premier League
1997/3/15
Nottingham Forest FC 1 : 1 Liverpool Week # 29
DetailsThursday 20/3/1997
European Cup Winners Cup
1997/3/20
Liverpool - England 3 : 0 FC Sion - Switzerland Quarterfinals
DetailsMonday 24/3/1997
English Premier League
1997/3/24
Arsenal FC 1 : 2 Liverpool Week # 30
DetailsSunday 06/4/1997
English Premier League
1997/4/6
Liverpool 1 : 2 Coventry City Week # 31
DetailsThursday 10/4/1997
European Cup Winners Cup
1997/4/10
Paris Saint-Germain - France 3 : 0 Liverpool - England Semifinals
DetailsSunday 13/4/1997
English Premier League
1997/4/13
AFC Sunderland 1 : 2 Liverpool Week # 33
DetailsWednesday 16/4/1997
English Premier League
1997/4/16
Everton FC 1 : 1 Liverpool Week # 35
DetailsSaturday 19/4/1997
English Premier League
1997/4/19
Liverpool 1 : 3 Manchester United Week # 34
DetailsThursday 24/4/1997
European Cup Winners Cup
1997/4/24
Liverpool - England 2 : 0 Paris Saint-Germain - France Semifinals
DetailsSaturday 03/5/1997
English Premier League
1997/5/3
Liverpool 2 : 1 Tottenham Hotspur Week # 36
DetailsTuesday 06/5/1997
English Premier League
1997/5/6
Wimbledon FC 2 : 1 Liverpool Week # 26
DetailsSunday 11/5/1997
English Premier League
1997/5/11
Sheffield Wednesday FC 1 : 1 Liverpool Week # 38
DetailsSaturday 09/8/1997
English Premier League
1997/8/9
Wimbledon FC 1 : 1 Liverpool Week # 1
DetailsWednesday 13/8/1997
English Premier League
1997/8/13
Liverpool 1 : 2 Leicester City Week # 2
DetailsSaturday 23/8/1997
English Premier League
1997/8/23
Blackburn Rovers FC 1 : 1 Liverpool Week # 3
DetailsTuesday 26/8/1997
English Premier League
1997/8/26
Leeds United FC 0 : 2 Liverpool Week # 4
DetailsSaturday 13/9/1997
English Premier League
1997/9/13
Liverpool 2 : 1 Sheffield Wednesday FC Week # 6
DetailsTuesday 16/9/1997
UEFA Cup
1997/9/16
Celtic Glasgow - Scotland 2 : 2 Liverpool - England 1st Round
DetailsSaturday 20/9/1997
English Premier League
1997/9/20
FC Southampton 1 : 1 Liverpool Week # 7
DetailsMonday 22/9/1997
English Premier League
1997/9/22
Liverpool 3 : 0 Aston Villa Week # 8
DetailsSaturday 27/9/1997
English Premier League
1997/9/27
West Ham United 2 : 1 Liverpool Week # 9
DetailsTuesday 30/9/1997
UEFA Cup
1997/9/30
Liverpool - England 0 : 0 Celtic Glasgow - Scotland 1st Round
DetailsSunday 05/10/1997
English Premier League
1997/10/5
Liverpool 4 : 2 Chelsea Week # 10
DetailsWednesday 15/10/1997
English League Cup
1997/10/15
West Bromwich Albion FC 0 : 2 Liverpool DetailsSaturday 18/10/1997
English Premier League
1997/10/18
Everton FC 2 : 0 Liverpool Week # 11
DetailsTuesday 21/10/1997
UEFA Cup
1997/10/21
RC Strasbourg - France 3 : 0 Liverpool - England 2nd Round
DetailsSaturday 25/10/1997
English Premier League
1997/10/25
Liverpool 4 : 0 Derby County FC Week # 12
DetailsSaturday 01/11/1997
English Premier League
1997/11/1
Bolton Wanderers 1 : 1 Liverpool Week # 13
DetailsTuesday 04/11/1997
UEFA Cup
1997/11/4
Liverpool - England 2 : 0 RC Strasbourg - France 2nd Round
DetailsSaturday 08/11/1997
English Premier League
1997/11/8
Liverpool 4 : 0 Tottenham Hotspur Week # 14
DetailsTuesday 18/11/1997
English League Cup
1997/11/18
Liverpool 3 : 0 Grimsby Town F.C Round 4
DetailsSaturday 22/11/1997
English Premier League
1997/11/22
Liverpool 0 : 1 Barnsley FC Week # 15
DetailsSunday 30/11/1997
English Premier League
1997/11/30
Arsenal FC 0 : 1 Liverpool Week # 16
DetailsSaturday 06/12/1997
English Premier League
1997/12/6
Liverpool 1 : 3 Manchester United Week # 17
DetailsSaturday 13/12/1997
English Premier League
1997/12/13
Crystal Palace FC 0 : 3 Liverpool Week # 18
DetailsSaturday 20/12/1997
English Premier League
1997/12/20
Liverpool 1 : 0 Coventry City Week # 19
DetailsFriday 26/12/1997
English Premier League
1997/12/26
Liverpool 3 : 1 Leeds United FC Week # 20
DetailsSunday 28/12/1997
English Premier League
1997/12/28
Newcastle United FC 1 : 2 Liverpool Week # 21
DetailsWednesday 07/1/1998
English League Cup
1998/1/7
Newcastle United FC 0 : 2 Liverpool Quarterfinals
After extra time
DetailsSaturday 10/1/1998
English Premier League
1998/1/10
Liverpool 2 : 0 Wimbledon FC Week # 22
DetailsSaturday 17/1/1998
English Premier League
1998/1/17
Leicester City 0 : 0 Liverpool Week # 23
DetailsTuesday 20/1/1998
English Premier League
1998/1/20
Liverpool 1 : 0 Newcastle United FC Week # 5
DetailsTuesday 27/1/1998
English League Cup
1998/1/27
Liverpool 2 : 1 Middlesbrough Semifinals
DetailsSaturday 31/1/1998
English Premier League
1998/1/31
Liverpool 0 : 0 Blackburn Rovers FC Week # 24
DetailsSaturday 07/2/1998
English Premier League
1998/2/7
Liverpool 2 : 3 FC Southampton Week # 25
DetailsSaturday 14/2/1998
English Premier League
1998/2/14
Sheffield Wednesday FC 3 : 3 Liverpool Week # 26
DetailsWednesday 18/2/1998
English League Cup
1998/2/18
Middlesbrough 2 : 0 Liverpool Semifinals
DetailsMonday 23/2/1998
English Premier League
1998/2/23
Liverpool 1 : 1 Everton FC Week # 27
DetailsSaturday 28/2/1998
English Premier League
1998/2/28
Aston Villa 2 : 1 Liverpool Week # 28
DetailsSaturday 07/3/1998
English Premier League
1998/3/7
Liverpool 2 : 1 Bolton Wanderers Week # 29
DetailsSaturday 14/3/1998
English Premier League
1998/3/14
Tottenham Hotspur 3 : 3 Liverpool Week # 30
DetailsSaturday 28/3/1998
English Premier League
1998/3/28
Barnsley FC 2 : 3 Liverpool Week # 31
DetailsFriday 10/4/1998
English Premier League
1998/4/10
Manchester United 1 : 1 Liverpool Week # 33
DetailsMonday 13/4/1998
English Premier League
1998/4/13
Liverpool 2 : 1 Crystal Palace FC Week # 34
DetailsSunday 19/4/1998
English Premier League
1998/4/19
Coventry City 1 : 1 Liverpool Week # 35
DetailsSaturday 25/4/1998
English Premier League
1998/4/25
Chelsea 4 : 1 Liverpool Week # 36
DetailsSunday 03/5/1998
English Premier League
1998/5/3
Liverpool 5 : 0 West Ham United Week # 37
DetailsWednesday 06/5/1998
English Premier League
1998/5/6
Liverpool 4 : 0 Arsenal FC Week # 32
DetailsSunday 10/5/1998
English Premier League
1998/5/10
Derby County FC 1 : 0 Liverpool Week # 38
DetailsSunday 16/8/1998
English Premier League
1998/8/16
FC Southampton 1 : 2 Liverpool Week # 1
DetailsSaturday 22/8/1998
English Premier League
1998/8/22
Liverpool 0 : 0 Arsenal FC Week # 2
DetailsSunday 30/8/1998
English Premier League
1998/8/30
Newcastle United FC 1 : 4 Liverpool Week # 3
DetailsWednesday 09/9/1998
English Premier League
1998/9/9
Liverpool 2 : 0 Coventry City Week # 4
DetailsSaturday 12/9/1998
English Premier League
1998/9/12
West Ham United 2 : 1 Liverpool Week # 5
DetailsTuesday 15/9/1998
UEFA Cup
1998/9/15
MFK Kosice - Slovakia 0 : 3 Liverpool - England 1st Round
DetailsSaturday 19/9/1998
English Premier League
1998/9/19
Liverpool 3 : 3 Charlton Athletic FC Week # 6
DetailsThursday 24/9/1998
English Premier League
1998/9/24
Manchester United 2 : 0 Liverpool Week # 7
DetailsTuesday 29/9/1998
UEFA Cup
1998/9/29
Liverpool - England 5 : 0 MFK Kosice - Slovakia 1st Round
DetailsSunday 04/10/1998
English Premier League
1998/10/4
Liverpool 1 : 1 Chelsea Week # 8
DetailsSaturday 17/10/1998
English Premier League
1998/10/17
Everton FC 0 : 0 Liverpool Week # 9
DetailsTuesday 20/10/1998
UEFA Cup
1998/10/20
Liverpool - England 0 : 0 Valencia C.F - Spain 2nd Round
DetailsSaturday 24/10/1998
English Premier League
1998/10/24
Liverpool 5 : 1 Nottingham Forest FC Week # 10
DetailsTuesday 27/10/1998
English League Cup
1998/10/27
Liverpool 3 : 1 Fulham FC DetailsSaturday 31/10/1998
English Premier League
1998/10/31
Leicester City 1 : 0 Liverpool Week # 11
DetailsTuesday 03/11/1998
UEFA Cup
1998/11/3
Valencia C.F - Spain 2 : 2 Liverpool - England 2nd Round
DetailsSaturday 07/11/1998
English Premier League
1998/11/7
Liverpool 1 : 2 Derby County FC Week # 12
DetailsTuesday 10/11/1998
English League Cup
1998/11/10
Liverpool 1 : 3 Tottenham Hotspur Round 4
DetailsSaturday 14/11/1998
English Premier League
1998/11/14
Liverpool 1 : 3 Leeds United FC Week # 13
DetailsSaturday 21/11/1998
English Premier League
1998/11/21
Aston Villa 2 : 4 Liverpool Week # 14
DetailsTuesday 24/11/1998
UEFA Cup
1998/11/24
Celta de Vigo - Spain 3 : 1 Liverpool - England 3rd Round
DetailsSunday 29/11/1998
English Premier League
1998/11/29
Liverpool 2 : 0 Blackburn Rovers FC Week # 15
DetailsSaturday 05/12/1998
English Premier League
1998/12/5
Tottenham Hotspur 2 : 1 Liverpool Week # 16
DetailsTuesday 08/12/1998
UEFA Cup
1998/12/8
Liverpool - England 0 : 1 Celta de Vigo - Spain 3rd Round
DetailsSunday 13/12/1998
English Premier League
1998/12/13
Wimbledon FC 1 : 0 Liverpool Week # 17
DetailsSaturday 19/12/1998
English Premier League
1998/12/19
Liverpool 2 : 0 Sheffield Wednesday FC Week # 18
DetailsSaturday 26/12/1998
English Premier League
1998/12/26
Middlesbrough 1 : 3 Liverpool Week # 19
DetailsMonday 28/12/1998
English Premier League
1998/12/28
Liverpool 4 : 2 Newcastle United FC Week # 20
DetailsSaturday 09/1/1999
English Premier League
1999/1/9
Arsenal FC 0 : 0 Liverpool Week # 21
DetailsSaturday 16/1/1999
English Premier League
1999/1/16
Liverpool 7 : 1 FC Southampton Week # 22
DetailsSunday 24/1/1999
FA Cup
1999/1/24
Manchester United 2 : 1 Liverpool DetailsSaturday 30/1/1999
English Premier League
1999/1/30
Coventry City 2 : 1 Liverpool Week # 23
DetailsSaturday 06/2/1999
English Premier League
1999/2/6
Liverpool 3 : 1 Middlesbrough Week # 24
DetailsSaturday 13/2/1999
English Premier League
1999/2/13
Charlton Athletic FC 1 : 0 Liverpool Week # 25
DetailsSaturday 20/2/1999
English Premier League
1999/2/20
Liverpool 2 : 2 West Ham United Week # 26
DetailsSaturday 27/2/1999
English Premier League
1999/2/27
Chelsea 2 : 1 Liverpool Week # 27
DetailsSaturday 13/3/1999
English Premier League
1999/3/13
Derby County FC 3 : 2 Liverpool Week # 29
DetailsSaturday 03/4/1999
English Premier League
1999/4/3
Liverpool 3 : 2 Everton FC Week # 31
DetailsMonday 05/4/1999
English Premier League
1999/4/5
Nottingham Forest FC 2 : 2 Liverpool Week # 32
DetailsMonday 12/4/1999
English Premier League
1999/4/12
Leeds United FC 0 : 0 Liverpool Week # 33
DetailsSaturday 17/4/1999
English Premier League
1999/4/17
Liverpool 0 : 1 Aston Villa Week # 34
DetailsWednesday 21/4/1999
English Premier League
1999/4/21
Liverpool 0 : 1 Leicester City Week # 30
DetailsSaturday 24/4/1999
English Premier League
1999/4/24
Blackburn Rovers FC 1 : 3 Liverpool Week # 35
DetailsSaturday 01/5/1999
English Premier League
1999/5/1
Liverpool 3 : 2 Tottenham Hotspur Week # 36
DetailsWednesday 05/5/1999
English Premier League
1999/5/5
Liverpool 2 : 2 Manchester United Week # 28
DetailsSaturday 08/5/1999
English Premier League
1999/5/8
Sheffield Wednesday FC 1 : 0 Liverpool Week # 37
DetailsSunday 16/5/1999
English Premier League
1999/5/16
Liverpool 3 : 0 Wimbledon FC Week # 38
DetailsSaturday 07/8/1999
English Premier League
1999/8/7
Sheffield Wednesday FC 1 : 2 Liverpool Week # 1
DetailsSaturday 14/8/1999
English Premier League
1999/8/14
Liverpool 0 : 1 Watford Week # 3
DetailsSaturday 21/8/1999
English Premier League
1999/8/21
Middlesbrough 1 : 0 Liverpool Week # 4
DetailsMonday 23/8/1999
English Premier League
1999/8/23
Leeds United FC 1 : 2 Liverpool Week # 5
DetailsSaturday 28/8/1999
English Premier League
1999/8/28
Liverpool 2 : 0 Arsenal FC Week # 6
DetailsSaturday 11/9/1999
English Premier League
1999/9/11
Liverpool 2 : 3 Manchester United Week # 7
DetailsSaturday 18/9/1999
English Premier League
1999/9/18
Leicester City 2 : 2 Liverpool Week # 8
DetailsMonday 27/9/1999
English Premier League
1999/9/27
Liverpool 0 : 1 Everton FC Week # 9
DetailsSaturday 02/10/1999
English Premier League
1999/10/2
Aston Villa 0 : 0 Liverpool Week # 10
DetailsWednesday 13/10/1999
English League Cup
1999/10/13
FC Southampton 2 : 1 Liverpool DetailsSaturday 16/10/1999
English Premier League
1999/10/16
Liverpool 1 : 0 Chelsea Week # 11
DetailsSaturday 23/10/1999
English Premier League
1999/10/23
FC Southampton 1 : 1 Liverpool Week # 12
DetailsWednesday 27/10/1999
English Premier League
1999/10/27
Liverpool 1 : 0 West Ham United Week # 2
DetailsMonday 01/11/1999
English Premier League
1999/11/1
Liverpool 3 : 1 Bradford City FC Week # 13
DetailsSaturday 06/11/1999
English Premier League
1999/11/6
Liverpool 2 : 0 Derby County FC Week # 14
DetailsSaturday 20/11/1999
English Premier League
1999/11/20
AFC Sunderland 0 : 2 Liverpool Week # 15
DetailsSaturday 27/11/1999
English Premier League
1999/11/27
West Ham United 1 : 0 Liverpool Week # 16
DetailsSunday 05/12/1999
English Premier League
1999/12/5
Liverpool 4 : 1 Sheffield Wednesday FC Week # 17
DetailsSaturday 18/12/1999
English Premier League
1999/12/18
Liverpool 2 : 0 Coventry City Week # 18
DetailsSunday 26/12/1999
English Premier League
1999/12/26
Newcastle United FC 2 : 2 Liverpool Week # 19
DetailsTuesday 28/12/1999
English Premier League
1999/12/28
Liverpool 3 : 1 Wimbledon FC Week # 20
DetailsMonday 03/1/2000
English Premier League
2000/1/3
Tottenham Hotspur 1 : 0 Liverpool Week # 21
DetailsMonday 10/1/2000
FA Cup
2000/1/10
Liverpool 0 : 1 Blackburn Rovers FC DetailsSaturday 15/1/2000
English Premier League
2000/1/15
Watford 2 : 3 Liverpool Week # 22
DetailsSaturday 22/1/2000
English Premier League
2000/1/22
Liverpool 0 : 0 Middlesbrough Week # 23
DetailsSaturday 05/2/2000
English Premier League
2000/2/5
Liverpool 3 : 1 Leeds United FC Week # 24
DetailsSunday 13/2/2000
English Premier League
2000/2/13
Arsenal FC 0 : 1 Liverpool Week # 25
DetailsSaturday 04/3/2000
English Premier League
2000/3/4
Manchester United 1 : 1 Liverpool Week # 27
DetailsSaturday 11/3/2000
English Premier League
2000/3/11
Liverpool 1 : 1 AFC Sunderland Week # 28
DetailsWednesday 15/3/2000
English Premier League
2000/3/15
Liverpool 0 : 0 Aston Villa Week # 35
DetailsSaturday 18/3/2000
English Premier League
2000/3/18
Derby County FC 0 : 2 Liverpool Week # 29
DetailsSaturday 25/3/2000
English Premier League
2000/3/25
Liverpool 2 : 1 Newcastle United FC Week # 30
DetailsSaturday 01/4/2000
English Premier League
2000/4/1
Coventry City 0 : 3 Liverpool Week # 31
DetailsSunday 09/4/2000
English Premier League
2000/4/9
Liverpool 2 : 0 Tottenham Hotspur Week # 32
DetailsSunday 16/4/2000
English Premier League
2000/4/16
Wimbledon FC 1 : 2 Liverpool Week # 32
DetailsFriday 21/4/2000
English Premier League
2000/4/21
Everton FC 0 : 0 Liverpool Week # 34
DetailsSaturday 29/4/2000
English Premier League
2000/4/29
Chelsea 2 : 0 Liverpool Week # 36
DetailsWednesday 03/5/2000
English Premier League
2000/5/3
Liverpool 0 : 2 Leicester City Week # 26
DetailsSunday 07/5/2000
English Premier League
2000/5/7
Liverpool 0 : 0 FC Southampton Week # 37
DetailsSunday 14/5/2000
English Premier League
2000/5/14
Bradford City FC 1 : 0 Liverpool Week # 38
DetailsSaturday 19/8/2000
English Premier League
2000/8/19
Liverpool 1 : 0 Bradford City FC DetailsMonday 21/8/2000
English Premier League
2000/8/21
Arsenal FC 2 : 0 Liverpool DetailsSaturday 26/8/2000
English Premier League
2000/8/26
FC Southampton 3 : 3 Liverpool DetailsWednesday 06/9/2000
English Premier League
2000/9/6
Liverpool 3 : 1 Aston Villa DetailsSaturday 09/9/2000
English Premier League
2000/9/9
Liverpool 3 : 2 Manchester City DetailsThursday 14/9/2000
UEFA Cup
2000/9/14
Rapid Bucharest - Romania 0 : 1 Liverpool - England DetailsSunday 17/9/2000
English Premier League
2000/9/17
West Ham United 1 : 1 Liverpool DetailsSaturday 23/9/2000
English Premier League
2000/9/23
Liverpool 1 : 1 AFC Sunderland DetailsThursday 28/9/2000
UEFA Cup
2000/9/28
Liverpool - England 0 : 0 Rapid Bucharest - Romania DetailsSunday 01/10/2000
English Premier League
2000/10/1
Chelsea 3 : 0 Liverpool DetailsSunday 15/10/2000
English Premier League
2000/10/15
Derby County FC 0 : 4 Liverpool DetailsSaturday 21/10/2000
English Premier League
2000/10/21
Liverpool 1 : 0 Leicester City DetailsThursday 26/10/2000
UEFA Cup
2000/10/26
Liverpool - England 1 : 0 Slovan Liberec - Czech Republic DetailsSunday 29/10/2000
English Premier League
2000/10/29
Liverpool 3 : 1 Everton FC DetailsWednesday 01/11/2000
English League Cup
2000/11/1
Liverpool 2 : 1 Chelsea Round 3
After extra time
DetailsSaturday 04/11/2000
English Premier League
2000/11/4
Leeds United FC 4 : 3 Liverpool DetailsThursday 09/11/2000
UEFA Cup
2000/11/9
Slovan Liberec - Czech Republic 2 : 3 Liverpool - England DetailsSunday 12/11/2000
English Premier League
2000/11/12
Liverpool 4 : 1 Coventry City DetailsSunday 19/11/2000
English Premier League
2000/11/19
Tottenham Hotspur 2 : 1 Liverpool DetailsThursday 23/11/2000
UEFA Cup
2000/11/23
Olympiacos Piraeus - Greece 2 : 2 Liverpool - England Round 3
DetailsSunday 26/11/2000
English Premier League
2000/11/26
Newcastle United FC 2 : 1 Liverpool DetailsWednesday 29/11/2000
English League Cup
2000/11/29
Stoke City FC 0 : 8 Liverpool Round 4
DetailsSaturday 02/12/2000
English Premier League
2000/12/2
Liverpool 3 : 0 Charlton Athletic FC DetailsThursday 07/12/2000
UEFA Cup
2000/12/7
Liverpool - England 2 : 0 Olympiacos Piraeus - Greece Round 3
DetailsSunday 10/12/2000
English Premier League
2000/12/10
Liverpool 0 : 1 Ipswich Town FC DetailsWednesday 13/12/2000
English League Cup
2000/12/13
Liverpool 3 : 0 Fulham FC Quarterfinals
After extra time
DetailsSunday 17/12/2000
English Premier League
2000/12/17
Manchester United 0 : 1 Liverpool DetailsSaturday 23/12/2000
English Premier League
2000/12/23
Liverpool 4 : 0 Arsenal FC DetailsTuesday 26/12/2000
English Premier League
2000/12/26
Middlesbrough 1 : 0 Liverpool DetailsSaturday 30/12/2000
English Premier League
2000/12/30
Bradford City FC 0 : 0 Liverpool Postponed
DetailsMonday 01/1/2001
English Premier League
2001/1/1
Liverpool 2 : 1 FC Southampton DetailsWednesday 10/1/2001
English League Cup
2001/1/10
Crystal Palace FC 2 : 1 Liverpool Semifinals
DetailsSaturday 13/1/2001
English Premier League
2001/1/13
Aston Villa 0 : 3 Liverpool DetailsSaturday 20/1/2001
English Premier League
2001/1/20
Liverpool 0 : 0 Middlesbrough DetailsWednesday 24/1/2001
English League Cup
2001/1/24
Liverpool 5 : 0 Crystal Palace FC Semifinals
DetailsSaturday 27/1/2001
FA Cup
2001/1/27
Leeds United FC 0 : 2 Liverpool DetailsWednesday 31/1/2001
English Premier League
2001/1/31
Manchester City 1 : 1 Liverpool DetailsSaturday 03/2/2001
English Premier League
2001/2/3
Liverpool 3 : 0 West Ham United DetailsSaturday 10/2/2001
English Premier League
2001/2/10
AFC Sunderland 1 : 1 Liverpool DetailsThursday 15/2/2001
UEFA Cup
2001/2/15
AS Roma - Italy 0 : 2 Liverpool - England Round 4
DetailsSunday 18/2/2001
FA Cup
2001/2/18
Liverpool 4 : 2 Manchester City Round 5
DetailsThursday 22/2/2001
UEFA Cup
2001/2/22
Liverpool - England 0 : 1 AS Roma - Italy Round 4
DetailsSunday 25/2/2001
English League Cup
2001/2/25
Birmingham City FC 1 : 1
5 : 6
Liverpool Final
Penalty Kicks
DetailsSaturday 03/3/2001
English Premier League
2001/3/3
Leicester City 2 : 0 Liverpool DetailsThursday 08/3/2001
UEFA Cup
2001/3/8
FC Porto - Portugal 0 : 0 Liverpool - England Quarterfinals
DetailsSunday 11/3/2001
FA Cup
2001/3/11
Tranmere Rovers FC 2 : 4 Liverpool Quarter Finals
DetailsThursday 15/3/2001
UEFA Cup
2001/3/15
Liverpool - England 2 : 0 FC Porto - Portugal Quarterfinals
DetailsSunday 18/3/2001
English Premier League
2001/3/18
Liverpool 1 : 1 Derby County FC DetailsSaturday 31/3/2001
English Premier League
2001/3/31
Liverpool 2 : 0 Manchester United DetailsThursday 05/4/2001
UEFA Cup
2001/4/5
FC Barcelona - Spain 0 : 0 Liverpool - England Semifinals
DetailsSunday 08/4/2001
FA Cup
2001/4/8
Wycombe Wanderers FC 1 : 2 Liverpool Semi Finals
DetailsTuesday 10/4/2001
English Premier League
2001/4/10
Ipswich Town FC 1 : 1 Liverpool DetailsFriday 13/4/2001
English Premier League
2001/4/13
Liverpool 1 : 2 Leeds United FC DetailsMonday 16/4/2001
English Premier League
2001/4/16
Everton FC 2 : 3 Liverpool DetailsThursday 19/4/2001
UEFA Cup
2001/4/19
Liverpool - England 1 : 0 FC Barcelona - Spain Semifinals
DetailsSunday 22/4/2001
English Premier League
2001/4/22
Liverpool 3 : 1 Tottenham Hotspur DetailsSaturday 28/4/2001
English Premier League
2001/4/28
Coventry City 0 : 2 Liverpool DetailsTuesday 01/5/2001
English Premier League
2001/5/1
Bradford City FC 0 : 2 Liverpool DetailsSaturday 05/5/2001
English Premier League
2001/5/5
Liverpool 3 : 0 Newcastle United FC DetailsTuesday 08/5/2001
English Premier League
2001/5/8
Liverpool 2 : 2 Chelsea DetailsSaturday 12/5/2001
FA Cup
2001/5/12
Arsenal FC 1 : 2 Liverpool Final
DetailsWednesday 16/5/2001
UEFA Cup
2001/5/16
Liverpool - England 5 : 4 Deportivo Alaves - Spain Final
After extra time
DetailsSaturday 19/5/2001
English Premier League
2001/5/19
Charlton Athletic FC 0 : 4 Liverpool DetailsThursday 26/7/2001
Amsterdam Intl.
2001/7/26
Liverpool 1 : 0 Valencia C.F DetailsSaturday 28/7/2001
Amsterdam Intl.
2001/7/28
Ajax Amsterdam 3 : 1 Liverpool DetailsWednesday 08/8/2001
UEFA Champions League
2001/8/8
Valkeakosken Haka - Finland 0 : 5 Liverpool - England Qualifying 3
DetailsSunday 12/8/2001
FA Community Shield
2001/8/12
Manchester United 1 : 2 Liverpool DetailsSaturday 18/8/2001
English Premier League
2001/8/18
Liverpool 2 : 1 West Ham United DetailsTuesday 21/8/2001
UEFA Champions League
2001/8/21
Liverpool - England 4 : 1 Valkeakosken Haka - Finland Qualifying 3
DetailsFriday 24/8/2001
UEFA Super Cup
2001/8/24
Liverpool - England 3 : 2 FC Bayern Munich - Germany DetailsMonday 27/8/2001
English Premier League
2001/8/27
Bolton Wanderers 2 : 1 Liverpool DetailsSaturday 08/9/2001
English Premier League
2001/9/8
Liverpool 1 : 3 Aston Villa DetailsTuesday 11/9/2001
UEFA Champions League
2001/9/11
Liverpool - England 1 : 1 Boavista FC - Portugal Raund 1 Groups
Round # 1
DetailsSaturday 15/9/2001
English Premier League
2001/9/15
Everton FC 1 : 3 Liverpool DetailsWednesday 19/9/2001
UEFA Champions League
2001/9/19
Borussia Dortmund - Germany 0 : 0 Liverpool - England Raund 1 Groups
Round # 2
DetailsSaturday 22/9/2001
English Premier League
2001/9/22
Liverpool 1 : 0 Tottenham Hotspur DetailsWednesday 26/9/2001
UEFA Champions League
2001/9/26
Liverpool - England 1 : 0 Dynamo Kiev - Ukraine Raund 1 Groups
Round # 3
DetailsSunday 30/9/2001
English Premier League
2001/9/30
Newcastle United FC 0 : 2 Liverpool DetailsTuesday 09/10/2001
English League Cup
2001/10/9
Liverpool 1 : 2 Grimsby Town F.C Round 3
After extra time
DetailsSaturday 13/10/2001
English Premier League
2001/10/13
Liverpool 1 : 1 Leeds United FC DetailsTuesday 16/10/2001
UEFA Champions League
2001/10/16
Dynamo Kiev - Ukraine 1 : 2 Liverpool - England Raund 1 Groups
Round # 4
DetailsSaturday 20/10/2001
English Premier League
2001/10/20
Leicester City 1 : 4 Liverpool DetailsWednesday 24/10/2001
UEFA Champions League
2001/10/24
Boavista FC - Portugal 1 : 1 Liverpool - England Raund 1 Groups
Round # 5
DetailsSaturday 27/10/2001
English Premier League
2001/10/27
Charlton Athletic FC 0 : 2 Liverpool DetailsTuesday 30/10/2001
UEFA Champions League
2001/10/30
Liverpool - England 2 : 0 Borussia Dortmund - Germany Raund 1 Groups
Round # 6
DetailsSunday 04/11/2001
English Premier League
2001/11/4
Liverpool 3 : 1 Manchester United DetailsSaturday 17/11/2001
English Premier League
2001/11/17
Blackburn Rovers FC 1 : 1 Liverpool DetailsTuesday 20/11/2001
UEFA Champions League
2001/11/20
Liverpool - England 1 : 3 FC Barcelona - Spain Raund 2 Groups
Round # 1
DetailsSunday 25/11/2001
English Premier League
2001/11/25
Liverpool 1 : 0 AFC Sunderland DetailsSaturday 01/12/2001
English Premier League
2001/12/1
Derby County FC 0 : 1 Liverpool DetailsWednesday 05/12/2001
UEFA Champions League
2001/12/5
AS Roma - Italy 0 : 0 Liverpool - England Raund 2 Groups
Round # 2
DetailsSaturday 08/12/2001
English Premier League
2001/12/8
Liverpool 2 : 0 Middlesbrough DetailsWednesday 12/12/2001
English Premier League
2001/12/12
Liverpool 0 : 0 Fulham FC DetailsSunday 16/12/2001
English Premier League
2001/12/16
Chelsea 4 : 0 Liverpool DetailsSunday 23/12/2001
English Premier League
2001/12/23
Liverpool 1 : 2 Arsenal FC DetailsWednesday 26/12/2001
English Premier League
2001/12/26
Aston Villa 1 : 2 Liverpool DetailsSaturday 29/12/2001
English Premier League
2001/12/29
West Ham United 1 : 1 Liverpool DetailsTuesday 01/1/2002
English Premier League
2002/1/1
Liverpool 1 : 1 Bolton Wanderers DetailsWednesday 09/1/2002
English Premier League
2002/1/9
FC Southampton 2 : 0 Liverpool DetailsSunday 13/1/2002
English Premier League
2002/1/13
Arsenal FC 1 : 1 Liverpool DetailsSaturday 19/1/2002
English Premier League
2002/1/19
Liverpool 1 : 1 FC Southampton DetailsTuesday 22/1/2002
English Premier League
2002/1/22
Manchester United 0 : 1 Liverpool DetailsSunday 27/1/2002
FA Cup
2002/1/27
Arsenal FC 1 : 0 Liverpool DetailsWednesday 30/1/2002
English Premier League
2002/1/30
Liverpool 1 : 0 Leicester City DetailsSunday 03/2/2002
English Premier League
2002/2/3
Leeds United FC 0 : 4 Liverpool DetailsSaturday 09/2/2002
English Premier League
2002/2/9
Ipswich Town FC 0 : 6 Liverpool DetailsWednesday 20/2/2002
UEFA Champions League
2002/2/20
Liverpool - England 0 : 0 Galatasaray SK - Turkey Raund 2 Groups
Round # 3
DetailsSaturday 23/2/2002
English Premier League
2002/2/23
Liverpool 1 : 1 Everton FC DetailsTuesday 26/2/2002
UEFA Champions League
2002/2/26
Galatasaray SK - Turkey 1 : 1 Liverpool - England Raund 2 Groups
Round # 4
DetailsSaturday 02/3/2002
English Premier League
2002/3/2
Fulham FC 0 : 2 Liverpool DetailsWednesday 06/3/2002
English Premier League
2002/3/6
Liverpool 3 : 0 Newcastle United FC DetailsWednesday 13/3/2002
UEFA Champions League
2002/3/13
FC Barcelona - Spain 0 : 0 Liverpool - England Raund 2 Groups
Round # 5
DetailsSaturday 16/3/2002
English Premier League
2002/3/16
Middlesbrough 1 : 2 Liverpool DetailsTuesday 19/3/2002
UEFA Champions League
2002/3/19
Liverpool - England 2 : 0 AS Roma - Italy Raund 2 Groups
Round # 6
DetailsSunday 24/3/2002
English Premier League
2002/3/24
Liverpool 1 : 0 Chelsea DetailsSaturday 30/3/2002
English Premier League
2002/3/30
Liverpool 2 : 0 Charlton Athletic FC DetailsWednesday 03/4/2002
UEFA Champions League
2002/4/3
Liverpool - England 1 : 0 Bayer 04 Leverkusen - Germany Quarterfinals
DetailsTuesday 09/4/2002
UEFA Champions League
2002/4/9
Bayer 04 Leverkusen - Germany 4 : 2 Liverpool - England Quarterfinals
DetailsSaturday 13/4/2002
English Premier League
2002/4/13
AFC Sunderland 0 : 1 Liverpool DetailsSaturday 20/4/2002
English Premier League
2002/4/20
Liverpool 2 : 0 Derby County FC DetailsSaturday 27/4/2002
English Premier League
2002/4/27
Tottenham Hotspur 1 : 0 Liverpool DetailsWednesday 08/5/2002
English Premier League
2002/5/8
Liverpool 4 : 3 Blackburn Rovers FC DetailsSaturday 11/5/2002
English Premier League
2002/5/11
Liverpool 5 : 0 Ipswich Town FC DetailsFriday 02/8/2002
Trofeo Santiago Bernabeu
2002/8/2
Real Madrid CF - Spain 2 : 0 Liverpool - England DetailsSunday 04/8/2002
Trofeo Santiago Bernabeu
2002/8/4
Liverpool - England 2 : 1 AC Milan - Italy Thrd Place
DetailsSunday 11/8/2002
FA Community Shield
2002/8/11
Arsenal FC 1 : 0 Liverpool DetailsSunday 18/8/2002
English Premier League
2002/8/18
Aston Villa 0 : 1 Liverpool DetailsSaturday 24/8/2002
English Premier League
2002/8/24
Liverpool 3 : 0 FC Southampton DetailsWednesday 28/8/2002
English Premier League
2002/8/28
Blackburn Rovers FC 2 : 2 Liverpool DetailsMonday 02/9/2002
English Premier League
2002/9/2
Liverpool 2 : 2 Newcastle United FC DetailsWednesday 11/9/2002
English Premier League
2002/9/11
Liverpool 2 : 2 Birmingham City FC DetailsSaturday 14/9/2002
English Premier League
2002/9/14
Bolton Wanderers 2 : 3 Liverpool DetailsTuesday 17/9/2002
UEFA Champions League
2002/9/17
Valencia C.F - Spain 2 : 0 Liverpool - England Raund 1 Groups
Round # 1
DetailsSaturday 21/9/2002
English Premier League
2002/9/21
Liverpool 2 : 0 West Bromwich Albion FC DetailsWednesday 25/9/2002
UEFA Champions League
2002/9/25
Liverpool - England 1 : 1 FC Basel 1893 - Switzerland Raund 1 Groups
Round # 2
DetailsSaturday 28/9/2002
English Premier League
2002/9/28
Manchester City 0 : 3 Liverpool DetailsWednesday 02/10/2002
UEFA Champions League
2002/10/2
Liverpool - England 5 : 0 Spartak Moscow - Russia Raund 1 Groups
Round # 3
DetailsSunday 06/10/2002
English Premier League
2002/10/6
Liverpool 1 : 0 Chelsea DetailsSaturday 19/10/2002
English Premier League
2002/10/19
Leeds United FC 0 : 1 Liverpool DetailsTuesday 22/10/2002
UEFA Champions League
2002/10/22
Spartak Moscow - Russia 1 : 3 Liverpool - England Raund 1 Groups
Round # 4
DetailsSaturday 26/10/2002
English Premier League
2002/10/26
Liverpool 2 : 1 Tottenham Hotspur DetailsWednesday 30/10/2002
UEFA Champions League
2002/10/30
Liverpool - England 0 : 1 Valencia C.F - Spain Raund 1 Groups
Round # 5
DetailsSaturday 02/11/2002
English Premier League
2002/11/2
Liverpool 2 : 0 West Ham United DetailsWednesday 06/11/2002
English League Cup
2002/11/6
Liverpool 3 : 1 FC Southampton Round 4
DetailsSaturday 09/11/2002
English Premier League
2002/11/9
Middlesbrough 1 : 0 Liverpool DetailsTuesday 12/11/2002
UEFA Champions League
2002/11/12
FC Basel 1893 - Switzerland 3 : 3 Liverpool - England Raund 1 Groups
Round # 6
DetailsSunday 17/11/2002
English Premier League
2002/11/17
Liverpool 0 : 0 AFC Sunderland DetailsSaturday 23/11/2002
English Premier League
2002/11/23
Fulham FC 3 : 2 Liverpool DetailsThursday 28/11/2002
UEFA Cup
2002/11/28
Vitesse Arnhem - Netherlands 0 : 1 Liverpool - England Round 3
DetailsSunday 01/12/2002
English Premier League
2002/12/1
Liverpool 1 : 2 Manchester United DetailsWednesday 04/12/2002
English League Cup
2002/12/4
Liverpool 1 : 1 Ipswich Town FC Quarterfinals
DetailsSaturday 07/12/2002
English Premier League
2002/12/7
Charlton Athletic FC 2 : 0 Liverpool DetailsThursday 12/12/2002
UEFA Cup
2002/12/12
Liverpool - England 1 : 0 Vitesse Arnhem - Netherlands Round 3
DetailsSunday 15/12/2002
English Premier League
2002/12/15
AFC Sunderland 2 : 1 Liverpool DetailsWednesday 18/12/2002
English League Cup
2002/12/18
Aston Villa 3 : 4 Liverpool Quarterfinals
DetailsSunday 22/12/2002
English Premier League
2002/12/22
Liverpool 0 : 0 Everton FC DetailsThursday 26/12/2002
English Premier League
2002/12/26
Liverpool 1 : 1 Blackburn Rovers FC DetailsSunday 29/12/2002
English Premier League
2002/12/29
Arsenal FC 1 : 1 Liverpool DetailsWednesday 01/1/2003
English Premier League
2003/1/1
Newcastle United FC 1 : 0 Liverpool DetailsWednesday 08/1/2003
English League Cup
2003/1/8
Sheffield United FC 2 : 1 Liverpool Semifinals
DetailsSaturday 11/1/2003
English Premier League
2003/1/11
Liverpool 1 : 1 Aston Villa DetailsSaturday 18/1/2003
English Premier League
2003/1/18
FC Southampton 0 : 1 Liverpool DetailsTuesday 21/1/2003
English League Cup
2003/1/21
Liverpool 2 : 0 Sheffield United FC Semifinals
After extra time
DetailsSunday 26/1/2003
FA Cup
2003/1/26
Crystal Palace FC 0 : 0 Liverpool DetailsWednesday 29/1/2003
English Premier League
2003/1/29
Liverpool 2 : 2 Arsenal FC DetailsSunday 02/2/2003
English Premier League
2003/2/2
West Ham United 0 : 3 Liverpool DetailsWednesday 05/2/2003
FA Cup
2003/2/5
Liverpool 0 : 2 Crystal Palace FC Replayed Game
DetailsSaturday 08/2/2003
English Premier League
2003/2/8
Liverpool 1 : 1 Middlesbrough DetailsThursday 20/2/2003
UEFA Cup
2003/2/20
Auxerre - France 0 : 1 Liverpool - England Round 4
DetailsSunday 23/2/2003
English Premier League
2003/2/23
Birmingham City FC 2 : 1 Liverpool DetailsThursday 27/2/2003
UEFA Cup
2003/2/27
Liverpool - England 2 : 0 Auxerre - France Round 4
DetailsSunday 02/3/2003
English League Cup
2003/3/2
Liverpool 2 : 0 Manchester United Final
DetailsSaturday 08/3/2003
English Premier League
2003/3/8
Liverpool 2 : 0 Bolton Wanderers DetailsThursday 13/3/2003
UEFA Cup
2003/3/13
Celtic Glasgow - Scotland 1 : 1 Liverpool - England Quarterfinals
DetailsSunday 16/3/2003
English Premier League
2003/3/16
Tottenham Hotspur 2 : 3 Liverpool DetailsThursday 20/3/2003
UEFA Cup
2003/3/20
Liverpool - England 0 : 2 Celtic Glasgow - Scotland Quarterfinals
DetailsSunday 23/3/2003
English Premier League
2003/3/23
Liverpool 3 : 1 Leeds United FC DetailsSaturday 05/4/2003
English Premier League
2003/4/5
Manchester United 4 : 0 Liverpool DetailsSaturday 12/4/2003
English Premier League
2003/4/12
Liverpool 2 : 0 Fulham FC DetailsSaturday 19/4/2003
English Premier League
2003/4/19
Everton FC 1 : 2 Liverpool DetailsMonday 21/4/2003
English Premier League
2003/4/21
Liverpool 2 : 1 Charlton Athletic FC DetailsSaturday 26/4/2003
English Premier League
2003/4/26
West Bromwich Albion FC 0 : 6 Liverpool DetailsSaturday 03/5/2003
English Premier League
2003/5/3
Liverpool 1 : 2 Manchester City DetailsSunday 11/5/2003
English Premier League
2003/5/11
Chelsea 2 : 1 Liverpool DetailsWednesday 16/7/2003
Friendlies - Clubs - 2003
2003/7/16
Liverpool - England 3 : 1 1. FC Koln - Germany DetailsSaturday 19/7/2003
Friendlies - Clubs - 2003
2003/7/19
Liverpool - England 1 : 1 Crewe Alexandra FC - England DetailsThursday 24/7/2003
Friendlies - Clubs - 2003
2003/7/24
Liverpool - England 3 : 1 Thailand DetailsFriday 01/8/2003
Amsterdam Intl.
2003/8/1
Ajax Amsterdam 0 : 0 Liverpool DetailsSunday 03/8/2003
Amsterdam Intl.
2003/8/3
Galatasaray SK 2 : 1 Liverpool DetailsTuesday 05/8/2003
Friendlies - Clubs - 2003
2003/8/5
Liverpool - England 5 : 1 Aberdeen F.C - Scotland DetailsSaturday 09/8/2003
Friendlies - Clubs - 2003
2003/8/9
Liverpool - England 0 : 2 Valencia C.F - Spain DetailsSunday 17/8/2003
English Premier League
2003/8/17
Liverpool 1 : 2 Chelsea DetailsSunday 24/8/2003
English Premier League
2003/8/24
Aston Villa 0 : 0 Liverpool DetailsWednesday 27/8/2003
English Premier League
2003/8/27
Liverpool 0 : 0 Tottenham Hotspur DetailsSaturday 30/8/2003
English Premier League
2003/8/30
Everton FC 0 : 3 Liverpool DetailsSaturday 13/9/2003
English Premier League
2003/9/13
Blackburn Rovers FC 1 : 3 Liverpool DetailsSaturday 20/9/2003
English Premier League
2003/9/20
Liverpool 2 : 1 Leicester City DetailsWednesday 24/9/2003
UEFA Cup
2003/9/24
NK Olimpija Ljubljana 1 : 1 Liverpool Round 1
DetailsSunday 28/9/2003
English Premier League
2003/9/28
Charlton Athletic FC 3 : 2 Liverpool DetailsSaturday 04/10/2003
English Premier League
2003/10/4
Liverpool 1 : 2 Arsenal FC DetailsWednesday 15/10/2003
UEFA Cup
2003/10/15
Liverpool 3 : 0 NK Olimpija Ljubljana Round 1
DetailsSaturday 18/10/2003
English Premier League
2003/10/18
Portsmouth 1 : 0 Liverpool DetailsSaturday 25/10/2003
English Premier League
2003/10/25
Liverpool 3 : 1 Leeds United FC DetailsWednesday 29/10/2003
English League Cup
2003/10/29
Blackburn Rovers FC 3 : 4 Liverpool Round 3
DetailsSunday 02/11/2003
English Premier League
2003/11/2
Fulham FC 1 : 2 Liverpool DetailsThursday 06/11/2003
UEFA Cup
2003/11/6
FCSB Steaua Bucarest 1 : 1 Liverpool Round 2
DetailsSunday 09/11/2003
English Premier League
2003/11/9
Liverpool 1 : 2 Manchester United DetailsSaturday 22/11/2003
English Premier League
2003/11/22
Middlesbrough 0 : 0 Liverpool DetailsThursday 27/11/2003
UEFA Cup
2003/11/27
Liverpool 1 : 0 FCSB Steaua Bucarest Round 2
DetailsSunday 30/11/2003
English Premier League
2003/11/30
Liverpool 3 : 1 Birmingham City FC DetailsWednesday 03/12/2003
English League Cup
2003/12/3
Liverpool 2 : 3 Bolton Wanderers Round 4
DetailsSaturday 06/12/2003
English Premier League
2003/12/6
Newcastle United FC 1 : 1 Liverpool DetailsSaturday 13/12/2003
English Premier League
2003/12/13
Liverpool 1 : 2 FC Southampton DetailsFriday 26/12/2003
English Premier League
2003/12/26
Liverpool 3 : 1 Bolton Wanderers DetailsSunday 28/12/2003
English Premier League
2003/12/28
Manchester City 2 : 2 Liverpool DetailsSunday 04/1/2004
FA Cup
2004/1/4
Yeovil Town 0 : 2 Liverpool Stage 3
DetailsWednesday 07/1/2004
English Premier League
2004/1/7
Chelsea 0 : 1 Liverpool DetailsSaturday 10/1/2004
English Premier League
2004/1/10
Liverpool 1 : 0 Aston Villa DetailsSaturday 17/1/2004
English Premier League
2004/1/17
Tottenham Hotspur 2 : 1 Liverpool DetailsWednesday 21/1/2004
English Premier League
2004/1/21
Wolverhampton Wanderers FC 1 : 1 Liverpool DetailsSaturday 24/1/2004
FA Cup
2004/1/24
Liverpool 2 : 1 Newcastle United FC Stage 4
DetailsSaturday 31/1/2004
English Premier League
2004/1/31
Liverpool 0 : 0 Everton FC DetailsSaturday 07/2/2004
English Premier League
2004/2/7
Bolton Wanderers 2 : 2 Liverpool DetailsWednesday 11/2/2004
English Premier League
2004/2/11
Liverpool 2 : 1 Manchester City DetailsSunday 15/2/2004
FA Cup
2004/2/15
Liverpool 1 : 1 Portsmouth 1/8 Finals
DetailsSunday 22/2/2004
FA Cup
2004/2/22
Portsmouth 1 : 0 Liverpool 1/8 Finals
Replayed Game
DetailsThursday 26/2/2004
UEFA Cup
2004/2/26
Liverpool 2 : 0 PFC Levski Sofia Round 3
DetailsSunday 29/2/2004
English Premier League
2004/2/29
Leeds United FC 2 : 2 Liverpool DetailsWednesday 03/3/2004
UEFA Cup
2004/3/3
PFC Levski Sofia 2 : 4 Liverpool Round 3
DetailsThursday 11/3/2004
UEFA Cup
2004/3/11
Liverpool 1 : 1 Olympique Marseille Round 4
DetailsSunday 14/3/2004
English Premier League
2004/3/14
FC Southampton 2 : 0 Liverpool DetailsWednesday 17/3/2004
English Premier League
2004/3/17
Liverpool 3 : 0 Portsmouth DetailsSaturday 20/3/2004
English Premier League
2004/3/20
Liverpool 1 : 0 Wolverhampton Wanderers FC DetailsThursday 25/3/2004
UEFA Cup
2004/3/25
Olympique Marseille 2 : 1 Liverpool Round 4
DetailsSunday 28/3/2004
English Premier League
2004/3/28
Leicester City 0 : 0 Liverpool DetailsSunday 04/4/2004
English Premier League
2004/4/4
Liverpool 4 : 0 Blackburn Rovers FC DetailsFriday 09/4/2004
English Premier League
2004/4/9
Arsenal FC 4 : 2 Liverpool DetailsMonday 12/4/2004
English Premier League
2004/4/12
Liverpool 0 : 1 Charlton Athletic FC DetailsSaturday 17/4/2004
English Premier League
2004/4/17
Liverpool 0 : 0 Fulham FC DetailsSaturday 24/4/2004
English Premier League
2004/4/24
Manchester United 0 : 1 Liverpool DetailsSunday 02/5/2004
English Premier League
2004/5/2
Liverpool 2 : 0 Middlesbrough DetailsSaturday 08/5/2004
English Premier League
2004/5/8
Birmingham City FC 0 : 3 Liverpool DetailsSaturday 15/5/2004
English Premier League
2004/5/15
Liverpool 1 : 1 Newcastle United FC DetailsWednesday 21/7/2004
Friendlies - Clubs
2004/7/21
Wrexham FC - First - England 1 : 2 Liverpool - First - England DetailsTuesday 27/7/2004
US ChampionsWorld Series
2004/7/27
Celtic Glasgow - Scotland 1 : 5 Liverpool - England DetailsSaturday 31/7/2004
US ChampionsWorld Series
2004/7/31
FC Porto - Portugal 1 : 0 Liverpool - England DetailsWednesday 04/8/2004
US ChampionsWorld Series
2004/8/4
AS Roma - Italy 1 : 2 Liverpool - England DetailsTuesday 10/8/2004
UEFA Champions League
2004/8/10
Grazer AK - Austria 0 : 2 Liverpool - England Qualifying 3
DetailsSaturday 14/8/2004
English Premier League
2004/8/14
Tottenham Hotspur 1 : 1 Liverpool Week # 1
DetailsSaturday 21/8/2004
English Premier League
2004/8/21
Liverpool 2 : 1 Manchester City Week # 2
DetailsTuesday 24/8/2004
UEFA Champions League
2004/8/24
Liverpool - England 0 : 1 Grazer AK - Austria Qualifying 3
DetailsSunday 29/8/2004
English Premier League
2004/8/29
Bolton Wanderers 1 : 0 Liverpool Week # 4
DetailsSaturday 11/9/2004
English Premier League
2004/9/11
Liverpool 3 : 0 West Bromwich Albion FC Week # 5
DetailsWednesday 15/9/2004
UEFA Champions League
2004/9/15
Liverpool - England 2 : 0 AS Monaco FC - France Groups
Round # 1
DetailsMonday 20/9/2004
English Premier League
2004/9/20
Manchester United 2 : 1 Liverpool Week # 6
DetailsSaturday 25/9/2004
English Premier League
2004/9/25
Liverpool 3 : 0 Norwich City Week # 7
DetailsTuesday 28/9/2004
UEFA Champions League
2004/9/28
Olympiacos Piraeus - Greece 1 : 0 Liverpool - England Groups
Round # 2
DetailsSunday 03/10/2004
English Premier League
2004/10/3
Chelsea 1 : 0 Liverpool Week # 8
DetailsSaturday 16/10/2004
English Premier League
2004/10/16
Fulham FC 2 : 4 Liverpool Week # 9
DetailsTuesday 19/10/2004
UEFA Champions League
2004/10/19
Liverpool - England 0 : 0 Deportivo La Coruna - Spain Groups
Round # 3
DetailsSaturday 23/10/2004
English Premier League
2004/10/23
Liverpool 2 : 0 Charlton Athletic FC Week # 10
DetailsTuesday 26/10/2004
English League Cup
2004/10/26
Millwall FC 0 : 3 Liverpool Round 3
DetailsSaturday 30/10/2004
English Premier League
2004/10/30
Blackburn Rovers FC 2 : 2 Liverpool Week # 11
DetailsWednesday 03/11/2004
UEFA Champions League
2004/11/3
Deportivo La Coruna - Spain 0 : 1 Liverpool - England Groups
Round # 4
DetailsSaturday 06/11/2004
English Premier League
2004/11/6
Liverpool 0 : 1 Birmingham City FC Week # 12
DetailsWednesday 10/11/2004
English League Cup
2004/11/10
Liverpool 2 : 0 Middlesbrough Round 4
DetailsSaturday 13/11/2004
English Premier League
2004/11/13
Liverpool 3 : 2 Crystal Palace FC Week # 13
DetailsSaturday 20/11/2004
English Premier League
2004/11/20
Middlesbrough 2 : 0 Liverpool Week # 14
DetailsTuesday 23/11/2004
UEFA Champions League
2004/11/23
AS Monaco FC - France 1 : 0 Liverpool - England Groups
Round # 5
DetailsSunday 28/11/2004
English Premier League
2004/11/28
Liverpool 2 : 1 Arsenal FC Week # 15
DetailsWednesday 01/12/2004
English League Cup
2004/12/1
Tottenham Hotspur 1 : 1
3 : 4
Liverpool Quarterfinals
Penalty Kicks
DetailsSaturday 04/12/2004
English Premier League
2004/12/4
Aston Villa 1 : 1 Liverpool Week # 16
DetailsWednesday 08/12/2004
UEFA Champions League
2004/12/8
Liverpool - England 3 : 1 Olympiacos Piraeus - Greece Groups
Round # 6
DetailsSaturday 11/12/2004
English Premier League
2004/12/11
Everton FC 1 : 0 Liverpool Week # 17
DetailsTuesday 14/12/2004
English Premier League
2004/12/14
Liverpool 1 : 1 Portsmouth Week # 3
DetailsSunday 19/12/2004
English Premier League
2004/12/19
Liverpool 3 : 1 Newcastle United FC Week # 18
DetailsSunday 26/12/2004
English Premier League
2004/12/26
West Bromwich Albion FC 0 : 5 Liverpool Week # 19
DetailsTuesday 28/12/2004
English Premier League
2004/12/28
Liverpool 1 : 0 FC Southampton Week # 20
DetailsSaturday 01/1/2005
English Premier League
2005/1/1
Liverpool 0 : 1 Chelsea Week # 21
DetailsMonday 03/1/2005
English Premier League
2005/1/3
Norwich City 1 : 2 Liverpool Week # 22
DetailsTuesday 11/1/2005
English League Cup
2005/1/11
Liverpool 1 : 0 Watford Semifinals
DetailsSaturday 15/1/2005
English Premier League
2005/1/15
Liverpool 0 : 1 Manchester United Week # 23
DetailsTuesday 18/1/2005
FA Cup
2005/1/18
Burnley FC 1 : 0 Liverpool Stage 3
DetailsSaturday 22/1/2005
English Premier League
2005/1/22
FC Southampton 2 : 0 Liverpool Week # 24
DetailsTuesday 25/1/2005
English League Cup
2005/1/25
Watford 0 : 1 Liverpool Semifinals
DetailsTuesday 01/2/2005
English Premier League
2005/2/1
Charlton Athletic FC 1 : 2 Liverpool Week # 25
DetailsSaturday 05/2/2005
English Premier League
2005/2/5
Liverpool 3 : 1 Fulham FC Week # 26
DetailsSaturday 12/2/2005
English Premier League
2005/2/12
Birmingham City FC 2 : 0 Liverpool Week # 27
DetailsTuesday 22/2/2005
UEFA Champions League
2005/2/22
Liverpool - England 3 : 1 Bayer 04 Leverkusen - Germany Knockout
DetailsSunday 27/2/2005
English League Cup
2005/2/27
Liverpool 2 : 3 Chelsea Final
After extra time
DetailsSaturday 05/3/2005
English Premier League
2005/3/5
Newcastle United FC 1 : 0 Liverpool Week # 29
DetailsWednesday 09/3/2005
UEFA Champions League
2005/3/9
Bayer 04 Leverkusen - Germany 1 : 3 Liverpool - England Knockout
DetailsWednesday 16/3/2005
English Premier League
2005/3/16
Liverpool 0 : 0 Blackburn Rovers FC Week # 28
DetailsSunday 20/3/2005
English Premier League
2005/3/20
Liverpool 2 : 1 Everton FC Week # 30
DetailsSaturday 02/4/2005
English Premier League
2005/4/2
Liverpool 1 : 0 Bolton Wanderers Week # 31
DetailsTuesday 05/4/2005
UEFA Champions League
2005/4/5
Liverpool - England 2 : 1 Juventus FC - Italy Quarterfinals
DetailsSaturday 09/4/2005
English Premier League
2005/4/9
Manchester City 1 : 0 Liverpool Week # 32
DetailsWednesday 13/4/2005
UEFA Champions League
2005/4/13
Juventus FC - Italy 0 : 0 Liverpool - England Quarterfinals
DetailsSaturday 16/4/2005
English Premier League
2005/4/16
Liverpool 2 : 2 Tottenham Hotspur Week # 33
DetailsWednesday 20/4/2005
English Premier League
2005/4/20
Portsmouth 1 : 2 Liverpool Week # 34
DetailsSaturday 23/4/2005
English Premier League
2005/4/23
Crystal Palace FC 1 : 0 Liverpool Week # 35
DetailsWednesday 27/4/2005
UEFA Champions League
2005/4/27
Chelsea - England 0 : 0 Liverpool - England Semifinals
DetailsSaturday 30/4/2005
English Premier League
2005/4/30
Liverpool 1 : 1 Middlesbrough Week # 36
DetailsTuesday 03/5/2005
UEFA Champions League
2005/5/3
Liverpool - England 1 : 0 Chelsea - England Semifinals
DetailsSunday 08/5/2005
English Premier League
2005/5/8
Arsenal FC 3 : 1 Liverpool Week # 37
DetailsSunday 15/5/2005
English Premier League
2005/5/15
Liverpool 2 : 1 Aston Villa Week # 38
DetailsWednesday 25/5/2005
UEFA Champions League
2005/5/25
AC Milan - Italy 3 : 3
2 : 3
Liverpool - England Final
Penalty Kicks
DetailsWednesday 13/7/2005
UEFA Champions League
2005/7/13
Liverpool - England 3 : 0 The New Saints - Wales DetailsSaturday 16/7/2005
Friendlies - Clubs
2005/7/16
Bayer 04 Leverkusen - Germany 0 : 3 Liverpool - England DetailsTuesday 19/7/2005
UEFA Champions League
2005/7/19
The New Saints - Wales 0 : 3 Liverpool - England DetailsSaturday 23/7/2005
Friendlies - Clubs
2005/7/23
Olympiacos Piraeus - Greece 3 : 4 Liverpool - England DetailsTuesday 26/7/2005
UEFA Champions League
2005/7/26
FBK Kaunas - Lithuania 1 : 3 Liverpool - England Qualifying 2
DetailsTuesday 02/8/2005
UEFA Champions League
2005/8/2
Liverpool - England 2 : 0 FBK Kaunas - Lithuania Qualifying 2
DetailsWednesday 10/8/2005
UEFA Champions League
2005/8/10
CSKA Sofia - Bulgaria 1 : 3 Liverpool - England Qualifying 3
DetailsSaturday 13/8/2005
English Premier League
2005/8/13
Middlesbrough 0 : 0 Liverpool Week # 1
DetailsSaturday 20/8/2005
English Premier League
2005/8/20
Liverpool 1 : 0 AFC Sunderland Week # 2
DetailsTuesday 23/8/2005
UEFA Champions League
2005/8/23
Liverpool - England 0 : 1 CSKA Sofia - Bulgaria Qualifying 3
DetailsFriday 26/8/2005
UEFA Super Cup
2005/8/26
Liverpool - England 3 : 1 CSKA Moscow - Russia After extra time
DetailsSaturday 10/9/2005
English Premier League
2005/9/10
Tottenham Hotspur 0 : 0 Liverpool Week # 5
DetailsTuesday 13/9/2005
UEFA Champions League
2005/9/13
Real Betis - Spain 1 : 2 Liverpool - England Groups
Round # 1
DetailsSunday 18/9/2005
English Premier League
2005/9/18
Liverpool 0 : 0 Manchester United Week # 6
DetailsSaturday 24/9/2005
English Premier League
2005/9/24
Birmingham City FC 2 : 2 Liverpool Week # 7
DetailsWednesday 28/9/2005
UEFA Champions League
2005/9/28
Liverpool - England 0 : 0 Chelsea - England Groups
Round # 2
DetailsSunday 02/10/2005
English Premier League
2005/10/2
Liverpool 1 : 4 Chelsea Week # 8
DetailsSaturday 15/10/2005
English Premier League
2005/10/15
Liverpool 1 : 0 Blackburn Rovers FC Week # 9
DetailsWednesday 19/10/2005
UEFA Champions League
2005/10/19
RSC Anderlecht - Belgium 0 : 1 Liverpool - England Groups
Round # 3
DetailsSaturday 22/10/2005
English Premier League
2005/10/22
Fulham FC 2 : 0 Liverpool Week # 10
DetailsTuesday 25/10/2005
English League Cup
2005/10/25
Crystal Palace FC 2 : 1 Liverpool Round 3
DetailsSaturday 29/10/2005
English Premier League
2005/10/29
Liverpool 2 : 0 West Ham United Week # 11
DetailsTuesday 01/11/2005
UEFA Champions League
2005/11/1
Liverpool - England 3 : 0 RSC Anderlecht - Belgium Groups
Round # 4
DetailsSaturday 05/11/2005
English Premier League
2005/11/5
Aston Villa 0 : 2 Liverpool Week # 12
DetailsSaturday 19/11/2005
English Premier League
2005/11/19
Liverpool 3 : 0 Portsmouth Week # 13
DetailsWednesday 23/11/2005
UEFA Champions League
2005/11/23
Liverpool - England 0 : 0 Real Betis - Spain Groups
Round # 5
DetailsSaturday 26/11/2005
English Premier League
2005/11/26
Manchester City 0 : 1 Liverpool Week # 14
DetailsWednesday 30/11/2005
English Premier League
2005/11/30
AFC Sunderland 0 : 2 Liverpool Week # 17
DetailsSaturday 03/12/2005
English Premier League
2005/12/3
Liverpool 3 : 0 Wigan Athletic Week # 15
DetailsTuesday 06/12/2005
UEFA Champions League
2005/12/6
Chelsea - England 0 : 0 Liverpool - England Groups
Round # 6
DetailsSaturday 10/12/2005
English Premier League
2005/12/10
Liverpool 2 : 0 Middlesbrough Week # 16
DetailsThursday 15/12/2005
FIFA Club World Championship
2005/12/15
Deportivo Saprissa - Costa Rica 0 : 3 Liverpool - England Semi Finals
DetailsSunday 18/12/2005
FIFA Club World Championship
2005/12/18
Sao Paulo Futebol Clube - Brazil 1 : 0 Liverpool - England Final
DetailsMonday 26/12/2005
English Premier League
2005/12/26
Liverpool 2 : 0 Newcastle United FC Week # 18
DetailsWednesday 28/12/2005
English Premier League
2005/12/28
Everton FC 1 : 3 Liverpool Week # 19
DetailsSaturday 31/12/2005
English Premier League
2005/12/31
Liverpool 1 : 0 West Bromwich Albion FC Week # 20
DetailsMonday 02/1/2006
English Premier League
2006/1/2
Bolton Wanderers 2 : 2 Liverpool Week # 21
DetailsSaturday 07/1/2006
FA Cup
2006/1/7
Luton Town 3 : 5 Liverpool Stage 3
DetailsSaturday 14/1/2006
English Premier League
2006/1/14
Liverpool 1 : 0 Tottenham Hotspur Week # 22
DetailsSunday 22/1/2006
English Premier League
2006/1/22
Manchester United 1 : 0 Liverpool Week # 23
DetailsSunday 29/1/2006
FA Cup
2006/1/29
Portsmouth 1 : 2 Liverpool Stage 4
DetailsWednesday 01/2/2006
English Premier League
2006/2/1
Liverpool 1 : 1 Birmingham City FC Week # 24
DetailsSunday 05/2/2006
English Premier League
2006/2/5
Chelsea 2 : 0 Liverpool Week # 25
DetailsWednesday 08/2/2006
English Premier League
2006/2/8
Charlton Athletic FC 2 : 0 Liverpool Week # 3
DetailsSaturday 11/2/2006
English Premier League
2006/2/11
Wigan Athletic 0 : 1 Liverpool Week # 26
DetailsTuesday 14/2/2006
English Premier League
2006/2/14
Liverpool 1 : 0 Arsenal FC Week # 4
DetailsSaturday 18/2/2006
FA Cup
2006/2/18
Liverpool 1 : 0 Manchester United 1/8 Finals
DetailsTuesday 21/2/2006
UEFA Champions League
2006/2/21
SL Benfica - Portugal 1 : 0 Liverpool - England Knockout
DetailsSunday 26/2/2006
English Premier League
2006/2/26
Liverpool 1 : 0 Manchester City Week # 27
DetailsSaturday 04/3/2006
English Premier League
2006/3/4
Liverpool 0 : 0 Charlton Athletic FC Week # 28
DetailsWednesday 08/3/2006
UEFA Champions League
2006/3/8
Liverpool - England 0 : 2 SL Benfica - Portugal Knockout
DetailsSunday 12/3/2006
English Premier League
2006/3/12
Arsenal FC 2 : 1 Liverpool Week # 29
DetailsWednesday 15/3/2006
English Premier League
2006/3/15
Liverpool 5 : 1 Fulham FC Week # 35
DetailsSunday 19/3/2006
English Premier League
2006/3/19
Newcastle United FC 1 : 3 Liverpool Week # 30
DetailsTuesday 21/3/2006
FA Cup
2006/3/21
Birmingham City FC 0 : 7 Liverpool Quarterfinals
DetailsSaturday 25/3/2006
English Premier League
2006/3/25
Liverpool 3 : 1 Everton FC Week # 31
DetailsSaturday 01/4/2006
English Premier League
2006/4/1
West Bromwich Albion FC 0 : 2 Liverpool Week # 32
DetailsSunday 09/4/2006
English Premier League
2006/4/9
Liverpool 1 : 0 Bolton Wanderers Week # 33
DetailsSunday 16/4/2006
English Premier League
2006/4/16
Blackburn Rovers FC 0 : 1 Liverpool Week # 34
DetailsSaturday 22/4/2006
FA Cup
2006/4/22
Chelsea 1 : 2 Liverpool Semifinals
DetailsWednesday 26/4/2006
English Premier League
2006/4/26
West Ham United 1 : 2 Liverpool Week # 36
DetailsSaturday 29/4/2006
English Premier League
2006/4/29
Liverpool 3 : 1 Aston Villa Week # 37
DetailsSunday 07/5/2006
English Premier League
2006/5/7
Portsmouth 1 : 3 Liverpool Week # 38
DetailsSaturday 13/5/2006
FA Cup
2006/5/13
Liverpool 3 : 3
3 : 1
West Ham United Final
Penalty Kicks
DetailsSaturday 15/7/2006
Friendlies - Clubs
2006/7/15
Wrexham FC - England 0 : 2 Liverpool - England DetailsSaturday 22/7/2006
Friendlies - Clubs
2006/7/22
Crewe Alexandra FC - England 0 : 1 Liverpool - England DetailsSaturday 29/7/2006
Friendlies - Clubs
2006/7/29
1. FC Kaiserslautern - Germany 3 : 2 Liverpool - England DetailsTuesday 01/8/2006
Friendlies - Clubs
2006/8/1
Grasshoppers - Switzerland 2 : 0 Liverpool - England DetailsFriday 04/8/2006
Friendlies - Clubs
2006/8/4
FSV Mainz 05 - Germany 5 : 0 Liverpool - England DetailsWednesday 09/8/2006
UEFA Champions League
2006/8/9
Liverpool - England 2 : 1 Maccabi Haifa - Israel Qualifying 3
DetailsSunday 13/8/2006
FA Community Shield
2006/8/13
Chelsea 1 : 2 Liverpool DetailsSaturday 19/8/2006
English Premier League
2006/8/19
Sheffield United FC 1 : 1 Liverpool Week # 1
DetailsTuesday 22/8/2006
UEFA Champions League
2006/8/22
Maccabi Haifa - Israel 1 : 1 Liverpool - England Qualifying 3
DetailsSaturday 26/8/2006
English Premier League
2006/8/26
Liverpool 2 : 1 West Ham United Week # 3
DetailsSaturday 09/9/2006
English Premier League
2006/9/9
Everton FC 3 : 0 Liverpool Week # 4
DetailsTuesday 12/9/2006
UEFA Champions League
2006/9/12
PSV Eindhoven - Netherlands 0 : 0 Liverpool - England Groups
Round # 1
DetailsSunday 17/9/2006
English Premier League
2006/9/17
Chelsea 1 : 0 Liverpool Week # 5
DetailsWednesday 20/9/2006
English Premier League
2006/9/20
Liverpool 2 : 0 Newcastle United FC Week # 2
DetailsSaturday 23/9/2006
English Premier League
2006/9/23
Liverpool 3 : 0 Tottenham Hotspur Week # 6
DetailsWednesday 27/9/2006
UEFA Champions League
2006/9/27
Liverpool - England 3 : 2 Galatasaray SK - Turkey Groups
Round # 2
DetailsSaturday 30/9/2006
English Premier League
2006/9/30
Bolton Wanderers 2 : 0 Liverpool Week # 7
DetailsSaturday 14/10/2006
English Premier League
2006/10/14
Liverpool 1 : 1 Blackburn Rovers FC Week # 8
DetailsWednesday 18/10/2006
UEFA Champions League
2006/10/18
Bordeaux - France 0 : 1 Liverpool - England Groups
Round # 3
DetailsSunday 22/10/2006
English Premier League
2006/10/22
Manchester United 2 : 0 Liverpool Week # 9
DetailsWednesday 25/10/2006
English League Cup
2006/10/25
Liverpool 4 : 3 Reading FC Round 3
DetailsSaturday 28/10/2006
English Premier League
2006/10/28
Liverpool 3 : 1 Aston Villa Week # 10
DetailsTuesday 31/10/2006
UEFA Champions League
2006/10/31
Liverpool - England 3 : 0 Bordeaux - France Groups
Round # 4
DetailsSaturday 04/11/2006
English Premier League
2006/11/4
Liverpool 2 : 0 Reading FC Week # 11
DetailsWednesday 08/11/2006
English League Cup
2006/11/8
Birmingham City FC 0 : 1 Liverpool Round 4
DetailsSunday 12/11/2006
English Premier League
2006/11/12
Arsenal FC 3 : 0 Liverpool Week # 12
DetailsSaturday 18/11/2006
English Premier League
2006/11/18
Middlesbrough 0 : 0 Liverpool Week # 13
DetailsWednesday 22/11/2006
UEFA Champions League
2006/11/22
Liverpool - England 2 : 0 PSV Eindhoven - Netherlands Groups
Round # 5
DetailsSaturday 25/11/2006
English Premier League
2006/11/25
Liverpool 1 : 0 Manchester City Week # 14
DetailsWednesday 29/11/2006
English Premier League
2006/11/29
Liverpool 0 : 0 Portsmouth Week # 15
DetailsSaturday 02/12/2006
English Premier League
2006/12/2
Wigan Athletic 0 : 4 Liverpool Week # 16
DetailsTuesday 05/12/2006
UEFA Champions League
2006/12/5
Galatasaray SK - Turkey 3 : 2 Liverpool - England Groups
Round # 6
DetailsSaturday 09/12/2006
English Premier League
2006/12/9
Liverpool 4 : 0 Fulham FC Week # 17
DetailsSaturday 16/12/2006
English Premier League
2006/12/16
Charlton Athletic FC 0 : 3 Liverpool Week # 18
DetailsSaturday 23/12/2006
English Premier League
2006/12/23
Liverpool 2 : 0 Watford Week # 19
DetailsTuesday 26/12/2006
English Premier League
2006/12/26
Blackburn Rovers FC 1 : 0 Liverpool Week # 20
DetailsSaturday 30/12/2006
English Premier League
2006/12/30
Tottenham Hotspur 0 : 1 Liverpool Week # 21
DetailsMonday 01/1/2007
English Premier League
2007/1/1
Liverpool 3 : 0 Bolton Wanderers Week # 22
DetailsSaturday 06/1/2007
FA Cup
2007/1/6
Liverpool 1 : 3 Arsenal FC Stage 3
DetailsTuesday 09/1/2007
English League Cup
2007/1/9
Liverpool 3 : 6 Arsenal FC Quarterfinals
DetailsSaturday 13/1/2007
English Premier League
2007/1/13
Watford 0 : 3 Liverpool Week # 23
DetailsSaturday 20/1/2007
English Premier League
2007/1/20
Liverpool 2 : 0 Chelsea Week # 24
DetailsTuesday 30/1/2007
English Premier League
2007/1/30
West Ham United 1 : 2 Liverpool Week # 25
DetailsSaturday 03/2/2007
English Premier League
2007/2/3
Liverpool 0 : 0 Everton FC Week # 26
DetailsSaturday 10/2/2007
English Premier League
2007/2/10
Newcastle United FC 2 : 1 Liverpool Week # 27
DetailsWednesday 21/2/2007
UEFA Champions League
2007/2/21
FC Barcelona - Spain 1 : 2 Liverpool - England Knockout
DetailsSaturday 24/2/2007
English Premier League
2007/2/24
Liverpool 4 : 0 Sheffield United FC Week # 28
DetailsSaturday 03/3/2007
English Premier League
2007/3/3
Liverpool 0 : 1 Manchester United Week # 29
DetailsTuesday 06/3/2007
UEFA Champions League
2007/3/6
Liverpool - England 0 : 1 FC Barcelona - Spain Knockout
DetailsSunday 18/3/2007
English Premier League
2007/3/18
Aston Villa 0 : 0 Liverpool Week # 30
DetailsSaturday 31/3/2007
English Premier League
2007/3/31
Liverpool 4 : 1 Arsenal FC Week # 31
DetailsTuesday 03/4/2007
UEFA Champions League
2007/4/3
PSV Eindhoven - Netherlands 0 : 3 Liverpool - England Quarterfinals
DetailsSaturday 07/4/2007
English Premier League
2007/4/7
Reading FC 1 : 2 Liverpool Week # 32
DetailsWednesday 11/4/2007
UEFA Champions League
2007/4/11
Liverpool - England 1 : 0 PSV Eindhoven - Netherlands Quarterfinals
DetailsSaturday 14/4/2007
English Premier League
2007/4/14
Manchester City 0 : 0 Liverpool Week # 34
DetailsWednesday 18/4/2007
English Premier League
2007/4/18
Liverpool 2 : 0 Middlesbrough Week # 33
DetailsSaturday 21/4/2007
English Premier League
2007/4/21
Liverpool 2 : 0 Wigan Athletic Week # 35
DetailsWednesday 25/4/2007
UEFA Champions League
2007/4/25
Chelsea - England 1 : 0 Liverpool - England Semifinals
DetailsSaturday 28/4/2007
English Premier League
2007/4/28
Portsmouth 2 : 1 Liverpool Week # 36
DetailsTuesday 01/5/2007
UEFA Champions League
2007/5/1
Liverpool - England 1 : 0
4 : 1
Chelsea - England Semifinals
Penalty Kicks
DetailsSaturday 05/5/2007
English Premier League
2007/5/5
Fulham FC 1 : 0 Liverpool Week # 37
DetailsSunday 13/5/2007
English Premier League
2007/5/13
Liverpool 2 : 2 Charlton Athletic FC Week # 38
DetailsWednesday 23/5/2007
UEFA Champions League
2007/5/23
AC Milan - Italy 2 : 1 Liverpool - England Final
DetailsSaturday 07/7/2007
Liverpool Pre-Season
2007/7/7
Wrexham FC - England 2 : 3 Liverpool - England DetailsSaturday 14/7/2007
Liverpool Pre-Season
2007/7/14
Crewe Alexandra FC - England 0 : 3 Liverpool - England DetailsTuesday 17/7/2007
Liverpool Pre-Season
2007/7/17
SV Werder Bremen - Germany 2 : 3 Liverpool - England DetailsFriday 20/7/2007
Liverpool Pre-Season
2007/7/20
Auxerre - France 0 : 2 Liverpool - England DetailsTuesday 24/7/2007
Premier League Asia Trophy
2007/7/24
South China AA - Hong Kong 1 : 3 Liverpool - England DetailsFriday 27/7/2007
Premier League Asia Trophy
2007/7/27
Liverpool - England 0 : 0
2 : 4
Portsmouth - England Final
Penalty Kicks
DetailsFriday 03/8/2007
Rotterdam Tournament
2007/8/3
Shanghai Greenland Shenhua FC - China 0 : 2 Liverpool - England DetailsSunday 05/8/2007
Rotterdam Tournament
2007/8/5
Feyenoord Rotterdam - Netherlands 1 : 1 Liverpool - England DetailsSaturday 11/8/2007
English Premier League
2007/8/11
Aston Villa 1 : 2 Liverpool Week # 1
DetailsWednesday 15/8/2007
UEFA Champions League
2007/8/15
Toulouse FC - France 0 : 1 Liverpool - England Qualifying 3
DetailsSunday 19/8/2007
English Premier League
2007/8/19
Liverpool 1 : 1 Chelsea Week # 3
DetailsSaturday 25/8/2007
English Premier League
2007/8/25
AFC Sunderland 0 : 2 Liverpool Week # 4
DetailsTuesday 28/8/2007
UEFA Champions League
2007/8/28
Liverpool - England 4 : 0 Toulouse FC - France Qualifying 3
DetailsSaturday 01/9/2007
English Premier League
2007/9/1
Liverpool 6 : 0 Derby County FC Week # 5
DetailsSaturday 15/9/2007
English Premier League
2007/9/15
Portsmouth 0 : 0 Liverpool Week # 6
DetailsTuesday 18/9/2007
UEFA Champions League
2007/9/18
FC Porto - Portugal 1 : 1 Liverpool - England Groups
Round # 1
DetailsSaturday 22/9/2007
English Premier League
2007/9/22
Liverpool 0 : 0 Birmingham City FC Week # 7
DetailsTuesday 25/9/2007
English League Cup
2007/9/25
Reading FC 2 : 4 Liverpool Round 3
DetailsSaturday 29/9/2007
English Premier League
2007/9/29
Wigan Athletic 0 : 1 Liverpool Week # 8
DetailsWednesday 03/10/2007
UEFA Champions League
2007/10/3
Liverpool - England 0 : 1 Olympique Marseille - France Groups
Round # 2
DetailsSunday 07/10/2007
English Premier League
2007/10/7
Liverpool 2 : 2 Tottenham Hotspur Week # 9
DetailsSaturday 20/10/2007
English Premier League
2007/10/20
Everton FC 1 : 2 Liverpool Week # 10
DetailsWednesday 24/10/2007
UEFA Champions League
2007/10/24
Besiktas JK - Turkey 2 : 1 Liverpool - England Groups
Round # 3
DetailsSunday 28/10/2007
English Premier League
2007/10/28
Liverpool 1 : 1 Arsenal FC Week # 11
DetailsWednesday 31/10/2007
English League Cup
2007/10/31
Liverpool 2 : 1 Cardiff City Round 4
DetailsSaturday 03/11/2007
English Premier League
2007/11/3
Blackburn Rovers FC 0 : 0 Liverpool Week # 12
DetailsTuesday 06/11/2007
UEFA Champions League
2007/11/6
Liverpool - England 8 : 0 Besiktas JK - Turkey Groups
Round # 4
DetailsSaturday 10/11/2007
English Premier League
2007/11/10
Liverpool 2 : 0 Fulham FC Week # 13
DetailsSaturday 24/11/2007
English Premier League
2007/11/24
Newcastle United FC 0 : 3 Liverpool Week # 14
DetailsWednesday 28/11/2007
UEFA Champions League
2007/11/28
Liverpool - England 4 : 1 FC Porto - Portugal Groups
DetailsSunday 02/12/2007
English Premier League
2007/12/2
Liverpool 4 : 0 Bolton Wanderers Week # 15
DetailsSaturday 08/12/2007
English Premier League
2007/12/8
Reading FC 3 : 1 Liverpool Week # 16
DetailsTuesday 11/12/2007
UEFA Champions League
2007/12/11
Olympique Marseille - France 0 : 4 Liverpool - England Groups
Round # 6
DetailsSunday 16/12/2007
English Premier League
2007/12/16
Liverpool 0 : 1 Manchester United Week # 17
DetailsWednesday 19/12/2007
English League Cup
2007/12/19
Chelsea 2 : 0 Liverpool Quarterfinals
DetailsSaturday 22/12/2007
English Premier League
2007/12/22
Liverpool 4 : 1 Portsmouth Week # 18
DetailsWednesday 26/12/2007
English Premier League
2007/12/26
Derby County FC 1 : 2 Liverpool Week # 19
DetailsSunday 30/12/2007
English Premier League
2007/12/30
Manchester City 0 : 0 Liverpool Week # 20
DetailsWednesday 02/1/2008
English Premier League
2008/1/2
Liverpool 1 : 1 Wigan Athletic Week # 21
DetailsSunday 06/1/2008
FA Cup
2008/1/6
Luton Town 1 : 1 Liverpool Round 3
DetailsSaturday 12/1/2008
English Premier League
2008/1/12
Middlesbrough 1 : 1 Liverpool Week # 22
DetailsTuesday 15/1/2008
FA Cup
2008/1/15
Liverpool 5 : 0 Luton Town Round 3
DetailsMonday 21/1/2008
English Premier League
2008/1/21
Liverpool 2 : 2 Aston Villa Week # 23
DetailsSaturday 26/1/2008
FA Cup
2008/1/26
Liverpool 5 : 2 Havant and Waterlooville Round 4
DetailsWednesday 30/1/2008
English Premier League
2008/1/30
West Ham United 1 : 0 Liverpool Week # 24
DetailsSaturday 02/2/2008
English Premier League
2008/2/2
Liverpool 3 : 0 AFC Sunderland Week # 25
DetailsSunday 10/2/2008
English Premier League
2008/2/10
Chelsea 0 : 0 Liverpool Week # 26
DetailsSaturday 16/2/2008
FA Cup
2008/2/16
Liverpool 1 : 2 Barnsley FC 1/8 Finals
DetailsTuesday 19/2/2008
UEFA Champions League
2008/2/19
Liverpool - England 2 : 0 Internazionale Milano - Italy Knockout
DetailsSaturday 23/2/2008
English Premier League
2008/2/23
Liverpool 3 : 2 Middlesbrough Week # 27
DetailsSunday 02/3/2008
English Premier League
2008/3/2
Bolton Wanderers 1 : 3 Liverpool Week # 28
DetailsWednesday 05/3/2008
English Premier League
2008/3/5
Liverpool 4 : 0 West Ham United Week # 2
DetailsSaturday 08/3/2008
English Premier League
2008/3/8
Liverpool 3 : 0 Newcastle United FC Week # 29
DetailsTuesday 11/3/2008
UEFA Champions League
2008/3/11
Internazionale Milano - Italy 0 : 1 Liverpool - England Knockout
DetailsSaturday 15/3/2008
English Premier League
2008/3/15
Liverpool 2 : 1 Reading FC Week # 30
DetailsSunday 23/3/2008
English Premier League
2008/3/23
Manchester United 3 : 0 Liverpool Week # 31
DetailsSunday 30/3/2008
English Premier League
2008/3/30
Liverpool 1 : 0 Everton FC Week # 32
DetailsWednesday 02/4/2008
UEFA Champions League
2008/4/2
Arsenal FC - England 1 : 1 Liverpool - England Quarterfinals
DetailsSaturday 05/4/2008
English Premier League
2008/4/5
Arsenal FC 1 : 1 Liverpool Week # 33
DetailsTuesday 08/4/2008
UEFA Champions League
2008/4/8
Liverpool - England 4 : 2 Arsenal FC - England Quarterfinals
DetailsSunday 13/4/2008
English Premier League
2008/4/13
Liverpool 3 : 1 Blackburn Rovers FC Week # 34
DetailsSaturday 19/4/2008
English Premier League
2008/4/19
Fulham FC 0 : 2 Liverpool Week # 35
DetailsTuesday 22/4/2008
UEFA Champions League
2008/4/22
Liverpool - England 1 : 1 Chelsea - England Semifinals
DetailsSaturday 26/4/2008
English Premier League
2008/4/26
Birmingham City FC 2 : 2 Liverpool Week # 36
DetailsWednesday 30/4/2008
UEFA Champions League
2008/4/30
Chelsea - England 3 : 2 Liverpool - England Semifinals
After extra time
DetailsSunday 04/5/2008
English Premier League
2008/5/4
Liverpool 1 : 0 Manchester City Week # 37
DetailsSunday 11/5/2008
English Premier League
2008/5/11
Tottenham Hotspur 0 : 2 Liverpool Week # 38
DetailsSaturday 12/7/2008
Liverpool Pre-Season
2008/7/12
Tranmere Rovers FC - First - England 0 : 1 Liverpool - First - England DetailsWednesday 16/7/2008
Liverpool Pre-Season
2008/7/16
FC Lucerne - First - Switzerland 1 : 2 Liverpool - First - England DetailsSaturday 19/7/2008
Liverpool Pre-Season
2008/7/19
Wisla Krakow - First - Poland 1 : 1 Liverpool - First - England DetailsTuesday 22/7/2008
Liverpool Pre-Season
2008/7/22
Hertha Berlin - First - Germany 0 : 0 Liverpool - First - England DetailsWednesday 30/7/2008
Liverpool Pre-Season
2008/7/30
Villarreal CF - First - Spain 0 : 0 Liverpool - First - England DetailsSaturday 02/8/2008
Liverpool Pre-Season
2008/8/2
Glasgow Rangers FC - First - Scotland 0 : 4 Liverpool - First - England DetailsTuesday 05/8/2008
Liverpool Pre-Season
2008/8/5
Valerenga IF - First - Norway 1 : 4 Liverpool - First - England DetailsFriday 08/8/2008
Liverpool Pre-Season
2008/8/8
Liverpool - First - England 1 : 0 SS Lazio - First - Italy DetailsWednesday 13/8/2008
UEFA Champions League
2008/8/13
Standard de Liege - Belgium 0 : 0 Liverpool - England Qualifying 3
DetailsSaturday 16/8/2008
English Premier League
2008/8/16
AFC Sunderland 0 : 1 Liverpool Week # 1
DetailsSaturday 23/8/2008
English Premier League
2008/8/23
Liverpool 2 : 1 Middlesbrough Week # 2
DetailsWednesday 27/8/2008
UEFA Champions League
2008/8/27
Liverpool - England 1 : 0 Standard de Liege - Belgium Qualifying 3
After extra time
DetailsSunday 31/8/2008
English Premier League
2008/8/31
Aston Villa 0 : 0 Liverpool Week # 3
DetailsSaturday 13/9/2008
English Premier League
2008/9/13
Liverpool 2 : 1 Manchester United Week # 4
DetailsTuesday 16/9/2008
UEFA Champions League
2008/9/16
Olympique Marseille - France 1 : 2 Liverpool - England Groups
Round # 1
DetailsSaturday 20/9/2008
English Premier League
2008/9/20
Liverpool 0 : 0 Stoke City FC Week # 5
DetailsTuesday 23/9/2008
English League Cup
2008/9/23
Liverpool 2 : 1 Crewe Alexandra FC Round 3
DetailsSaturday 27/9/2008
English Premier League
2008/9/27
Everton FC 0 : 2 Liverpool Week # 6
DetailsWednesday 01/10/2008
UEFA Champions League
2008/10/1
Liverpool - England 3 : 1 PSV Eindhoven - Netherlands Groups
Round # 2
DetailsSunday 05/10/2008
English Premier League
2008/10/5
Manchester City 2 : 3 Liverpool Week # 7
DetailsSaturday 18/10/2008
English Premier League
2008/10/18
Liverpool 3 : 2 Wigan Athletic Week # 8
DetailsWednesday 22/10/2008
UEFA Champions League
2008/10/22
Atletico de Madrid - Spain 1 : 1 Liverpool - England Groups
Round # 3
DetailsSunday 26/10/2008
English Premier League
2008/10/26
Chelsea 0 : 1 Liverpool Week # 9
DetailsWednesday 29/10/2008
English Premier League
2008/10/29
Liverpool 1 : 0 Portsmouth Week # 10
DetailsSaturday 01/11/2008
English Premier League
2008/11/1
Tottenham Hotspur 2 : 1 Liverpool Week # 11
DetailsTuesday 04/11/2008
UEFA Champions League
2008/11/4
Liverpool - England 1 : 1 Atletico de Madrid - Spain Groups
Round # 4
DetailsSaturday 08/11/2008
English Premier League
2008/11/8
Liverpool 3 : 0 West Bromwich Albion FC Week # 12
DetailsWednesday 12/11/2008
English League Cup
2008/11/12
Tottenham Hotspur 4 : 2 Liverpool Round 4
DetailsSaturday 15/11/2008
English Premier League
2008/11/15
Bolton Wanderers 0 : 2 Liverpool Week # 13
DetailsSaturday 22/11/2008
English Premier League
2008/11/22
Liverpool 0 : 0 Fulham FC Week # 14
DetailsWednesday 26/11/2008
UEFA Champions League
2008/11/26
Liverpool - England 1 : 0 Olympique Marseille - France Groups
Round # 5
DetailsMonday 01/12/2008
English Premier League
2008/12/1
Liverpool 0 : 0 West Ham United Week # 15
DetailsSaturday 06/12/2008
English Premier League
2008/12/6
Blackburn Rovers FC 1 : 3 Liverpool Week # 16
DetailsTuesday 09/12/2008
UEFA Champions League
2008/12/9
PSV Eindhoven - Netherlands 1 : 3 Liverpool - England Groups
Round # 6
DetailsSaturday 13/12/2008
English Premier League
2008/12/13
Liverpool 2 : 2 Hull City Week # 17
DetailsSunday 21/12/2008
English Premier League
2008/12/21
Arsenal FC 1 : 1 Liverpool Week # 18
DetailsFriday 26/12/2008
English Premier League
2008/12/26
Liverpool 3 : 0 Bolton Wanderers Week # 19
DetailsSunday 28/12/2008
English Premier League
2008/12/28
Newcastle United FC 1 : 5 Liverpool Week # 20
DetailsSaturday 03/1/2009
FA Cup
2009/1/3
Preston North End 0 : 2 Liverpool Round 3
DetailsSaturday 10/1/2009
English Premier League
2009/1/10
Stoke City FC 0 : 0 Liverpool Week # 21
DetailsMonday 19/1/2009
English Premier League
2009/1/19
Liverpool 1 : 1 Everton FC Week # 22
DetailsSunday 25/1/2009
FA Cup
2009/1/25
Liverpool 1 : 1 Everton FC Round 32
DetailsWednesday 28/1/2009
English Premier League
2009/1/28
Wigan Athletic 1 : 1 Liverpool Week # 23
DetailsSunday 01/2/2009
English Premier League
2009/2/1
Liverpool 2 : 0 Chelsea Week # 24
DetailsWednesday 04/2/2009
FA Cup
2009/2/4
Everton FC 1 : 0 Liverpool Round 32
After extra time
DetailsSaturday 07/2/2009
English Premier League
2009/2/7
Portsmouth 2 : 3 Liverpool Week # 25
DetailsSunday 22/2/2009
English Premier League
2009/2/22
Liverpool 1 : 1 Manchester City Week # 26
DetailsWednesday 25/2/2009
UEFA Champions League
2009/2/25
Real Madrid CF - Spain 0 : 1 Liverpool - England Knockout
DetailsSaturday 28/2/2009
English Premier League
2009/2/28
Middlesbrough 2 : 0 Liverpool Week # 27
DetailsTuesday 03/3/2009
English Premier League
2009/3/3
Liverpool 2 : 0 AFC Sunderland Week # 28
DetailsTuesday 10/3/2009
UEFA Champions League
2009/3/10
Liverpool - England 4 : 0 Real Madrid CF - Spain Knockout
DetailsSaturday 14/3/2009
English Premier League
2009/3/14
Manchester United 1 : 4 Liverpool Week # 29
DetailsSunday 22/3/2009
English Premier League
2009/3/22
Liverpool 5 : 0 Aston Villa Week # 30
DetailsSaturday 04/4/2009
English Premier League
2009/4/4
Fulham FC 0 : 1 Liverpool Week # 31
DetailsWednesday 08/4/2009
UEFA Champions League
2009/4/8
Liverpool - England 1 : 3 Chelsea - England Quarterfinals
DetailsSaturday 11/4/2009
English Premier League
2009/4/11
Liverpool 4 : 0 Blackburn Rovers FC Week # 32
DetailsTuesday 14/4/2009
UEFA Champions League
2009/4/14
Chelsea - England 4 : 4 Liverpool - England Quarterfinals
DetailsTuesday 21/4/2009
English Premier League
2009/4/21
Liverpool 4 : 4 Arsenal FC Week # 33
DetailsSaturday 25/4/2009
English Premier League
2009/4/25
Hull City 1 : 3 Liverpool Week # 34
DetailsSunday 03/5/2009
English Premier League
2009/5/3
Liverpool 3 : 0 Newcastle United FC Week # 35
DetailsSaturday 09/5/2009
English Premier League
2009/5/9
West Ham United 0 : 3 Liverpool Week # 36
DetailsSunday 17/5/2009
English Premier League
2009/5/17
West Bromwich Albion FC 0 : 2 Liverpool Week # 37
DetailsSunday 24/5/2009
English Premier League
2009/5/24
Liverpool 3 : 1 Tottenham Hotspur Week # 38
DetailsWednesday 15/7/2009
Liverpool Pre-Season
2009/7/15
Club St. Gallen - First - Switzerland 0 : 0 Club Liverpool - First - England DetailsSunday 19/7/2009
Liverpool Pre-Season
2009/7/19
Club SK Rapid Wien - First - Austria 1 : 0 Club Liverpool - First - England DetailsWednesday 22/7/2009
Liverpool Pre-Season
2009/7/22
National Thailand - First 1 : 1 Club Liverpool - First - England DetailsSunday 26/7/2009
Liverpool Pre-Season
2009/7/26
National Singapore - First 0 : 5 Club Liverpool - First - England DetailsSunday 02/8/2009
Liverpool Pre-Season
2009/8/2
Club RCD Espanyol - First - Spain 3 : 0 Club Liverpool - First - England DetailsWednesday 05/8/2009
Liverpool Pre-Season
2009/8/5
Club SFK Lyn - First - Norway 0 : 2 Club Liverpool - First - England DetailsSaturday 08/8/2009
Liverpool Pre-Season
2009/8/8
Club Liverpool - First - England 1 : 2 Club Atletico de Madrid - First - Spain DetailsSunday 16/8/2009
English Premier League
2009/8/16
Tottenham Hotspur 2 : 1 Liverpool Week # 1
DetailsWednesday 19/8/2009
English Premier League
2009/8/19
Liverpool 4 : 0 Stoke City FC Week # 2
DetailsMonday 24/8/2009
English Premier League
2009/8/24
Liverpool 1 : 3 Aston Villa Week # 3
DetailsSaturday 29/8/2009
English Premier League
2009/8/29
Bolton Wanderers 2 : 3 Liverpool Week # 4
DetailsSaturday 12/9/2009
English Premier League
2009/9/12
Liverpool 4 : 0 Burnley FC Week # 5
DetailsWednesday 16/9/2009
UEFA Champions League
2009/9/16
Liverpool - England 1 : 0 Debreceni VSC - Hungary Groups
Round # 1
DetailsSaturday 19/9/2009
English Premier League
2009/9/19
West Ham United 2 : 3 Liverpool Week # 6
DetailsTuesday 22/9/2009
English League Cup
2009/9/22
Leeds United FC 0 : 1 Liverpool Round 3
DetailsSaturday 26/9/2009
English Premier League
2009/9/26
Liverpool 6 : 1 Hull City Week # 7
DetailsTuesday 29/9/2009
UEFA Champions League
2009/9/29
ACF Fiorentina - Italy 2 : 0 Liverpool - England Groups
Round # 2
DetailsSunday 04/10/2009
English Premier League
2009/10/4
Chelsea 2 : 0 Liverpool Week # 8
DetailsSaturday 17/10/2009
English Premier League
2009/10/17
AFC Sunderland 1 : 0 Liverpool Week # 9
DetailsTuesday 20/10/2009
UEFA Champions League
2009/10/20
Liverpool - England 1 : 2 Olympique Lyonnais - France Groups
Round # 3
DetailsSunday 25/10/2009
English Premier League
2009/10/25
Liverpool 2 : 0 Manchester United Week # 10
DetailsWednesday 28/10/2009
English League Cup
2009/10/28
Arsenal FC 2 : 1 Liverpool Round 4
DetailsSaturday 31/10/2009
English Premier League
2009/10/31
Fulham FC 3 : 1 Liverpool Week # 11
DetailsWednesday 04/11/2009
UEFA Champions League
2009/11/4
Olympique Lyonnais - France 1 : 1 Liverpool - England Groups
Round # 4
DetailsMonday 09/11/2009
English Premier League
2009/11/9
Liverpool 2 : 2 Birmingham City FC Week # 12
DetailsSaturday 21/11/2009
English Premier League
2009/11/21
Liverpool 2 : 2 Manchester City Week # 13
DetailsTuesday 24/11/2009
UEFA Champions League
2009/11/24
Debreceni VSC - Hungary 0 : 1 Liverpool - England Groups
Round # 5
DetailsSunday 29/11/2009
English Premier League
2009/11/29
Everton FC 0 : 2 Liverpool Week # 14
DetailsSaturday 05/12/2009
English Premier League
2009/12/5
Blackburn Rovers FC 0 : 0 Liverpool Week # 15
DetailsWednesday 09/12/2009
UEFA Champions League
2009/12/9
Liverpool - England 1 : 2 ACF Fiorentina - Italy Groups
Round # 6
DetailsSunday 13/12/2009
English Premier League
2009/12/13
Liverpool 1 : 2 Arsenal FC Week # 16
DetailsWednesday 16/12/2009
English Premier League
2009/12/16
Liverpool 2 : 1 Wigan Athletic Week # 17
DetailsSaturday 19/12/2009
English Premier League
2009/12/19
Portsmouth 2 : 0 Liverpool Week # 18
DetailsSaturday 26/12/2009
English Premier League
2009/12/26
Liverpool 2 : 0 Wolverhampton Wanderers FC Week # 19
DetailsTuesday 29/12/2009
English Premier League
2009/12/29
Aston Villa 0 : 1 Liverpool Week # 20
DetailsSaturday 02/1/2010
FA Cup
2010/1/2
Reading FC 1 : 1 Liverpool Round 3
DetailsWednesday 13/1/2010
FA Cup
2010/1/13
Liverpool 1 : 2 Reading FC Round 3
After extra time
DetailsSaturday 16/1/2010
English Premier League
2010/1/16
Stoke City FC 1 : 1 Liverpool Week # 22
DetailsWednesday 20/1/2010
English Premier League
2010/1/20
Liverpool 2 : 0 Tottenham Hotspur Week # 21
DetailsTuesday 26/1/2010
English Premier League
2010/1/26
Wolverhampton Wanderers FC 0 : 0 Liverpool Week # 23
DetailsSaturday 30/1/2010
English Premier League
2010/1/30
Liverpool 2 : 0 Bolton Wanderers Week # 24
DetailsSaturday 06/2/2010
English Premier League
2010/2/6
Liverpool 1 : 0 Everton FC Week # 25
DetailsWednesday 10/2/2010
English Premier League
2010/2/10
Arsenal FC 1 : 0 Liverpool Week # 26
DetailsThursday 18/2/2010
UEFA Europa League
2010/2/18
Liverpool - England 1 : 0 FC Unirea Urziceni - Romania Round of 32
DetailsSunday 21/2/2010
English Premier League
2010/2/21
Manchester City 0 : 0 Liverpool Week # 27
DetailsThursday 25/2/2010
UEFA Europa League
2010/2/25
FC Unirea Urziceni - Romania 1 : 3 Liverpool - England Round of 32
DetailsSunday 28/2/2010
English Premier League
2010/2/28
Liverpool 2 : 1 Blackburn Rovers FC Week # 28
DetailsMonday 08/3/2010
English Premier League
2010/3/8
Wigan Athletic 1 : 0 Liverpool Week # 29
DetailsThursday 11/3/2010
UEFA Europa League
2010/3/11
LOSC Lille - France 1 : 0 Liverpool - England Round of 16
DetailsMonday 15/3/2010
English Premier League
2010/3/15
Liverpool 4 : 1 Portsmouth Week # 30
DetailsThursday 18/3/2010
UEFA Europa League
2010/3/18
Liverpool - England 3 : 0 LOSC Lille - France Round of 16
DetailsSunday 21/3/2010
English Premier League
2010/3/21
Manchester United 2 : 1 Liverpool Week # 31
DetailsSunday 28/3/2010
English Premier League
2010/3/28
Liverpool 3 : 0 AFC Sunderland Week # 32
DetailsThursday 01/4/2010
UEFA Europa League
2010/4/1
SL Benfica - Portugal 2 : 1 Liverpool - England Quarterfinals
DetailsSunday 04/4/2010
English Premier League
2010/4/4
Birmingham City FC 1 : 1 Liverpool Week # 33
DetailsThursday 08/4/2010
UEFA Europa League
2010/4/8
Liverpool - England 4 : 1 SL Benfica - Portugal Quarterfinals
DetailsSunday 11/4/2010
English Premier League
2010/4/11
Liverpool 0 : 0 Fulham FC Week # 34
DetailsMonday 19/4/2010
English Premier League
2010/4/19
Liverpool 3 : 0 West Ham United Week # 35
DetailsThursday 22/4/2010
UEFA Europa League
2010/4/22
Atletico de Madrid - Spain 1 : 0 Liverpool - England Semifinals
DetailsSunday 25/4/2010
English Premier League
2010/4/25
Burnley FC 0 : 4 Liverpool Week # 36
DetailsThursday 29/4/2010
UEFA Europa League
2010/4/29
Liverpool - England 2 : 1 Atletico de Madrid - Spain Semifinals
After extra time
DetailsSunday 02/5/2010
English Premier League
2010/5/2
Liverpool 0 : 2 Chelsea Week # 37
DetailsSunday 09/5/2010
English Premier League
2010/5/9
Hull City 0 : 0 Liverpool Week # 38
DetailsSaturday 17/7/2010
Saudi Arabia ClubsTour
2010/7/17
Liverpool - England -- : -- Al Hilal - Saudi Arabia Cancelled
DetailsSaturday 17/7/2010
Liverpool Pre-Season
2010/7/17
Club Al Hilal - First - Saudi Arabia -- : -- Club Liverpool - First - England Cancelled
DetailsWednesday 21/7/2010
Liverpool Pre-Season
2010/7/21
Club Grasshoppers - First - Switzerland 0 : 0 Club Liverpool - First - England DetailsSaturday 24/7/2010
Summer of Champions
2010/7/24
1. FC Kaiserslautern - Germany 1 : 0 Liverpool - England DetailsThursday 29/7/2010
UEFA Europa League
2010/7/29
FC Rabotnicki - North Macedonia 0 : 2 Liverpool - England 1st Round
DetailsSunday 01/8/2010
Liverpool Pre-Season
2010/8/1
Club Borussia Monchengladbach - First - Germany 1 : 0 Club Liverpool - First - England DetailsThursday 05/8/2010
UEFA Europa League
2010/8/5
Liverpool - England 2 : 0 FC Rabotnicki - North Macedonia 1st Round
DetailsSunday 15/8/2010
English Premier League
2010/8/15
Liverpool 1 : 1 Arsenal FC Week # 1
DetailsThursday 19/8/2010
UEFA Europa League
2010/8/19
Liverpool - England 1 : 0 Trabzonspor - Turkey Play-off round
DetailsMonday 23/8/2010
English Premier League
2010/8/23
Manchester City 3 : 0 Liverpool Week # 2
DetailsThursday 26/8/2010
UEFA Europa League
2010/8/26
Trabzonspor - Turkey 1 : 2 Liverpool - England Play-off round
DetailsSunday 29/8/2010
English Premier League
2010/8/29
Liverpool 1 : 0 West Bromwich Albion FC Week # 3
DetailsSunday 12/9/2010
English Premier League
2010/9/12
Birmingham City FC 0 : 0 Liverpool Week # 4
DetailsThursday 16/9/2010
UEFA Europa League
2010/9/16
Liverpool - England 4 : 1 FCSB Steaua Bucarest - Romania Groups
Round # 1
DetailsSunday 19/9/2010
English Premier League
2010/9/19
Manchester United 3 : 2 Liverpool Week # 5
DetailsWednesday 22/9/2010
English League Cup
2010/9/22
Liverpool 2 : 2
2 : 4
Northampton Town FC Round 3
Penalty Kicks
DetailsSaturday 25/9/2010
English Premier League
2010/9/25
Liverpool 2 : 2 AFC Sunderland Week # 6
DetailsThursday 30/9/2010
UEFA Europa League
2010/9/30
FC Utrecht - Netherlands 0 : 0 Liverpool - England Groups
Round # 2
DetailsSunday 03/10/2010
English Premier League
2010/10/3
Liverpool 1 : 2 Blackpool FC Week # 7
DetailsSunday 17/10/2010
English Premier League
2010/10/17
Everton FC 2 : 0 Liverpool Week # 8
DetailsThursday 21/10/2010
UEFA Europa League
2010/10/21
SSC Napoli - Italy 0 : 0 Liverpool - England Groups
Round # 3
DetailsSunday 24/10/2010
English Premier League
2010/10/24
Liverpool 2 : 1 Blackburn Rovers FC Week # 9
DetailsSunday 31/10/2010
English Premier League
2010/10/31
Bolton Wanderers 0 : 1 Liverpool Week # 10
DetailsThursday 04/11/2010
UEFA Europa League
2010/11/4
Liverpool - England 3 : 1 SSC Napoli - Italy Groups
Round # 4
DetailsSunday 07/11/2010
English Premier League
2010/11/7
Liverpool 2 : 0 Chelsea Week # 11
DetailsWednesday 10/11/2010
English Premier League
2010/11/10
Wigan Athletic 1 : 1 Liverpool Week # 12
DetailsSaturday 13/11/2010
English Premier League
2010/11/13
Stoke City FC 2 : 0 Liverpool Week # 13
DetailsSaturday 20/11/2010
English Premier League
2010/11/20
Liverpool 3 : 0 West Ham United Week # 14
DetailsSunday 28/11/2010
English Premier League
2010/11/28
Tottenham Hotspur 2 : 1 Liverpool Week # 15
DetailsThursday 02/12/2010
UEFA Europa League
2010/12/2
FCSB Steaua Bucarest - Romania 1 : 1 Liverpool - England Groups
Round # 5
DetailsMonday 06/12/2010
English Premier League
2010/12/6
Liverpool 3 : 0 Aston Villa Week # 16
DetailsSaturday 11/12/2010
English Premier League
2010/12/11
Newcastle United FC 3 : 1 Liverpool Week # 17
DetailsWednesday 15/12/2010
UEFA Europa League
2010/12/15
Liverpool - England 0 : 0 FC Utrecht - Netherlands Groups
Round # 6
DetailsWednesday 29/12/2010
English Premier League
2010/12/29
Liverpool 0 : 1 Wolverhampton Wanderers FC Week # 20
DetailsSaturday 01/1/2011
English Premier League
2011/1/1
Liverpool 2 : 1 Bolton Wanderers Week # 21
DetailsWednesday 05/1/2011
English Premier League
2011/1/5
Blackburn Rovers FC 3 : 1 Liverpool Week # 22
DetailsSunday 09/1/2011
FA Cup
2011/1/9
Manchester United 1 : 0 Liverpool Round 3
DetailsWednesday 12/1/2011
English Premier League
2011/1/12
Blackpool FC 2 : 1 Liverpool Week # 19
DetailsSunday 16/1/2011
English Premier League
2011/1/16
Liverpool 2 : 2 Everton FC Week # 23
DetailsSaturday 22/1/2011
English Premier League
2011/1/22
Wolverhampton Wanderers FC 0 : 3 Liverpool Week # 24
DetailsWednesday 26/1/2011
English Premier League
2011/1/26
Liverpool 1 : 0 Fulham FC Week # 18
DetailsWednesday 02/2/2011
English Premier League
2011/2/2
Liverpool 2 : 0 Stoke City FC Week # 25
DetailsSunday 06/2/2011
English Premier League
2011/2/6
Chelsea 0 : 1 Liverpool Week # 26
DetailsSaturday 12/2/2011
English Premier League
2011/2/12
Liverpool 1 : 1 Wigan Athletic Week # 27
DetailsThursday 17/2/2011
UEFA Europa League
2011/2/17
AC Sparta Praha - Czech Republic 0 : 0 Liverpool - England Round of 32
DetailsThursday 24/2/2011
UEFA Europa League
2011/2/24
Liverpool - England 1 : 0 AC Sparta Praha - Czech Republic Round of 32
DetailsSunday 27/2/2011
English Premier League
2011/2/27
West Ham United 3 : 1 Liverpool Week # 28
DetailsSunday 06/3/2011
English Premier League
2011/3/6
Liverpool 3 : 1 Manchester United Week # 29
DetailsThursday 10/3/2011
UEFA Europa League
2011/3/10
Sporting Braga - Portugal 1 : 0 Liverpool - England Round of 16
DetailsThursday 17/3/2011
UEFA Europa League
2011/3/17
Liverpool - England 0 : 0 Sporting Braga - Portugal Round of 16
DetailsSunday 20/3/2011
English Premier League
2011/3/20
AFC Sunderland 0 : 2 Liverpool Week # 30
DetailsSaturday 02/4/2011
English Premier League
2011/4/2
West Bromwich Albion FC 2 : 1 Liverpool Week # 31
DetailsMonday 11/4/2011
English Premier League
2011/4/11
Liverpool 3 : 0 Manchester City Week # 32
DetailsSunday 17/4/2011
English Premier League
2011/4/17
Arsenal FC 1 : 1 Liverpool Week # 33
DetailsSaturday 23/4/2011
English Premier League
2011/4/23
Liverpool 5 : 0 Birmingham City FC Week # 34
DetailsSunday 01/5/2011
English Premier League
2011/5/1
Liverpool 3 : 0 Newcastle United FC Week # 35
DetailsMonday 09/5/2011
English Premier League
2011/5/9
Fulham FC 2 : 5 Liverpool Week # 36
DetailsSunday 15/5/2011
English Premier League
2011/5/15
Liverpool 0 : 2 Tottenham Hotspur Week # 37
DetailsSunday 22/5/2011
English Premier League
2011/5/22
Aston Villa 1 : 0 Liverpool Week # 38
DetailsWednesday 13/7/2011
Liverpool Pre-Season
2011/7/13
Guangdong Sunray Cave - China 3 : 4 Liverpool - England DetailsSaturday 16/7/2011
Liverpool Pre-Season
2011/7/16
Malaysian XI 3 : 6 Liverpool - England DetailsSaturday 23/7/2011
Liverpool Pre-Season
2011/7/23
Hull City - England 3 : 0 Liverpool - England DetailsThursday 28/7/2011
Liverpool Pre-Season
2011/7/28
Galatasaray SK - Turkey 3 : 0 Liverpool - England DetailsMonday 01/8/2011
Liverpool Pre-Season
2011/8/1
Valerenga IF - Norway 3 : 3 Liverpool - England DetailsSaturday 06/8/2011
Liverpool Pre-Season
2011/8/6
Liverpool - England 2 : 0 Valencia C.F - Spain DetailsSaturday 13/8/2011
English Premier League
2011/8/13
Liverpool 1 : 1 AFC Sunderland Week # 1
DetailsSaturday 20/8/2011
English Premier League
2011/8/20
Arsenal FC 0 : 2 Liverpool Week # 2
DetailsWednesday 24/8/2011
English League Cup
2011/8/24
Exeter City 1 : 3 Liverpool Round 2
DetailsSaturday 27/8/2011
English Premier League
2011/8/27
Liverpool 3 : 1 Bolton Wanderers Week # 3
DetailsSaturday 10/9/2011
English Premier League
2011/9/10
Stoke City FC 1 : 0 Liverpool Week # 4
DetailsSunday 18/9/2011
English Premier League
2011/9/18
Tottenham Hotspur 4 : 0 Liverpool Week # 5
DetailsWednesday 21/9/2011
English League Cup
2011/9/21
Brighton & Hove Albion 1 : 2 Liverpool Round 3
DetailsSaturday 24/9/2011
English Premier League
2011/9/24
Liverpool 2 : 1 Wolverhampton Wanderers FC Week # 6
DetailsSaturday 01/10/2011
English Premier League
2011/10/1
Everton FC 0 : 2 Liverpool Week # 7
DetailsSaturday 15/10/2011
English Premier League
2011/10/15
Liverpool 1 : 1 Manchester United Week # 8
DetailsTuesday 18/10/2011
Friendlies - Clubs
2011/10/18
Glasgow Rangers FC - Scotland 1 : 0 Liverpool - England DetailsSaturday 22/10/2011
English Premier League
2011/10/22
Liverpool 1 : 1 Norwich City Week # 9
DetailsWednesday 26/10/2011
English League Cup
2011/10/26
Stoke City FC 1 : 2 Liverpool Round 4
DetailsSaturday 29/10/2011
English Premier League
2011/10/29
West Bromwich Albion FC 0 : 2 Liverpool Week # 10
DetailsSaturday 05/11/2011
English Premier League
2011/11/5
Liverpool 0 : 0 Swansea City Week # 11
DetailsSunday 20/11/2011
English Premier League
2011/11/20
Chelsea 1 : 2 Liverpool Week # 12
DetailsSunday 27/11/2011
English Premier League
2011/11/27
Liverpool 1 : 1 Manchester City Week # 13
DetailsTuesday 29/11/2011
English League Cup
2011/11/29
Chelsea 0 : 2 Liverpool Quarterfinals
DetailsMonday 05/12/2011
English Premier League
2011/12/5
Fulham FC 1 : 0 Liverpool Week # 14
DetailsSaturday 10/12/2011
English Premier League
2011/12/10
Liverpool 1 : 0 Queens Park Rangers Week # 15
DetailsSunday 18/12/2011
English Premier League
2011/12/18
Aston Villa 0 : 2 Liverpool Week # 16
DetailsWednesday 21/12/2011
English Premier League
2011/12/21
Wigan Athletic 0 : 0 Liverpool Week # 17
DetailsMonday 26/12/2011
English Premier League
2011/12/26
Liverpool 1 : 1 Blackburn Rovers FC Week # 18
DetailsFriday 30/12/2011
English Premier League
2011/12/30
Liverpool 3 : 1 Newcastle United FC Week # 19
DetailsTuesday 03/1/2012
English Premier League
2012/1/3
Manchester City 3 : 0 Liverpool Week # 20
DetailsFriday 06/1/2012
FA Cup
2012/1/6
Liverpool 5 : 1 Oldham Athletic Round 3
DetailsWednesday 11/1/2012
English League Cup
2012/1/11
Manchester City 0 : 1 Liverpool Semifinals
DetailsSaturday 14/1/2012
English Premier League
2012/1/14
Liverpool 0 : 0 Stoke City FC Week # 21
DetailsSaturday 21/1/2012
English Premier League
2012/1/21
Bolton Wanderers 3 : 1 Liverpool Week # 22
DetailsWednesday 25/1/2012
English League Cup
2012/1/25
Liverpool 2 : 2 Manchester City Semifinals
DetailsSaturday 28/1/2012
FA Cup
2012/1/28
Liverpool 2 : 1 Manchester United Round 32
DetailsTuesday 31/1/2012
English Premier League
2012/1/31
Wolverhampton Wanderers FC 0 : 3 Liverpool Week # 23
DetailsMonday 06/2/2012
English Premier League
2012/2/6
Liverpool 0 : 0 Tottenham Hotspur Week # 24
DetailsSaturday 11/2/2012
English Premier League
2012/2/11
Manchester United 2 : 1 Liverpool Week # 25
DetailsSunday 19/2/2012
FA Cup
2012/2/19
Liverpool 6 : 1 Brighton & Hove Albion Round 16
DetailsSunday 26/2/2012
English League Cup
2012/2/26
Cardiff City 2 : 2
2 : 3
Liverpool Final
Penalty Kicks
DetailsSaturday 03/3/2012
English Premier League
2012/3/3
Liverpool 1 : 2 Arsenal FC Week # 27
DetailsSaturday 10/3/2012
English Premier League
2012/3/10
AFC Sunderland 1 : 0 Liverpool Week # 28
DetailsTuesday 13/3/2012
English Premier League
2012/3/13
Liverpool 3 : 0 Everton FC Week # 26
DetailsSunday 18/3/2012
FA Cup
2012/3/18
Liverpool 2 : 1 Stoke City FC Quarter Finals
DetailsWednesday 21/3/2012
English Premier League
2012/3/21
Queens Park Rangers 3 : 2 Liverpool Week # 29
DetailsSaturday 24/3/2012
English Premier League
2012/3/24
Liverpool 1 : 2 Wigan Athletic Week # 30
DetailsSunday 01/4/2012
English Premier League
2012/4/1
Newcastle United FC 2 : 0 Liverpool Week # 31
DetailsSaturday 07/4/2012
English Premier League
2012/4/7
Liverpool 1 : 1 Aston Villa Week # 32
DetailsTuesday 10/4/2012
English Premier League
2012/4/10
Blackburn Rovers FC 2 : 3 Liverpool Week # 33
DetailsSaturday 14/4/2012
FA Cup
2012/4/14
Liverpool 2 : 1 Everton FC Semi Finals
DetailsSunday 22/4/2012
English Premier League
2012/4/22
Liverpool 0 : 1 West Bromwich Albion FC Week # 35
DetailsSaturday 28/4/2012
English Premier League
2012/4/28
Norwich City 0 : 3 Liverpool Week # 36
DetailsTuesday 01/5/2012
English Premier League
2012/5/1
Liverpool 0 : 1 Fulham FC Week # 34
DetailsSaturday 05/5/2012
FA Cup
2012/5/5
Chelsea 2 : 1 Liverpool Final
DetailsTuesday 08/5/2012
English Premier League
2012/5/8
Liverpool 4 : 1 Chelsea Week # 37
DetailsSunday 13/5/2012
English Premier League
2012/5/13
Swansea City 1 : 0 Liverpool Week # 38
DetailsSaturday 21/7/2012
Liverpool Pre-Season 2011
2012/7/21
Toronto FC 1 : 1 Liverpool DetailsWednesday 25/7/2012
As Roma Pre-Season
2012/7/26
AS Roma 2 : 1 Liverpool DetailsWednesday 25/7/2012
Liverpool Pre-Season 2011
2012/7/26
AS Roma 2 : 1 Liverpool DetailsSaturday 28/7/2012
Liverpool Pre-Season 2011
2012/7/28
Liverpool 0 : 0 Tottenham Hotspur DetailsThursday 02/8/2012
UEFA Europa League
2012/8/2
FC Gomel - Belarus 0 : 1 Liverpool - England Qualifying 3
DetailsThursday 09/8/2012
UEFA Europa League
2012/8/9
Liverpool - England 3 : 0 FC Gomel - Belarus Qualifying 3
DetailsSunday 12/8/2012
Liverpool Pre-Season 2011
2012/8/12
Liverpool 3 : 1 Bayer 04 Leverkusen DetailsSaturday 18/8/2012
English Premier League
2012/8/18
West Bromwich Albion FC 3 : 0 Liverpool Week # 1
DetailsThursday 23/8/2012
UEFA Europa League
2012/8/23
Heart of Midlothian FC - Scotland 0 : 1 Liverpool - England Play-off Round
DetailsSunday 26/8/2012
English Premier League
2012/8/26
Liverpool 2 : 2 Manchester City Week # 2
DetailsThursday 30/8/2012
UEFA Europa League
2012/8/30
Liverpool - England 1 : 1 Heart of Midlothian FC - Scotland Play-off Round
DetailsSunday 02/9/2012
English Premier League
2012/9/2
Liverpool 0 : 2 Arsenal FC Week # 3
DetailsSaturday 15/9/2012
English Premier League
2012/9/15
AFC Sunderland 1 : 1 Liverpool Week # 4
DetailsThursday 20/9/2012
UEFA Europa League
2012/9/20
BSC Young Boys - Switzerland 3 : 5 Liverpool - England Groups
DetailsSunday 23/9/2012
English Premier League
2012/9/23
Liverpool 1 : 2 Manchester United Week # 5
DetailsWednesday 26/9/2012
English League Cup
2012/9/26
West Bromwich Albion FC 1 : 2 Liverpool Round 3
DetailsSaturday 29/9/2012
English Premier League
2012/9/29
Norwich City 2 : 5 Liverpool Week # 6
DetailsThursday 04/10/2012
UEFA Europa League
2012/10/4
Liverpool - England 2 : 3 Udinese Calcio - Italy Groups
DetailsSunday 07/10/2012
English Premier League
2012/10/7
Liverpool 0 : 0 Stoke City FC Week # 7
DetailsSaturday 20/10/2012
English Premier League
2012/10/20
Liverpool 1 : 0 Reading FC Week # 8
DetailsThursday 25/10/2012
UEFA Europa League
2012/10/25
Liverpool - England 1 : 0 Anzhi Makhachkala - Russia Groups
DetailsSunday 28/10/2012
English Premier League
2012/10/28
Everton FC 2 : 2 Liverpool Week # 9
DetailsWednesday 31/10/2012
English League Cup
2012/10/31
Liverpool 1 : 3 Swansea City Round of 16
DetailsSunday 04/11/2012
English Premier League
2012/11/4
Liverpool 1 : 1 Newcastle United FC Week # 10
DetailsThursday 08/11/2012
UEFA Europa League
2012/11/8
Anzhi Makhachkala - Russia 1 : 0 Liverpool - England Groups
DetailsSunday 11/11/2012
English Premier League
2012/11/11
Chelsea 1 : 1 Liverpool Week # 11
DetailsSaturday 17/11/2012
English Premier League
2012/11/17
Liverpool 3 : 0 Wigan Athletic Week # 12
DetailsThursday 22/11/2012
UEFA Europa League
2012/11/22
Liverpool - England 2 : 2 BSC Young Boys - Switzerland Groups
DetailsSunday 25/11/2012
English Premier League
2012/11/25
Swansea City 0 : 0 Liverpool Week # 13
DetailsWednesday 28/11/2012
English Premier League
2012/11/28
Tottenham Hotspur 2 : 1 Liverpool Week # 14
DetailsSaturday 01/12/2012
English Premier League
2012/12/1
Liverpool 1 : 0 FC Southampton Week # 15
DetailsThursday 06/12/2012
UEFA Europa League
2012/12/6
Udinese Calcio - Italy 0 : 1 Liverpool - England Groups
DetailsSunday 09/12/2012
English Premier League
2012/12/9
West Ham United 2 : 3 Liverpool Week # 16
DetailsSaturday 15/12/2012
English Premier League
2012/12/15
Liverpool 1 : 3 Aston Villa Week # 17
DetailsSaturday 22/12/2012
English Premier League
2012/12/22
Liverpool 4 : 0 Fulham FC Week # 18
DetailsWednesday 26/12/2012
English Premier League
2012/12/26
Stoke City FC 3 : 1 Liverpool Week # 19
DetailsSunday 30/12/2012
English Premier League
2012/12/30
Queens Park Rangers 0 : 3 Liverpool Week # 20
DetailsWednesday 02/1/2013
English Premier League
2013/1/2
Liverpool 3 : 0 AFC Sunderland Week # 21
DetailsSunday 06/1/2013
England FA Cup
2013/1/6
Mansfield Town 1 : 2 Liverpool Round of 64
DetailsSunday 13/1/2013
English Premier League
2013/1/13
Manchester United 2 : 1 Liverpool Week # 22
DetailsSaturday 19/1/2013
English Premier League
2013/1/19
Liverpool 5 : 0 Norwich City Week # 23
DetailsSunday 27/1/2013
England FA Cup
2013/1/27
Oldham Athletic 3 : 2 Liverpool Round of 32
DetailsWednesday 30/1/2013
English Premier League
2013/1/30
Arsenal FC 2 : 2 Liverpool Week # 24
DetailsSunday 03/2/2013
English Premier League
2013/2/3
Manchester City 2 : 2 Liverpool Week # 25
DetailsMonday 11/2/2013
English Premier League
2013/2/11
Liverpool 0 : 2 West Bromwich Albion FC Week # 26
DetailsThursday 14/2/2013
UEFA Europa League
2013/2/14
Zenit St. Petersburg - Russia 2 : 0 Liverpool - England Round of 32
DetailsSunday 17/2/2013
English Premier League
2013/2/17
Liverpool 5 : 0 Swansea City Week # 27
DetailsThursday 21/2/2013
UEFA Europa League
2013/2/21
Liverpool - England 3 : 1 Zenit St. Petersburg - Russia Round of 32
DetailsSaturday 02/3/2013
English Premier League
2013/3/2
Wigan Athletic 0 : 4 Liverpool Week # 28
DetailsSunday 10/3/2013
English Premier League
2013/3/10
Liverpool 3 : 2 Tottenham Hotspur Week # 29
DetailsSaturday 16/3/2013
English Premier League
2013/3/16
FC Southampton 3 : 1 Liverpool Week # 30
DetailsSunday 31/3/2013
English Premier League
2013/3/31
Aston Villa 1 : 2 Liverpool Week # 31
DetailsSunday 07/4/2013
English Premier League
2013/4/7
Liverpool 0 : 0 West Ham United Week # 32
DetailsSaturday 13/4/2013
English Premier League
2013/4/13
Reading FC 0 : 0 Liverpool Week # 33
DetailsSunday 21/4/2013
English Premier League
2013/4/21
Liverpool 2 : 2 Chelsea Week # 34
DetailsSaturday 27/4/2013
English Premier League
2013/4/27
Newcastle United FC 0 : 6 Liverpool Week # 35
DetailsSunday 05/5/2013
English Premier League
2013/5/5
Liverpool 0 : 0 Everton FC Week # 36
DetailsSunday 12/5/2013
English Premier League
2013/5/12
Fulham FC 1 : 3 Liverpool Week # 37
DetailsSunday 19/5/2013
English Premier League
2013/5/19
Liverpool 1 : 0 Queens Park Rangers Week # 38
DetailsSaturday 13/7/2013
Liverpool Pre-Season
2013/7/13
Preston North End - England 0 : 4 Liverpool - England Friendly Mathcs
DetailsSaturday 20/7/2013
Liverpool Pre-Season
2013/7/20
Indonesia All Star 0 : 2 Liverpool - England DetailsWednesday 24/7/2013
Liverpool Pre-Season
2013/7/24
Melbourne Victory FC - Australia 0 : 2 Liverpool - England DetailsSunday 28/7/2013
Liverpool Pre-Season
2013/7/28
Thailand 0 : 3 Liverpool - England DetailsSaturday 03/8/2013
Liverpool Pre-Season
2013/8/3
Liverpool - England 2 : 0 Olympiacos Piraeus - Greece Friendly Mathcs
DetailsWednesday 07/8/2013
Liverpool Pre-Season
2013/8/7
Valerenga IF - Norway 1 : 4 Liverpool - England Friendly Mathcs
DetailsSaturday 10/8/2013
Liverpool Pre-Season
2013/8/10
Liverpool - England 0 : 1 Celtic Glasgow - Scotland Friendly Mathcs
DetailsSaturday 17/8/2013
English Premier League
2013/8/17
Liverpool 1 : 0 Stoke City FC Week # 1
DetailsSaturday 24/8/2013
English Premier League
2013/8/24
Aston Villa 0 : 1 Liverpool Week # 2
DetailsTuesday 27/8/2013
English League Cup
2013/8/27
Liverpool 4 : 2 Notts County FC Round 2
After extra time
DetailsSunday 01/9/2013
English Premier League
2013/9/1
Liverpool 1 : 0 Manchester United Week # 3
DetailsMonday 16/9/2013
English Premier League
2013/9/16
Swansea City 2 : 2 Liverpool Week # 4
DetailsSaturday 21/9/2013
English Premier League
2013/9/21
Liverpool 0 : 1 FC Southampton Week # 5
DetailsWednesday 25/9/2013
English League Cup
2013/9/25
Manchester United 1 : 0 Liverpool Round 3
DetailsSunday 29/9/2013
English Premier League
2013/9/29
AFC Sunderland 1 : 3 Liverpool Week # 6
DetailsSaturday 05/10/2013
English Premier League
2013/10/5
Liverpool 3 : 1 Crystal Palace FC Week # 7
DetailsSaturday 19/10/2013
English Premier League
2013/10/19
Newcastle United FC 2 : 2 Liverpool Week # 8
DetailsSaturday 26/10/2013
English Premier League
2013/10/26
Liverpool 4 : 1 West Bromwich Albion FC Week # 9
DetailsSaturday 02/11/2013
English Premier League
2013/11/2
Arsenal FC 2 : 0 Liverpool Week # 10
DetailsSaturday 09/11/2013
English Premier League
2013/11/9
Liverpool 4 : 0 Fulham FC Week # 11
DetailsSaturday 23/11/2013
English Premier League
2013/11/23
Everton FC 3 : 3 Liverpool Week # 12
DetailsSunday 01/12/2013
English Premier League
2013/12/1
Hull City 3 : 1 Liverpool Week # 13
DetailsWednesday 04/12/2013
English Premier League
2013/12/4
Liverpool 5 : 1 Norwich City Week # 14
DetailsSaturday 07/12/2013
English Premier League
2013/12/7
Liverpool 4 : 1 West Ham United Week # 15
DetailsSunday 15/12/2013
English Premier League
2013/12/15
Tottenham Hotspur 0 : 5 Liverpool Week # 16
DetailsSaturday 21/12/2013
English Premier League
2013/12/21
Liverpool 3 : 1 Cardiff City Week # 17
DetailsThursday 26/12/2013
English Premier League
2013/12/26
Manchester City 2 : 1 Liverpool Week # 18
DetailsSunday 29/12/2013
English Premier League
2013/12/29
Chelsea 2 : 1 Liverpool Week # 19
DetailsWednesday 01/1/2014
English Premier League
2014/1/1
Liverpool 2 : 0 Hull City Week # 20
DetailsSunday 05/1/2014
England FA Cup
2014/1/5
Liverpool 2 : 0 Oldham Athletic Round of 64
DetailsSunday 12/1/2014
English Premier League
2014/1/12
Stoke City FC 3 : 5 Liverpool Week # 21
DetailsSaturday 18/1/2014
English Premier League
2014/1/18
Liverpool 2 : 2 Aston Villa Week # 22
DetailsSaturday 25/1/2014
England FA Cup
2014/1/25
AFC Bournemouth 0 : 2 Liverpool Round of 32
DetailsTuesday 28/1/2014
English Premier League
2014/1/28
Liverpool 4 : 0 Everton FC Week # 23
DetailsSunday 02/2/2014
English Premier League
2014/2/2
West Bromwich Albion FC 1 : 1 Liverpool Week # 24
DetailsSaturday 08/2/2014
English Premier League
2014/2/8
Liverpool 5 : 1 Arsenal FC Week # 25
DetailsWednesday 12/2/2014
English Premier League
2014/2/12
Fulham FC 2 : 3 Liverpool Week # 26
DetailsSunday 16/2/2014
England FA Cup
2014/2/16
Arsenal FC 2 : 1 Liverpool Round of 16
DetailsSunday 23/2/2014
English Premier League
2014/2/23
Liverpool 4 : 3 Swansea City Week # 27
DetailsSaturday 01/3/2014
English Premier League
2014/3/1
FC Southampton 0 : 3 Liverpool Week # 28
DetailsSunday 16/3/2014
English Premier League
2014/3/16
Manchester United 0 : 3 Liverpool Week # 30
DetailsSaturday 22/3/2014
English Premier League
2014/3/22
Cardiff City 3 : 6 Liverpool Week # 31
DetailsWednesday 26/3/2014
English Premier League
2014/3/26
Liverpool 2 : 1 AFC Sunderland Week # 29
DetailsSunday 30/3/2014
English Premier League
2014/3/30
Liverpool 4 : 0 Tottenham Hotspur Week # 32
DetailsSunday 06/4/2014
English Premier League
2014/4/6
West Ham United 1 : 2 Liverpool Week # 33
DetailsSunday 13/4/2014
English Premier League
2014/4/13
Liverpool 3 : 2 Manchester City Week # 34
DetailsSunday 20/4/2014
English Premier League
2014/4/20
Norwich City 2 : 3 Liverpool Week # 35
DetailsSunday 27/4/2014
English Premier League
2014/4/27
Liverpool 0 : 2 Chelsea Week # 36
DetailsMonday 05/5/2014
English Premier League
2014/5/5
Crystal Palace FC 3 : 3 Liverpool Week # 37
DetailsSunday 11/5/2014
English Premier League
2014/5/11
Liverpool 2 : 1 Newcastle United FC Week # 38
DetailsWednesday 14/5/2014
Friendlies - Clubs
2014/5/14
Shamrock Rovers - Ireland 0 : 4 Liverpool - England DetailsWednesday 16/7/2014
Liverpool Pre-Season
2014/7/16
Brondby IF - Denmark 2 : 1 Liverpool - England DetailsSaturday 19/7/2014
Liverpool Pre-Season
2014/7/19
Preston North End - England 1 : 2 Liverpool - England DetailsWednesday 23/7/2014
Liverpool Pre-Season
2014/7/24
Liverpool - England 0 : 1 AS Roma - Italy DetailsSunday 27/7/2014
International Champions Cup
2014/7/28
Liverpool - England 1 : 0 Olympiacos Piraeus - Greece DetailsThursday 31/7/2014
International Champions Cup
2014/7/31
Manchester City - England 2 : 2
1 : 3
Liverpool - England Penalty Kicks
DetailsSaturday 02/8/2014
International Champions Cup
2014/8/3
Liverpool - England 2 : 0 AC Milan - Italy DetailsTuesday 05/8/2014
International Champions Cup
2014/8/5
Manchester United - England 3 : 1 Liverpool - England Final
DetailsSunday 10/8/2014
Borussia Dortmund Pre-Season
2014/8/10
Liverpool - England 4 : 0 Borussia Dortmund - Germany DetailsSunday 17/8/2014
English Premier League
2014/8/17
Liverpool 2 : 1 FC Southampton Week # 1
DetailsMonday 25/8/2014
English Premier League
2014/8/25
Manchester City 3 : 1 Liverpool Week # 2
DetailsSunday 31/8/2014
English Premier League
2014/8/31
Tottenham Hotspur 0 : 3 Liverpool Week # 3
DetailsSaturday 13/9/2014
English Premier League
2014/9/13
Liverpool 0 : 1 Aston Villa Week # 4
DetailsTuesday 16/9/2014
UEFA Champions League
2014/9/16
Liverpool - England 2 : 1 Ludogorets Razgrad - Bulgaria Group stage
Round # 1
DetailsSaturday 20/9/2014
English Premier League
2014/9/20
West Ham United 3 : 1 Liverpool Week # 5
DetailsTuesday 23/9/2014
English League Cup
2014/9/23
Liverpool 2 : 2
14 : 13
Middlesbrough Round 3
Penalty Kicks
DetailsSaturday 27/9/2014
English Premier League
2014/9/27
Liverpool 1 : 1 Everton FC Week # 6
DetailsWednesday 01/10/2014
UEFA Champions League
2014/10/1
FC Basel 1893 - Switzerland 1 : 0 Liverpool - England Group stage
Round # 2
DetailsSaturday 04/10/2014
English Premier League
2014/10/4
Liverpool 2 : 1 West Bromwich Albion FC Week # 7
DetailsSunday 19/10/2014
English Premier League
2014/10/19
Queens Park Rangers 2 : 3 Liverpool Week # 8
DetailsWednesday 22/10/2014
UEFA Champions League
2014/10/22
Liverpool - England 0 : 3 Real Madrid CF - Spain Group stage
Round # 3
DetailsSaturday 25/10/2014
English Premier League
2014/10/25
Liverpool 0 : 0 Hull City Week # 9
DetailsTuesday 28/10/2014
English League Cup
2014/10/28
Liverpool 2 : 1 Swansea City Round of 16
DetailsSaturday 01/11/2014
English Premier League
2014/11/1
Newcastle United FC 1 : 0 Liverpool Week # 10
DetailsTuesday 04/11/2014
UEFA Champions League
2014/11/4
Real Madrid CF - Spain 1 : 0 Liverpool - England Group stage
Round # 4
DetailsSaturday 08/11/2014
English Premier League
2014/11/8
Liverpool 1 : 2 Chelsea Week # 11
DetailsSunday 23/11/2014
English Premier League
2014/11/23
Crystal Palace FC 3 : 1 Liverpool Week # 12
DetailsWednesday 26/11/2014
UEFA Champions League
2014/11/26
Ludogorets Razgrad - Bulgaria 2 : 2 Liverpool - England Group stage
Round # 5
DetailsSaturday 29/11/2014
English Premier League
2014/11/29
Liverpool 1 : 0 Stoke City FC Week # 13
DetailsTuesday 02/12/2014
English Premier League
2014/12/2
Leicester City 1 : 3 Liverpool Week # 14
DetailsSaturday 06/12/2014
English Premier League
2014/12/6
Liverpool 0 : 0 AFC Sunderland Week # 15
DetailsTuesday 09/12/2014
UEFA Champions League
2014/12/9
Liverpool - England 1 : 1 FC Basel 1893 - Switzerland Group stage
Round # 6
DetailsSunday 14/12/2014
English Premier League
2014/12/14
Manchester United 3 : 0 Liverpool Week # 16
DetailsWednesday 17/12/2014
English League Cup
2014/12/17
AFC Bournemouth 1 : 3 Liverpool Quarterfinals
DetailsSunday 21/12/2014
English Premier League
2014/12/21
Liverpool 2 : 2 Arsenal FC Week # 17
DetailsFriday 26/12/2014
English Premier League
2014/12/26
Burnley FC 0 : 1 Liverpool Week # 18
DetailsMonday 29/12/2014
English Premier League
2014/12/29
Liverpool 4 : 1 Swansea City Week # 19
DetailsThursday 01/1/2015
English Premier League
2015/1/1
Liverpool 2 : 2 Leicester City Week # 20
DetailsMonday 05/1/2015
England FA Cup
2015/1/5
AFC Wimbledon 1 : 2 Liverpool Round of 64
DetailsSaturday 10/1/2015
English Premier League
2015/1/10
AFC Sunderland 0 : 1 Liverpool Week # 21
DetailsSaturday 17/1/2015
English Premier League
2015/1/17
Aston Villa 0 : 2 Liverpool Week # 22
DetailsTuesday 20/1/2015
English League Cup
2015/1/20
Liverpool 1 : 1 Chelsea Semifinals
DetailsSaturday 24/1/2015
England FA Cup
2015/1/24
Liverpool 0 : 0 Bolton Wanderers Round of 32
DetailsTuesday 27/1/2015
English League Cup
2015/1/27
Chelsea 1 : 0 Liverpool Semifinals
After extra time
DetailsSaturday 31/1/2015
English Premier League
2015/1/31
Liverpool 2 : 0 West Ham United Week # 23
DetailsWednesday 04/2/2015
England FA Cup
2015/2/4
Bolton Wanderers 1 : 2 Liverpool Round of 32
DetailsSaturday 07/2/2015
English Premier League
2015/2/7
Everton FC 0 : 0 Liverpool Week # 24
DetailsTuesday 10/2/2015
English Premier League
2015/2/10
Liverpool 3 : 2 Tottenham Hotspur Week # 25
DetailsSaturday 14/2/2015
England FA Cup
2015/2/14
Crystal Palace FC 1 : 2 Liverpool Round of 16
DetailsThursday 19/2/2015
UEFA Europa League
2015/2/19
Liverpool - England 1 : 0 Besiktas JK - Turkey Round of 32
DetailsSunday 22/2/2015
English Premier League
2015/2/22
FC Southampton 0 : 2 Liverpool Week # 26
DetailsThursday 26/2/2015
UEFA Europa League
2015/2/26
Besiktas JK - Turkey 1 : 0
5 : 4
Liverpool - England Round of 32
Penalty Kicks
DetailsSunday 01/3/2015
English Premier League
2015/3/1
Liverpool 2 : 1 Manchester City Week # 27
DetailsWednesday 04/3/2015
English Premier League
2015/3/4
Liverpool 2 : 0 Burnley FC Week # 28
DetailsSunday 08/3/2015
England FA Cup
2015/3/8
Liverpool 0 : 0 Blackburn Rovers FC Quarter Finals
DetailsMonday 16/3/2015
English Premier League
2015/3/16
Swansea City 0 : 1 Liverpool Week # 29
DetailsSunday 22/3/2015
English Premier League
2015/3/22
Liverpool 1 : 2 Manchester United Week # 30
DetailsSaturday 04/4/2015
English Premier League
2015/4/4
Arsenal FC 4 : 1 Liverpool Week # 31
DetailsWednesday 08/4/2015
England FA Cup
2015/4/8
Blackburn Rovers FC 0 : 1 Liverpool Quarter Finals
DetailsMonday 13/4/2015
English Premier League
2015/4/13
Liverpool 2 : 0 Newcastle United FC Week # 32
DetailsSunday 19/4/2015
England FA Cup
2015/4/19
Aston Villa 2 : 1 Liverpool SemiFinal
DetailsSaturday 25/4/2015
English Premier League
2015/4/25
West Bromwich Albion FC 0 : 0 Liverpool Week # 34
DetailsTuesday 28/4/2015
English Premier League
2015/4/28
Hull City 1 : 0 Liverpool Week # 33
DetailsSaturday 02/5/2015
English Premier League
2015/5/2
Liverpool 2 : 1 Queens Park Rangers Week # 35
DetailsSunday 10/5/2015
English Premier League
2015/5/10
Chelsea 1 : 1 Liverpool Week # 36
DetailsSaturday 16/5/2015
English Premier League
2015/5/16
Liverpool 1 : 3 Crystal Palace FC Week # 37
DetailsSunday 24/5/2015
English Premier League
2015/5/24
Stoke City FC 6 : 1 Liverpool Week # 38
DetailsTuesday 14/7/2015
Liverpool Pre-Season
2015/7/14
Thailand All Stars 0 : 4 Liverpool - England DetailsFriday 17/7/2015
Liverpool Pre-Season
2015/7/17
Brisbane Roar FC - Australia 1 : 2 Liverpool - England DetailsMonday 20/7/2015
Liverpool Pre-Season
2015/7/20
Adelaide United - Australia 0 : 2 Liverpool - England DetailsFriday 24/7/2015
Liverpool Pre-Season
2015/7/24
Malaysian XI 1 : 1 Liverpool - England DetailsSaturday 01/8/2015
Liverpool Pre-Season
2015/8/1
Liverpool - England 2 : 0 HJK Helsinki - Finland DetailsSunday 02/8/2015
Liverpool Pre-Season
2015/8/2
Swindon Town FC - England 1 : 2 Liverpool - England DetailsSunday 09/8/2015
English Premier League
2015/8/9
Stoke City FC 0 : 1 Liverpool Week # 1
DetailsMonday 17/8/2015
English Premier League
2015/8/17
Liverpool 1 : 0 AFC Bournemouth Week # 2
DetailsMonday 24/8/2015
English Premier League
2015/8/24
Arsenal FC 0 : 0 Liverpool Week # 3
DetailsSaturday 29/8/2015
English Premier League
2015/8/29
Liverpool 0 : 3 West Ham United Week # 4
DetailsSaturday 12/9/2015
English Premier League
2015/9/12
Manchester United 3 : 1 Liverpool Week # 5
DetailsThursday 17/9/2015
UEFA Europa League
2015/9/17
Bordeaux - France 1 : 1 Liverpool - England Groups
DetailsSunday 20/9/2015
English Premier League
2015/9/20
Liverpool 1 : 1 Norwich City Week # 6
DetailsWednesday 23/9/2015
English League Cup
2015/9/23
Liverpool 1 : 1
3 : 2
Carlisle United Round 3
Penalty Kicks
DetailsSaturday 26/9/2015
English Premier League
2015/9/26
Liverpool 3 : 2 Aston Villa Week # 7
DetailsThursday 01/10/2015
UEFA Europa League
2015/10/1
Liverpool - England 1 : 1 FC Sion - Switzerland Groups
DetailsSunday 04/10/2015
English Premier League
2015/10/4
Everton FC 1 : 1 Liverpool Week # 8
DetailsSaturday 17/10/2015
English Premier League
2015/10/17
Tottenham Hotspur 0 : 0 Liverpool Week # 9
DetailsThursday 22/10/2015
UEFA Europa League
2015/10/22
Liverpool - England 1 : 1 FC Rubin Kazan - Russia Groups
DetailsSunday 25/10/2015
English Premier League
2015/10/25
Liverpool 1 : 1 FC Southampton Week # 10
DetailsWednesday 28/10/2015
English League Cup
2015/10/28
Liverpool 1 : 0 AFC Bournemouth Round of 16
DetailsSaturday 31/10/2015
English Premier League
2015/10/31
Chelsea 1 : 3 Liverpool Week # 11
DetailsThursday 05/11/2015
UEFA Europa League
2015/11/5
FC Rubin Kazan - Russia 0 : 1 Liverpool - England Groups
DetailsSunday 08/11/2015
English Premier League
2015/11/8
Liverpool 1 : 2 Crystal Palace FC Week # 12
DetailsSaturday 21/11/2015
English Premier League
2015/11/21
Manchester City 1 : 4 Liverpool Week # 13
DetailsThursday 26/11/2015
UEFA Europa League
2015/11/26
Liverpool - England 2 : 1 Bordeaux - France Groups
DetailsSunday 29/11/2015
English Premier League
2015/11/29
Liverpool 1 : 0 Swansea City Week # 14
DetailsWednesday 02/12/2015
English League Cup
2015/12/2
FC Southampton 1 : 6 Liverpool Quarterfinals
DetailsSunday 06/12/2015
English Premier League
2015/12/6
Newcastle United FC 2 : 0 Liverpool Week # 15
DetailsThursday 10/12/2015
UEFA Europa League
2015/12/10
FC Sion - Switzerland 0 : 0 Liverpool - England Groups
DetailsSunday 13/12/2015
English Premier League
2015/12/13
Liverpool 2 : 2 West Bromwich Albion FC Week # 16
DetailsSunday 20/12/2015
English Premier League
2015/12/20
Watford 3 : 0 Liverpool Week # 17
DetailsSaturday 26/12/2015
English Premier League
2015/12/26
Liverpool 1 : 0 Leicester City Week # 18
DetailsWednesday 30/12/2015
English Premier League
2015/12/30
AFC Sunderland 0 : 1 Liverpool Week # 19
DetailsSaturday 02/1/2016
English Premier League
2016/1/2
West Ham United 2 : 0 Liverpool Week # 20
DetailsTuesday 05/1/2016
English League Cup
2016/1/5
Stoke City FC 0 : 1 Liverpool Semifinals
DetailsFriday 08/1/2016
England FA Cup
2016/1/8
Exeter City 2 : 2 Liverpool Round of 64
DetailsWednesday 13/1/2016
English Premier League
2016/1/13
Liverpool 3 : 3 Arsenal FC Week # 21
DetailsSunday 17/1/2016
English Premier League
2016/1/17
Liverpool 0 : 1 Manchester United Week # 22
DetailsWednesday 20/1/2016
England FA Cup
2016/1/20
Liverpool 3 : 0 Exeter City Round of 64
DetailsSaturday 23/1/2016
English Premier League
2016/1/23
Norwich City 4 : 5 Liverpool Week # 23
DetailsTuesday 26/1/2016
English League Cup
2016/1/26
Liverpool 0 : 1
6 : 5
Stoke City FC Semifinals
Penalty Kicks
DetailsSaturday 30/1/2016
England FA Cup
2016/1/30
Liverpool 0 : 0 West Ham United Round of 32
DetailsTuesday 02/2/2016
English Premier League
2016/2/2
Leicester City 2 : 0 Liverpool Week # 24
DetailsSaturday 06/2/2016
English Premier League
2016/2/6
Liverpool 2 : 2 AFC Sunderland Week # 25
DetailsTuesday 09/2/2016
England FA Cup
2016/2/9
West Ham United 2 : 1 Liverpool Round of 32
After extra time
DetailsSunday 14/2/2016
English Premier League
2016/2/14
Aston Villa 0 : 6 Liverpool Week # 26
DetailsThursday 18/2/2016
UEFA Europa League
2016/2/18
FC Augsburg - Germany 0 : 0 Liverpool - England Round of 32
DetailsThursday 25/2/2016
UEFA Europa League
2016/2/25
Liverpool - England 1 : 0 FC Augsburg - Germany Round of 32
DetailsSaturday 27/2/2016
English League Cup
2016/2/27
Liverpool 1 : 1
1 : 3
Manchester City Final
Penalty Kicks
DetailsWednesday 02/3/2016
English Premier League
2016/3/2
Liverpool 3 : 0 Manchester City Week # 28
DetailsSunday 06/3/2016
English Premier League
2016/3/6
Crystal Palace FC 1 : 2 Liverpool Week # 29
DetailsThursday 10/3/2016
UEFA Europa League
2016/3/10
Liverpool - England 2 : 0 Manchester United - England Round of 16
DetailsThursday 17/3/2016
UEFA Europa League
2016/3/17
Manchester United - England 1 : 1 Liverpool - England Round of 16
DetailsSunday 20/3/2016
English Premier League
2016/3/20
FC Southampton 3 : 2 Liverpool Week # 31
DetailsSaturday 02/4/2016
English Premier League
2016/4/2
Liverpool 1 : 1 Tottenham Hotspur Week # 32
DetailsThursday 07/4/2016
UEFA Europa League
2016/4/7
Borussia Dortmund - Germany 1 : 1 Liverpool - England Quarterfinals
DetailsSunday 10/4/2016
English Premier League
2016/4/10
Liverpool 4 : 1 Stoke City FC Week # 33
DetailsThursday 14/4/2016
UEFA Europa League
2016/4/14
Liverpool - England 4 : 3 Borussia Dortmund - Germany Quarterfinals
DetailsSunday 17/4/2016
English Premier League
2016/4/17
AFC Bournemouth 1 : 2 Liverpool Week # 34
DetailsWednesday 20/4/2016
English Premier League
2016/4/20
Liverpool 4 : 0 Everton FC Week # 27
DetailsSaturday 23/4/2016
English Premier League
2016/4/23
Liverpool 2 : 2 Newcastle United FC Week # 35
DetailsThursday 28/4/2016
UEFA Europa League
2016/4/28
Villarreal CF - Spain 1 : 0 Liverpool - England Semifinals
DetailsSunday 01/5/2016
English Premier League
2016/5/1
Swansea City 3 : 1 Liverpool Week # 36
DetailsThursday 05/5/2016
UEFA Europa League
2016/5/5
Liverpool - England 3 : 0 Villarreal CF - Spain Semifinals
DetailsSunday 08/5/2016
English Premier League
2016/5/8
Liverpool 2 : 0 Watford Week # 37
DetailsWednesday 11/5/2016
English Premier League
2016/5/11
Liverpool 1 : 1 Chelsea Week # 30
DetailsSunday 15/5/2016
English Premier League
2016/5/15
West Bromwich Albion FC 1 : 1 Liverpool Week # 38
DetailsWednesday 18/5/2016
UEFA Europa League
2016/5/18
Liverpool - England 1 : 3 Sevilla FC - Spain Final
DetailsFriday 08/7/2016
Liverpool Pre-Season
2016/7/8
Tranmere Rovers FC - England 0 : 1 Liverpool - England DetailsWednesday 13/7/2016
Liverpool Pre-Season
2016/7/13
Fleetwood Town - England 0 : 5 Liverpool - England DetailsSunday 17/7/2016
Liverpool Pre-Season
2016/7/17
Wigan Athletic - England 0 : 2 Liverpool - England DetailsWednesday 20/7/2016
Liverpool Pre-Season
2016/7/20
Huddersfield Town - England 0 : 2 Liverpool - England DetailsThursday 28/7/2016
International Champions Cup
2016/7/28
Chelsea - England 1 : 0 Liverpool - England United States and Europe
DetailsSunday 31/7/2016
International Champions Cup
2016/7/31
Liverpool - England 2 : 0 AC Milan - Italy United States and Europe
DetailsTuesday 02/8/2016
Liverpool Pre-Season
2016/8/2
Liverpool - England 1 : 2 AS Roma - Italy DetailsSaturday 06/8/2016
International Champions Cup
2016/8/6
Liverpool - England 4 : 0 FC Barcelona - Spain United States and Europe
DetailsSunday 07/8/2016
Liverpool Pre-Season
2016/8/7
FSV Mainz 05 - Germany 4 : 0 Liverpool - England DetailsSunday 14/8/2016
English Premier League
2016/8/14
Arsenal FC 3 : 4 Liverpool Week # 1
DetailsSaturday 20/8/2016
English Premier League
2016/8/20
Burnley FC 2 : 0 Liverpool Week # 28
DetailsTuesday 23/8/2016
English League Cup
2016/8/23
Burton Albion 0 : 5 Liverpool Round 2
DetailsSaturday 27/8/2016
English Premier League
2016/8/27
Tottenham Hotspur 1 : 1 Liverpool Week # 3
DetailsSaturday 10/9/2016
English Premier League
2016/9/10
Liverpool 4 : 1 Leicester City Week # 4
DetailsFriday 16/9/2016
English Premier League
2016/9/16
Chelsea 1 : 2 Liverpool Week # 5
DetailsTuesday 20/9/2016
English League Cup
2016/9/20
Derby County FC 0 : 3 Liverpool Round 3
DetailsSaturday 24/9/2016
English Premier League
2016/9/24
Liverpool 5 : 1 Hull City Week # 6
DetailsSaturday 01/10/2016
English Premier League
2016/10/1
Swansea City 1 : 2 Liverpool Week # 7
DetailsMonday 17/10/2016
English Premier League
2016/10/17
Liverpool 0 : 0 Manchester United Week # 8
DetailsSaturday 22/10/2016
English Premier League
2016/10/22
Liverpool 2 : 1 West Bromwich Albion FC Week # 9
DetailsTuesday 25/10/2016
English League Cup
2016/10/25
Liverpool 2 : 1 Tottenham Hotspur Round of 16
DetailsSaturday 29/10/2016
English Premier League
2016/10/29
Crystal Palace FC 2 : 4 Liverpool Week # 10
DetailsSunday 06/11/2016
English Premier League
2016/11/6
Liverpool 6 : 1 Watford Week # 11
DetailsSaturday 19/11/2016
English Premier League
2016/11/19
FC Southampton 0 : 0 Liverpool Week # 12
DetailsSaturday 26/11/2016
English Premier League
2016/11/26
Liverpool 2 : 0 AFC Sunderland Week # 13
DetailsTuesday 29/11/2016
English League Cup
2016/11/29
Liverpool 2 : 0 Leeds United FC Quarterfinals
DetailsSunday 04/12/2016
English Premier League
2016/12/4
AFC Bournemouth 4 : 3 Liverpool Week # 14
DetailsSunday 11/12/2016
English Premier League
2016/12/11
Liverpool 2 : 2 West Ham United Week # 15
DetailsWednesday 14/12/2016
English Premier League
2016/12/14
Middlesbrough 0 : 3 Liverpool Week # 16
DetailsMonday 19/12/2016
English Premier League
2016/12/19
Everton FC 0 : 1 Liverpool Week # 17
DetailsTuesday 27/12/2016
English Premier League
2016/12/27
Liverpool 4 : 1 Stoke City FC Week # 18
DetailsSaturday 31/12/2016
English Premier League
2016/12/31
Liverpool 1 : 0 Manchester City Week # 19
DetailsMonday 02/1/2017
English Premier League
2017/1/2
AFC Sunderland 2 : 2 Liverpool Week # 20
DetailsSunday 08/1/2017
England FA Cup
2017/1/8
Liverpool 0 : 0 Plymouth Argyle FC Round of 64
DetailsWednesday 11/1/2017
English League Cup
2017/1/11
FC Southampton 1 : 0 Liverpool Semifinals
DetailsSunday 15/1/2017
English Premier League
2017/1/15
Manchester United 1 : 1 Liverpool Week # 21
DetailsWednesday 18/1/2017
England FA Cup
2017/1/18
Plymouth Argyle FC 0 : 1 Liverpool Round of 64
DetailsSaturday 21/1/2017
English Premier League
2017/1/21
Liverpool 2 : 3 Swansea City Week # 22
DetailsWednesday 25/1/2017
English League Cup
2017/1/25
Liverpool 0 : 1 FC Southampton Semifinals
DetailsSaturday 28/1/2017
England FA Cup
2017/1/28
Liverpool 1 : 2 Wolverhampton Wanderers FC Round of 32
DetailsTuesday 31/1/2017
English Premier League
2017/1/31
Liverpool 1 : 1 Chelsea Week # 23
DetailsSaturday 04/2/2017
English Premier League
2017/2/4
Hull City 2 : 0 Liverpool Week # 24
DetailsSaturday 11/2/2017
English Premier League
2017/2/11
Liverpool 2 : 0 Tottenham Hotspur Week # 25
DetailsMonday 27/2/2017
English Premier League
2017/2/27
Leicester City 3 : 1 Liverpool Week # 26
DetailsSaturday 04/3/2017
English Premier League
2017/3/4
Liverpool 3 : 1 Arsenal FC Week # 27
DetailsSunday 12/3/2017
English Premier League
2017/3/12
Liverpool 2 : 1 Burnley FC Week # 2
DetailsSunday 19/3/2017
English Premier League
2017/3/19
Manchester City 1 : 1 Liverpool Week # 29
DetailsSaturday 01/4/2017
English Premier League
2017/4/1
Liverpool 3 : 1 Everton FC Week # 30
DetailsWednesday 05/4/2017
English Premier League
2017/4/5
Liverpool 2 : 2 AFC Bournemouth Week # 31
DetailsSaturday 08/4/2017
English Premier League
2017/4/8
Stoke City FC 1 : 2 Liverpool Week # 32
DetailsSunday 16/4/2017
English Premier League
2017/4/16
West Bromwich Albion FC 0 : 1 Liverpool Week # 33
DetailsSunday 23/4/2017
English Premier League
2017/4/23
Liverpool 1 : 2 Crystal Palace FC Week # 34
DetailsMonday 01/5/2017
English Premier League
2017/5/1
Watford 0 : 1 Liverpool Week # 35
DetailsSunday 07/5/2017
English Premier League
2017/5/7
Liverpool 0 : 0 FC Southampton Week # 36
DetailsSunday 14/5/2017
English Premier League
2017/5/14
West Ham United 0 : 4 Liverpool Week # 37
DetailsSunday 21/5/2017
English Premier League
2017/5/21
Liverpool 3 : 0 Middlesbrough Week # 38
DetailsWednesday 24/5/2017
Liverpool Pre-Season
2017/5/24
Sydney FC - Australia 0 : 3 Liverpool - England DetailsWednesday 12/7/2017
Liverpool Pre-Season
2017/7/12
Tranmere Rovers FC - England 0 : 4 Liverpool - England DetailsFriday 14/7/2017
Liverpool Pre-Season
2017/7/14
Wigan Athletic - England 3 : 0 Liverpool - England DetailsWednesday 19/7/2017
Premier League Asia Trophy
2017/7/19
Liverpool - England 1 : 3 Crystal Palace FC - England DetailsSaturday 22/7/2017
Premier League Asia Trophy
2017/7/22
Leicester City - England 1 : 2 Liverpool - England Final
DetailsSaturday 29/7/2017
Liverpool Pre-Season
2017/7/29
Hertha Berlin - Germany 0 : 3 Liverpool - England DetailsTuesday 01/8/2017
Audi Cup
2017/8/1
FC Bayern Munich - Germany 0 : 3 Liverpool - England DetailsWednesday 02/8/2017
Audi Cup
2017/8/2
Atletico de Madrid - Spain 1 : 1
5 : 4
Liverpool - England Final
Penalty Kicks
DetailsSaturday 05/8/2017
Liverpool Pre-Season
2017/8/5
Liverpool - England 3 : 1 Athletic de Bilbao - Spain DetailsSaturday 12/8/2017
English Premier League
2017/8/12
Watford 3 : 3 Liverpool Week # 1
DetailsTuesday 15/8/2017
UEFA Champions League
2017/8/15
TSG 1899 Hoffenheim - Germany 1 : 2 Liverpool - England Play-off round
DetailsSaturday 19/8/2017
English Premier League
2017/8/19
Liverpool 1 : 0 Crystal Palace FC Week # 2
DetailsWednesday 23/8/2017
UEFA Champions League
2017/8/23
Liverpool - England 4 : 2 TSG 1899 Hoffenheim - Germany Play-off round
DetailsSunday 27/8/2017
English Premier League
2017/8/27
Liverpool 4 : 0 Arsenal FC Week # 3
DetailsSaturday 09/9/2017
English Premier League
2017/9/9
Manchester City 5 : 0 Liverpool Week # 4
DetailsWednesday 13/9/2017
UEFA Champions League
2017/9/13
Liverpool - England 2 : 2 Sevilla FC - Spain Group Stage
Round # 1
DetailsSaturday 16/9/2017
English Premier League
2017/9/16
Liverpool 1 : 1 Burnley FC Week # 5
DetailsTuesday 19/9/2017
English League Cup
2017/9/19
Leicester City 2 : 0 Liverpool Round 3
DetailsSaturday 23/9/2017
English Premier League
2017/9/23
Leicester City 2 : 3 Liverpool Week # 6
DetailsTuesday 26/9/2017
UEFA Champions League
2017/9/26
Spartak Moscow - Russia 1 : 1 Liverpool - England Group Stage
Round # 2
DetailsSunday 01/10/2017
English Premier League
2017/10/1
Newcastle United FC 1 : 1 Liverpool Week # 7
DetailsSaturday 14/10/2017
English Premier League
2017/10/14
Liverpool 0 : 0 Manchester United Week # 8
DetailsTuesday 17/10/2017
UEFA Champions League
2017/10/17
NK Maribor - Slovenia 0 : 7 Liverpool - England Group Stage
Round # 3
DetailsSunday 22/10/2017
English Premier League
2017/10/22
Tottenham Hotspur 4 : 1 Liverpool Week # 9
DetailsSaturday 28/10/2017
English Premier League
2017/10/28
Liverpool 3 : 0 Huddersfield Town Week # 10
DetailsWednesday 01/11/2017
UEFA Champions League
2017/11/1
Liverpool - England 3 : 0 NK Maribor - Slovenia Group Stage
Round # 4
DetailsSaturday 04/11/2017
English Premier League
2017/11/4
West Ham United 1 : 4 Liverpool Week # 11
DetailsSaturday 18/11/2017
English Premier League
2017/11/18
Liverpool 3 : 0 FC Southampton Week # 12
DetailsTuesday 21/11/2017
UEFA Champions League
2017/11/21
Sevilla FC - Spain 3 : 3 Liverpool - England Group Stage
Round # 5
DetailsSaturday 25/11/2017
English Premier League
2017/11/25
Liverpool 1 : 1 Chelsea Week # 13
DetailsWednesday 29/11/2017
English Premier League
2017/11/29
Stoke City FC 0 : 3 Liverpool Week # 14
DetailsSaturday 02/12/2017
English Premier League
2017/12/2
Brighton & Hove Albion 1 : 5 Liverpool Week # 15
DetailsWednesday 06/12/2017
UEFA Champions League
2017/12/6
Liverpool - England 7 : 0 Spartak Moscow - Russia Group Stage
Round # 6
DetailsSunday 10/12/2017
English Premier League
2017/12/10
Liverpool 1 : 1 Everton FC Week # 16
DetailsWednesday 13/12/2017
English Premier League
2017/12/13
Liverpool 0 : 0 West Bromwich Albion FC Week # 17
DetailsSunday 17/12/2017
English Premier League
2017/12/17
AFC Bournemouth 0 : 4 Liverpool Week # 18
DetailsFriday 22/12/2017
English Premier League
2017/12/22
Arsenal FC 3 : 3 Liverpool Week # 19
DetailsTuesday 26/12/2017
English Premier League
2017/12/26
Liverpool 5 : 0 Swansea City Week # 20
DetailsSaturday 30/12/2017
English Premier League
2017/12/30
Liverpool 2 : 1 Leicester City Week # 21
DetailsMonday 01/1/2018
English Premier League
2018/1/1
Burnley FC 1 : 2 Liverpool Week # 22
DetailsFriday 05/1/2018
England FA Cup
2018/1/5
Liverpool 2 : 1 Everton FC Round of 64
DetailsSunday 14/1/2018
English Premier League
2018/1/14
Liverpool 4 : 3 Manchester City Week # 23
DetailsMonday 22/1/2018
English Premier League
2018/1/22
Swansea City 1 : 0 Liverpool Week # 24
DetailsSaturday 27/1/2018
England FA Cup
2018/1/27
Liverpool 2 : 3 West Bromwich Albion FC Round of 32
DetailsTuesday 30/1/2018
English Premier League
2018/1/30
Huddersfield Town 0 : 3 Liverpool Week # 25
DetailsSunday 04/2/2018
English Premier League
2018/2/4
Liverpool 2 : 2 Tottenham Hotspur Week # 26
DetailsSunday 11/2/2018
English Premier League
2018/2/11
FC Southampton 0 : 2 Liverpool Week # 27
DetailsWednesday 14/2/2018
UEFA Champions League
2018/2/14
FC Porto - Portugal 0 : 5 Liverpool - England Round of 16
DetailsSaturday 24/2/2018
English Premier League
2018/2/24
Liverpool 4 : 1 West Ham United Week # 28
DetailsSaturday 03/3/2018
English Premier League
2018/3/3
Liverpool 2 : 0 Newcastle United FC Week # 29
DetailsTuesday 06/3/2018
UEFA Champions League
2018/3/6
Liverpool - England 0 : 0 FC Porto - Portugal Round of 16
DetailsSaturday 10/3/2018
English Premier League
2018/3/10
Manchester United 2 : 1 Liverpool Week # 30
DetailsSaturday 17/3/2018
English Premier League
2018/3/17
Liverpool 5 : 0 Watford Week # 31
DetailsSaturday 31/3/2018
English Premier League
2018/3/31
Crystal Palace FC 1 : 2 Liverpool Week # 32
DetailsWednesday 04/4/2018
UEFA Champions League
2018/4/4
Liverpool - England 3 : 0 Manchester City - England Quarter-final
DetailsSaturday 07/4/2018
English Premier League
2018/4/7
Everton FC 0 : 0 Liverpool Week # 33
DetailsTuesday 10/4/2018
UEFA Champions League
2018/4/10
Manchester City - England 1 : 2 Liverpool - England Quarter-final
DetailsSaturday 14/4/2018
English Premier League
2018/4/14
Liverpool 3 : 0 AFC Bournemouth Week # 34
DetailsSaturday 21/4/2018
English Premier League
2018/4/21
West Bromwich Albion FC 2 : 2 Liverpool Week # 35
DetailsTuesday 24/4/2018
UEFA Champions League
2018/4/24
Liverpool - England 5 : 2 AS Roma - Italy Semi-final
DetailsSaturday 28/4/2018
English Premier League
2018/4/28
Liverpool 0 : 0 Stoke City FC Week # 36
DetailsWednesday 02/5/2018
UEFA Champions League
2018/5/2
AS Roma - Italy 4 : 2 Liverpool - England Semi-final
DetailsSunday 06/5/2018
English Premier League
2018/5/6
Chelsea 1 : 0 Liverpool Week # 37
DetailsSunday 13/5/2018
English Premier League
2018/5/13
Liverpool 4 : 0 Brighton & Hove Albion Week # 38
DetailsSaturday 26/5/2018
UEFA Champions League
2018/5/26
Real Madrid CF - Spain 3 : 1 Liverpool - England Final
DetailsSaturday 07/7/2018
Liverpool Pre-Season
2018/7/7
Chester City fc - England 0 : 7 Liverpool - England DetailsTuesday 10/7/2018
Liverpool Pre-Season
2018/7/10
Tranmere Rovers FC - England 2 : 3 Liverpool - England DetailsSaturday 14/7/2018
Liverpool Pre-Season
2018/7/14
Bury F.C - England 0 : 0 Liverpool - England DetailsThursday 19/7/2018
Liverpool Pre-Season
2018/7/19
Blackburn Rovers FC - England 0 : 2 Liverpool - England DetailsSunday 22/7/2018
International Champions Cup
2018/7/22
Liverpool - England 1 : 3 Borussia Dortmund - Germany DetailsThursday 26/7/2018
International Champions Cup
2018/7/26
Manchester City - England 1 : 2 Liverpool - England DetailsSaturday 28/7/2018
International Champions Cup
2018/7/28
Manchester United - England 1 : 4 Liverpool - England DetailsSaturday 04/8/2018
Liverpool Pre-Season
2018/8/4
Liverpool - England 5 : 0 SSC Napoli - Italy DetailsTuesday 07/8/2018
Liverpool Pre-Season
2018/8/7
Liverpool - England 3 : 1 Torino FC - Italy DetailsSunday 12/8/2018
English Premier League
2018/8/12
Liverpool 4 : 0 West Ham United Week # 1
DetailsMonday 20/8/2018
English Premier League
2018/8/20
Crystal Palace FC 0 : 2 Liverpool Week # 2
DetailsSaturday 25/8/2018
English Premier League
2018/8/25
Liverpool 1 : 0 Brighton & Hove Albion Week # 3
DetailsSaturday 01/9/2018
English Premier League
2018/9/1
Leicester City 1 : 2 Liverpool Week # 4
DetailsSaturday 15/9/2018
English Premier League
2018/9/15
Tottenham Hotspur 1 : 2 Liverpool Week # 5
DetailsTuesday 18/9/2018
UEFA Champions League
2018/9/18
Liverpool - England 3 : 2 Paris Saint-Germain - France Group Stage
Round # 1
DetailsSaturday 22/9/2018
English Premier League
2018/9/22
Liverpool 3 : 0 FC Southampton Week # 6
DetailsWednesday 26/9/2018
English League Cup
2018/9/26
Liverpool 1 : 2 Chelsea Round 3
DetailsSaturday 29/9/2018
English Premier League
2018/9/29
Chelsea 1 : 1 Liverpool Week # 7
DetailsWednesday 03/10/2018
UEFA Champions League
2018/10/3
SSC Napoli - Italy 1 : 0 Liverpool - England Group Stage
Round # 2
DetailsSunday 07/10/2018
English Premier League
2018/10/7
Liverpool 0 : 0 Manchester City Week # 8
DetailsSaturday 20/10/2018
English Premier League
2018/10/20
Huddersfield Town 0 : 1 Liverpool Week # 9
DetailsWednesday 24/10/2018
UEFA Champions League
2018/10/24
Liverpool - England 4 : 0 Crvena Zvezda - Serbia Group Stage
Round # 3
DetailsSaturday 27/10/2018
English Premier League
2018/10/27
Liverpool 4 : 1 Cardiff City Week # 10
DetailsSaturday 03/11/2018
English Premier League
2018/11/3
Arsenal FC 1 : 1 Liverpool Week # 11
DetailsTuesday 06/11/2018
UEFA Champions League
2018/11/6
Crvena Zvezda - Serbia 2 : 0 Liverpool - England Group Stage
Round # 4
DetailsSunday 11/11/2018
English Premier League
2018/11/11
Liverpool 2 : 0 Fulham FC Week # 12
DetailsSaturday 24/11/2018
English Premier League
2018/11/24
Watford 0 : 3 Liverpool Week # 13
DetailsWednesday 28/11/2018
UEFA Champions League
2018/11/28
Paris Saint-Germain - France 2 : 1 Liverpool - England Group Stage
Round # 5
DetailsSunday 02/12/2018
English Premier League
2018/12/2
Liverpool 1 : 0 Everton FC Week # 14
DetailsWednesday 05/12/2018
English Premier League
2018/12/5
Burnley FC 1 : 3 Liverpool Week # 15
DetailsSaturday 08/12/2018
English Premier League
2018/12/8
AFC Bournemouth 0 : 4 Liverpool Week # 16
DetailsTuesday 11/12/2018
UEFA Champions League
2018/12/11
Liverpool - England 1 : 0 SSC Napoli - Italy Group Stage
Round # 6
DetailsSunday 16/12/2018
English Premier League
2018/12/16
Liverpool 3 : 1 Manchester United Week # 17
DetailsFriday 21/12/2018
English Premier League
2018/12/21
Wolverhampton Wanderers FC 0 : 2 Liverpool Week # 18
DetailsWednesday 26/12/2018
English Premier League
2018/12/26
Liverpool 4 : 0 Newcastle United FC Week # 19
DetailsSaturday 29/12/2018
English Premier League
2018/12/29
Liverpool 5 : 1 Arsenal FC Week # 20
DetailsThursday 03/1/2019
English Premier League
2019/1/3
Manchester City 2 : 1 Liverpool Week # 21
DetailsMonday 07/1/2019
England FA Cup
2019/1/7
Wolverhampton Wanderers FC 2 : 1 Liverpool Round 3
DetailsSaturday 12/1/2019
English Premier League
2019/1/12
Brighton & Hove Albion 0 : 1 Liverpool Week # 22
DetailsSaturday 19/1/2019
English Premier League
2019/1/19
Liverpool 4 : 3 Crystal Palace FC Week # 23
DetailsWednesday 30/1/2019
English Premier League
2019/1/30
Liverpool 1 : 1 Leicester City Week # 24
DetailsMonday 04/2/2019
English Premier League
2019/2/4
West Ham United 1 : 1 Liverpool Week # 25
DetailsSaturday 09/2/2019
English Premier League
2019/2/9
Liverpool 3 : 0 AFC Bournemouth Week # 26
DetailsTuesday 19/2/2019
UEFA Champions League
2019/2/19
Liverpool - England 0 : 0 FC Bayern Munich - Germany Round of 16
DetailsSunday 24/2/2019
English Premier League
2019/2/24
Manchester United 0 : 0 Liverpool Week # 27
DetailsWednesday 27/2/2019
English Premier League
2019/2/27
Liverpool 5 : 0 Watford Week # 28
DetailsSunday 03/3/2019
English Premier League
2019/3/3
Everton FC 0 : 0 Liverpool Week # 29
DetailsSunday 10/3/2019
English Premier League
2019/3/10
Liverpool 4 : 2 Burnley FC Week # 30
DetailsWednesday 13/3/2019
UEFA Champions League
2019/3/13
FC Bayern Munich - Germany 1 : 3 Liverpool - England Round of 16
DetailsSunday 17/3/2019
English Premier League
2019/3/17
Fulham FC 1 : 2 Liverpool Week # 31
DetailsSunday 31/3/2019
English Premier League
2019/3/31
Liverpool 2 : 1 Tottenham Hotspur Week # 32
DetailsFriday 05/4/2019
English Premier League
2019/4/5
FC Southampton 1 : 3 Liverpool Week # 33
DetailsTuesday 09/4/2019
UEFA Champions League
2019/4/9
Liverpool - England 2 : 0 FC Porto - Portugal Quarterfinals
DetailsSunday 14/4/2019
English Premier League
2019/4/14
Liverpool 2 : 0 Chelsea Week # 34
DetailsWednesday 17/4/2019
UEFA Champions League
2019/4/17
FC Porto - Portugal 1 : 4 Liverpool - England Quarterfinals
DetailsSunday 21/4/2019
English Premier League
2019/4/21
Cardiff City 0 : 2 Liverpool Week # 35
DetailsFriday 26/4/2019
English Premier League
2019/4/26
Liverpool 5 : 0 Huddersfield Town Week # 36
DetailsWednesday 01/5/2019
UEFA Champions League
2019/5/1
FC Barcelona - Spain 3 : 0 Liverpool - England Semifinals
DetailsSaturday 04/5/2019
English Premier League
2019/5/4
Newcastle United FC 2 : 3 Liverpool Week # 37
DetailsTuesday 07/5/2019
UEFA Champions League
2019/5/7
Liverpool - England 4 : 0 FC Barcelona - Spain Semifinals
DetailsSunday 12/5/2019
English Premier League
2019/5/12
Liverpool 2 : 0 Wolverhampton Wanderers FC Week # 38
DetailsSaturday 01/6/2019
UEFA Champions League
2019/6/1
Tottenham Hotspur - England 0 : 2 Liverpool - England Final
DetailsThursday 11/7/2019
Liverpool Pre-Season
2019/7/11
Tranmere Rovers FC - England 0 : 6 Liverpool - England DetailsSunday 14/7/2019
Liverpool Pre-Season
2019/7/14
Bradford City FC - England 1 : 3 Liverpool - England DetailsSaturday 20/7/2019
Liverpool Pre-Season
2019/7/20
Borussia Dortmund - Germany 3 : 2 Liverpool - England DetailsSunday 21/7/2019
Liverpool Pre-Season
2019/7/22
Sevilla FC - Spain 2 : 1 Liverpool - England DetailsThursday 25/7/2019
Liverpool Pre-Season
2019/7/25
Sporting CP - Portugal 2 : 2 Liverpool - England DetailsSunday 28/7/2019
Liverpool Pre-Season
2019/7/28
Liverpool - England 0 : 3 SSC Napoli - Italy DetailsWednesday 31/7/2019
Liverpool Pre-Season
2019/7/31
Liverpool - England 3 : 1 Olympique Lyonnais - France DetailsSunday 04/8/2019
FA Community Shield
2019/8/4
Liverpool 1 : 1
4 : 5
Manchester City Penalty Kicks
DetailsTuesday 06/8/2019
Liverpool Pre-Season
2019/8/6
Liverpool - England -- : -- FC Schalke 04 - Germany Cancelled
DetailsFriday 09/8/2019
English Premier League
2019/8/9
Liverpool 4 : 1 Norwich City Week # 1
DetailsWednesday 14/8/2019
UEFA Super Cup
2019/8/14
Liverpool - England 2 : 2
5 : 4
Chelsea - England Penalty Kicks
DetailsSaturday 17/8/2019
English Premier League
2019/8/17
FC Southampton 1 : 2 Liverpool Week # 2
DetailsSaturday 24/8/2019
English Premier League
2019/8/24
Liverpool 3 : 1 Arsenal FC Week # 3
DetailsSaturday 31/8/2019
English Premier League
2019/8/31
Burnley FC 0 : 3 Liverpool Week # 4
DetailsSaturday 14/9/2019
English Premier League
2019/9/14
Liverpool 3 : 1 Newcastle United FC Week # 5
DetailsTuesday 17/9/2019
UEFA Champions League
2019/9/17
SSC Napoli - Italy 2 : 0 Liverpool - England Group Stage
Round # 1
DetailsSunday 22/9/2019
English Premier League
2019/9/22
Chelsea 1 : 2 Liverpool Week # 6
DetailsWednesday 25/9/2019
English League Cup
2019/9/25
Milton Keynes Dons FC 0 : 2 Liverpool Round 3
DetailsSaturday 28/9/2019
English Premier League
2019/9/28
Sheffield United FC 0 : 1 Liverpool Week # 7
DetailsWednesday 02/10/2019
UEFA Champions League
2019/10/2
Liverpool - England 4 : 3 Red Bull Salzburg - Austria Group Stage
Round # 2
DetailsSaturday 05/10/2019
English Premier League
2019/10/5
Liverpool 2 : 1 Leicester City Week # 8
DetailsSunday 20/10/2019
English Premier League
2019/10/20
Manchester United 1 : 1 Liverpool Week # 9
DetailsWednesday 23/10/2019
UEFA Champions League
2019/10/23
KRC Genk - Belgium 1 : 4 Liverpool - England Group Stage
Round # 3
DetailsSunday 27/10/2019
English Premier League
2019/10/27
Liverpool 2 : 1 Tottenham Hotspur Week # 10
DetailsWednesday 30/10/2019
English League Cup
2019/10/30
Liverpool 5 : 5
5 : 4
Arsenal FC Round of 16
Penalty Kicks
DetailsSaturday 02/11/2019
English Premier League
2019/11/2
Aston Villa 1 : 2 Liverpool Week # 11
DetailsTuesday 05/11/2019
UEFA Champions League
2019/11/5
Liverpool - England 2 : 1 KRC Genk - Belgium Group Stage
Round # 4
DetailsSunday 10/11/2019
English Premier League
2019/11/10
Liverpool 3 : 1 Manchester City Week # 12
DetailsSaturday 23/11/2019
English Premier League
2019/11/23
Crystal Palace FC 1 : 2 Liverpool Week # 13
DetailsWednesday 27/11/2019
UEFA Champions League
2019/11/27
Liverpool - England 1 : 1 SSC Napoli - Italy Group Stage
Round # 5
DetailsSaturday 30/11/2019
English Premier League
2019/11/30
Liverpool 2 : 1 Brighton & Hove Albion Week # 14
DetailsWednesday 04/12/2019
English Premier League
2019/12/4
Liverpool 5 : 2 Everton FC Week # 15
DetailsSaturday 07/12/2019
English Premier League
2019/12/7
AFC Bournemouth 0 : 3 Liverpool Week # 16
DetailsTuesday 10/12/2019
UEFA Champions League
2019/12/10
Red Bull Salzburg - Austria 0 : 2 Liverpool - England Group Stage
Round # 6
DetailsSaturday 14/12/2019
English Premier League
2019/12/14
Liverpool 2 : 0 Watford Week # 17
DetailsTuesday 17/12/2019
English League Cup
2019/12/17
Aston Villa 5 : 0 Liverpool Quarterfinals
DetailsWednesday 18/12/2019
FIFA Club World Championship
2019/12/18
Monterrey - Mexico 1 : 2 Liverpool - England Semifinals
DetailsSaturday 21/12/2019
FIFA Club World Championship
2019/12/21
Liverpool - England 1 : 0 Flamengo - Brazil Final
After extra time
DetailsThursday 26/12/2019
English Premier League
2019/12/26
Leicester City 0 : 4 Liverpool Week # 19
DetailsSunday 29/12/2019
English Premier League
2019/12/29
Liverpool 1 : 0 Wolverhampton Wanderers FC Week # 20
DetailsThursday 02/1/2020
English Premier League
1/2
Liverpool 2 : 0 Sheffield United FC Week # 21
DetailsSunday 05/1/2020
England FA Cup
1/5
Liverpool 1 : 0 Everton FC Round 3
DetailsSaturday 11/1/2020
English Premier League
1/11
Tottenham Hotspur 0 : 1 Liverpool Week # 22
DetailsSunday 19/1/2020
English Premier League
1/19
Liverpool 2 : 0 Manchester United Week # 23
DetailsThursday 23/1/2020
English Premier League
1/23
Wolverhampton Wanderers FC 1 : 2 Liverpool Week # 24
DetailsSunday 26/1/2020
England FA Cup
1/26
Shrewsbury Town FC 2 : 2 Liverpool Round 4
DetailsWednesday 29/1/2020
English Premier League
1/29
West Ham United 0 : 2 Liverpool Week # 18
DetailsSaturday 01/2/2020
English Premier League
2/1
Liverpool 4 : 0 FC Southampton Week # 25
DetailsTuesday 04/2/2020
England FA Cup
2/4
Liverpool 1 : 0 Shrewsbury Town FC Round 4
DetailsSaturday 15/2/2020
English Premier League
2/15
Norwich City 0 : 1 Liverpool Week # 26
DetailsTuesday 18/2/2020
UEFA Champions League
2/18
Atletico de Madrid - Spain 1 : 0 Liverpool - England Round of 16
DetailsMonday 24/2/2020
English Premier League
2/24
Liverpool 3 : 2 West Ham United Week # 27
DetailsSaturday 29/2/2020
English Premier League
2/29
Watford 3 : 0 Liverpool Week # 28
DetailsTuesday 03/3/2020
England FA Cup
3/3
Chelsea 2 : 0 Liverpool Round 5
DetailsSaturday 07/3/2020
English Premier League
3/7
Liverpool 2 : 1 AFC Bournemouth Week # 29
DetailsWednesday 11/3/2020
UEFA Champions League
3/11
Liverpool - England 2 : 3 Atletico de Madrid - Spain Round of 16
DetailsSunday 21/6/2020
English Premier League
6/21
Everton FC 0 : 0 Liverpool Week # 30
DetailsWednesday 24/6/2020
English Premier League
6/24
Liverpool 4 : 0 Crystal Palace FC Week # 31
DetailsThursday 02/7/2020
English Premier League
7/2
Manchester City 4 : 0 Liverpool Week # 32
DetailsSunday 05/7/2020
English Premier League
7/5
Liverpool 2 : 0 Aston Villa Week # 33
DetailsWednesday 08/7/2020
English Premier League
7/8
Brighton & Hove Albion 1 : 3 Liverpool Week # 34
DetailsSaturday 11/7/2020
English Premier League
7/11
Liverpool 1 : 1 Burnley FC Week # 35
DetailsWednesday 15/7/2020
English Premier League
7/15
Arsenal FC 2 : 1 Liverpool Week # 36
DetailsWednesday 22/7/2020
English Premier League
7/22
Liverpool 5 : 3 Chelsea Week # 37
DetailsSunday 26/7/2020
English Premier League
7/26
Newcastle United FC 1 : 3 Liverpool Week # 38
DetailsSaturday 29/8/2020
FA Community Shield
8/29
Arsenal FC 1 : 1
5 : 4
Liverpool Penalty Kicks
Details